id	text
Psychology_423_r$Psychology_169_r$Psychology_244_p$Psychology_tweet_29_r	"<span id=""hover_text_news"" data-toggle=""tooltip"" data-html=""true"" data-placement=""bottom"" title=""Context: They found that when the weight of the cutlery confirms expectations (e.g. a plastic spoon is light), yoghurt seemed denser and more expensive. Color contrast is also an important factor: white yoghurt when eaten from a white spoon was rated sweeter, more liked, and more expensive than pink-colored yoghurt.""><b>Finding A:</b></span> a plastic spoon is light), yoghurt seemed denser and more expensive.<br><span id=""hover_text_news"" data-toggle=""tooltip"" data-html=""true"" data-placement=""bottom"" title=""Context: The findings suggest that music instruction helps enhance skills that are critical for academic success. The gains were seen during group music classes included in the schools\' curriculum, suggesting in-school training accelerates neurodevelopment. ""While music programs are often the first to be cut when the school budget is tight, these results highlight music\'s place in the high school curriculum,"" says Nina Kraus, senior study author and director of the Auditory Neuroscience Laboratory at Northwestern University.""><b>Finding B:</b></span> The findings suggest that music instruction helps enhance skills that are critical for academic success.<br><span id=""hover_text_paper"" data-toggle=""tooltip"" data-html=""true"" data-placement=""bottom"" title=""Context: In that study, ΔRecall nap predicted ΔRecall overnight , suggesting an interaction of multiple sleep bouts on memory processing. Notably, here too with emotional memories, we found a significant association between ΔRecall nap and ΔRecall overnight such that declines in accuracy across the nap were associated with improvements across overnight sleep (B = −0.488, p = 0.029; 95% CI: [−1.294, −0.079]; Fig. We did not receive caregiver reports for 9 of the children.""><b>Finding C:</b></span> Notably, here too with emotional memories, we found a significant association between ΔRecall nap and ΔRecall overnight such that declines in accuracy across the nap were associated with improvements across overnight sleep (B = −0.488, p = 0.029; 95% CI: [−1.294, −0.079]; Fig.<br><span id=""hover_text_news"" data-toggle=""tooltip"" data-html=""true"" data-placement=""bottom"" title=""Context: Really fascinating: A 20-yr cohort study of nearly 200,000 women shows that depression is associated with a 2-fold increase in the risk of developing lupus. All the more reasons to pay attention to #MentalHealth!  ""><b>Finding D:</b></span> Really fascinating: A 20-yr cohort study of nearly 200,000 women shows that depression is associated with a 2-fold increase in the risk of developing lupus. All the more reasons to pay attention to #MentalHealth!  "
Psychology_tweet_161_r$Psychology_408_p$Psychology_19_p$Psychology_434_p	"<span id=""hover_text_news"" data-toggle=""tooltip"" data-html=""true"" data-placement=""bottom"" title=""Context: Power of touch ✋️in relieving pain  ""><b>Finding A:</b></span> Power of touch ✋️in relieving pain  <br><span id=""hover_text_paper"" data-toggle=""tooltip"" data-html=""true"" data-placement=""bottom"" title=""Context: Prior to adjusting for age, the T2DM cumulative incidence percent and incidence rates were similar in patients with PTSD (252 [7.3%]) and without PTSD (141 [6.4%]; P = .19). After adjusting for age, the cumulative incidence of T2DM was significantly higher in those with PTSD vs those without (patients with PTSD: 6.6%; patients without PTSD: 4.7%; P = .002); the same pattern occurred with respect to incidence rate (patients with PTSD: 15.2 per 1000 person-years; patients without PTSD: 11.4 per 1000 person-years; P = .01). After adjusting for age in model 2, PTSD was associated with a 33% increased likelihood of incident T2DM (hazard ratio [HR], 1.33; 95% CI, 1.08-1.64; P = .01).""><b>Finding B:</b></span> After adjusting for age, the cumulative incidence of T2DM was significantly higher in those with PTSD vs those without (patients with PTSD: 6.6%; patients without PTSD: 4.7%; P = .002); the same pattern occurred with respect to incidence rate (patients with PTSD: 15.2 per 1000 person-years; patients without PTSD: 11.4 per 1000 person-years; P = .01).<br><span id=""hover_text_paper"" data-toggle=""tooltip"" data-html=""true"" data-placement=""bottom"" title=""Context: Results: With a total of 4986 ASD cases, our study showed that regardless of cultural background circumcised boys were more likely than intact boys to develop ASD before age 10 years (HR ¼ 1.46; 95% CI: 1.11-1.93). Risk was particularly high for infantile autism before age five years (HR ¼ 2.06; 95% CI: 1.36-3.13). Circumcised boys in non-Muslim families were also more likely to develop hyperkinetic disorder (HR ¼ 1.81; 95% CI: 1.11-2.96).""><b>Finding C:</b></span> Results: With a total of 4986 ASD cases, our study showed that regardless of cultural background circumcised boys were more likely than intact boys to develop ASD before age 10 years (HR ¼ 1.46; 95% CI: 1.11-1.93).<br><span id=""hover_text_paper"" data-toggle=""tooltip"" data-html=""true"" data-placement=""bottom"" title=""Context: found that individuals with ASD were more likely to report television and \'\'by making mistakes\'\' in their list of sexual knowledge sources, and less likely to report social sources. Most concerning is the potential that the combination of age appropriate sexual motivation and interest, limited sexual knowledge and experiences, and additional social deficits, may place adolescents and young adults with ASD at increased risk for sexual violence victimization. Children with autism in the education system were not at an increased risk for sexual abuse compared to peers with other disabilities.""><b>Finding D:</b></span> Most concerning is the potential that the combination of age appropriate sexual motivation and interest, limited sexual knowledge and experiences, and additional social deficits, may place adolescents and young adults with ASD at increased risk for sexual violence victimization."
Psychology_52_r$Psychology_tweet_3_p$Psychology_tweet_143_p$Psychology_26_r	"<span id=""hover_text_news"" data-toggle=""tooltip"" data-html=""true"" data-placement=""bottom"" title=""Context: An innovative brain imaging study has uncovered new evidence explaining why ToM deficiencies are present in ASD children. Published in Molecular Autism, the research reveals disruptions in the brain\'s circuitry involved in ToM at multiple levels compared to typical brain functioning. The findings provide valuable insight into understanding the functional makeup of a vital neural network that is critical for characterizing the social symptoms in individuals with ASD.""><b>Finding A:</b></span> Published in Molecular Autism, the research reveals disruptions in the brain\'s circuitry involved in ToM at multiple levels compared to typical brain functioning.<br><span id=""hover_text_paper"" data-toggle=""tooltip"" data-html=""true"" data-placement=""bottom"" title=""Context: However, maternal distress had a more negative impact on children who were aware of their origins. Conclusions: The absence of a gestational connection to the mother may be more problematic for children than the absence of a genetic link. When the mother\'s egg and father\'s sperm are used in IVF and the mother undergoes the pregnancy, the parents have both a genetic and gestational link to the child in the same way as parents of naturally conceived children.""><b>Finding B:</b></span> Conclusions: The absence of a gestational connection to the mother may be more problematic for children than the absence of a genetic link.<br><span id=""hover_text_paper"" data-toggle=""tooltip"" data-html=""true"" data-placement=""bottom"" title=""Context: Results: We found that full body illusions were experienced by patients with chronic pain and further, that pain intensity was reduced by an average of 37% after illusion (synchronous) conditions. Conclusion: These findings add support to theories that high-level multisensory body representations can interact with homeostatic regulation and pain perception. Significance: Pain intensity in chronic pain patients was reduced by 37% by \'out of body\' illusions.""><b>Finding C:</b></span> Conclusion: These findings add support to theories that high-level multisensory body representations can interact with homeostatic regulation and pain perception.<br><span id=""hover_text_news"" data-toggle=""tooltip"" data-html=""true"" data-placement=""bottom"" title=""Context: The analysis showed that these functional connectivities underlie the relation between depressive problems and sleep quality. The researchers conclude that increased functional connectivity among these brain regions provides a neural basis for how depression is related to poor sleep quality. ""This study may also have implications for a deeper understanding of depression,"" adds professor Edmund Rolls.""><b>Finding D:</b></span> The researchers conclude that increased functional connectivity among these brain regions provides a neural basis for how depression is related to poor sleep quality."
Psychology_169_p$Psychology_431_p$Psychology_tweet_120_p$Psychology_498_p	"<span id=""hover_text_paper"" data-toggle=""tooltip"" data-html=""true"" data-placement=""bottom"" title=""Context: Although phonological processing improved in both the music training and active control groups, the enhancement was greater in adolescents who underwent music training. Thus, music training initiated as late as adolescence can enhance neural processing of sound and confer benefits for language skills. These results establish the potential for experience-driven brain plasticity during adolescence and demonstrate that in-school programs can engender these changes.""><b>Finding A:</b></span> Thus, music training initiated as late as adolescence can enhance neural processing of sound and confer benefits for language skills.<br><span id=""hover_text_paper"" data-toggle=""tooltip"" data-html=""true"" data-placement=""bottom"" title=""Context: Our results nevertheless indicated that the endorsement of higher depressive symptoms and sleep disturbances yielded greatest risk for death by suicide. This demonstrates the importance of assessing disturbed sleep in the presence of other, well-established and robust risk factors for suicide. The present study contributes to the extant literature in several ways.""><b>Finding B:</b></span> This demonstrates the importance of assessing disturbed sleep in the presence of other, well-established and robust risk factors for suicide.<br><span id=""hover_text_paper"" data-toggle=""tooltip"" data-html=""true"" data-placement=""bottom"" title=""Context: The critical interaction term was significant for all three assessed outcomes (all ps < .05). Simple slope analyses indicated that high-SOI participants who had casual sex over the academic year had higher self-esteem (B ¼ 0.14, SE ¼ 0.06, p ¼ .025) and marginally lower depression (B ¼ À0.12, SE ¼ 0.07, p ¼ .091) and anxiety (B ¼ À0.11, SE ¼ 0.06, p ¼ .086) than high-SOI participants who did not have casual sex (Figure 3) . Among low-SOI participants, those who had casual sex did not differ significantly from those who did not have casual sex on self-esteem (B ¼ À0.10, SE ¼ 0.07, p ¼ .168), depression (B ¼ 0.13, SE ¼ 0.08, p ¼ .104), or anxiety (B ¼ 0.11, SE ¼ 0.07, p ¼ .130).""><b>Finding C:</b></span> Simple slope analyses indicated that high-SOI participants who had casual sex over the academic year had higher self-esteem (B ¼ 0.14, SE ¼ 0.06, p ¼ .025) and marginally lower depression (B ¼ À0.12, SE ¼ 0.07, p ¼ .091) and anxiety (B ¼ À0.11, SE ¼ 0.06, p ¼ .086) than high-SOI participants who did not have casual sex (Figure 3) .<br><span id=""hover_text_paper"" data-toggle=""tooltip"" data-html=""true"" data-placement=""bottom"" title=""Context: Specifically, independent regression analysis for each participant in the no-gum and chewing-gum groups provides an estimate for their gradients of vigilance decline across epochs. The proposition is supported if the gradient of decline for the no-gum group is significantly steeper than that for the chewing-gum group. The computed gradients of decline (see Figure 2) were compared via an independent samples t-test and, consistent with the proposition, the gradient of decline for the no-gum group exceeded that for the chewing-gum group, (t(38)=3.99, p< .001: regression means = -0.32 and -0.06, for the no-gum and chewing-gum group, respectively).""><b>Finding D:</b></span> The proposition is supported if the gradient of decline for the no-gum group is significantly steeper than that for the chewing-gum group."
Psychology_293_p$Psychology_tweet_73_p$Psychology_214_p$Psychology_441_r	"<span id=""hover_text_paper"" data-toggle=""tooltip"" data-html=""true"" data-placement=""bottom"" title=""Context: This provides evidence that the 39 functional connectivity links may account for this proportion of the relation of poor sleep quality on depressive problems. We found that all 39 links significantly mediated the relationship between the PSQI sleep quality and the depressive problem score (using FDR correction, p<0.05, Table S4 ). In the reverse direction, only 2 links significantly mediated effects of sleep quality on depressive problems with FDR correction.""><b>Finding A:</b></span> We found that all 39 links significantly mediated the relationship between the PSQI sleep quality and the depressive problem score (using FDR correction, p<0.05, Table S4 ).<br><span id=""hover_text_paper"" data-toggle=""tooltip"" data-html=""true"" data-placement=""bottom"" title=""Context: More African Americans endorsed experiencing corporal punishment ""always,"" relative to Hispanic participants, c 2 [1] = 3.96, P < .05, but this difference did not emerge between African American and white participants, c 2 [1] = 1.51, P = .22. A significant positive association emerged for the association between corporal punishment and physical perpetration of dating violence, with an OR of 1.30 (95% CI 1.07-1.59). In the multivariate analysis, controlling for sex, ethnicity, age, parental education, yearly alcohol use, as well as child physical abuse, corporal punishment remained a significant and robust predictor of perpetration of dating violence (aOR 1.29, 95% CI 1.02-1.62; Table III) .""><b>Finding B:</b></span> A significant positive association emerged for the association between corporal punishment and physical perpetration of dating violence, with an OR of 1.30 (95% CI 1.07-1.59).<br><span id=""hover_text_paper"" data-toggle=""tooltip"" data-html=""true"" data-placement=""bottom"" title=""Context: Conclusions. The findings extend previous research in showing that the eye-closure instruction can still be effective when witnesses are interviewed repeatedly, and that it can facilitate the elicitation of new information. Thus, the eye-closure instruction constitutes a simple and time-efficient interview tool for police interviewers.""><b>Finding C:</b></span> The findings extend previous research in showing that the eye-closure instruction can still be effective when witnesses are interviewed repeatedly, and that it can facilitate the elicitation of new information.<br><span id=""hover_text_news"" data-toggle=""tooltip"" data-html=""true"" data-placement=""bottom"" title=""Context: Interestingly, the study also showed that autonomy supportive approaches benefit employees irrespective of national culture--it is not just the way we like things to be in the West. But perhaps the most important aspect of the study was that it showed how autonomy support leads to positive outcomes in employees. The study suggests it helps employees satisfy three basic psychological needs--for autonomy, competence, and relatedness.""><b>Finding D:</b></span> But perhaps the most important aspect of the study was that it showed how autonomy support leads to positive outcomes in employees."
Psychology_49_p$Psychology_144_r$Psychology_tweet_154_r$Psychology_89_r	"<span id=""hover_text_paper"" data-toggle=""tooltip"" data-html=""true"" data-placement=""bottom"" title=""Context: Results: In Jilin City, 77 cases of autism were identified from a total population of 7258, equating to a prevalence of 108 per 10,000 (95% confidence interval (CI) 89, 130). In Shenzhen City: 21,420 children were screened and 35 cases of autism were identified, resulting in a mainstream prevalence of 42 per 10,000 (95% CI 20-89). In Jiamusi City, 16,358 children were screened, with 10 autism cases being identified, with a mainstream prevalence of 19 per 10,000 (95% CI 10-38).""><b>Finding A:</b></span> In Shenzhen City: 21,420 children were screened and 35 cases of autism were identified, resulting in a mainstream prevalence of 42 per 10,000 (95% CI 20-89).<br><span id=""hover_text_news"" data-toggle=""tooltip"" data-html=""true"" data-placement=""bottom"" title=""Context: Understanding how black gay and bisexual men are able to remain negative -- despite being constantly labeled ""high risk"" for or ""vulnerable"" to HIV by public health researchers and health care providers alike -- might provide us a roadmap for how to achieve better health outcomes and ultimately end the AIDS epidemic. It found that many participants attributed their ability to stay HIV negative to a strong sense of religious and spiritual identity, social support from friends and family, and social engagement with other HIV-negative black MSM in safe spaces. The study noted the need to provide safe social spaces for black gay and bisexual men to engage around HIV prevention and the need to incorporate HIV prevention messages into religious/spiritual contexts.""><b>Finding B:</b></span> It found that many participants attributed their ability to stay HIV negative to a strong sense of religious and spiritual identity, social support from friends and family, and social engagement with other HIV-negative black MSM in safe spaces.<br><span id=""hover_text_news"" data-toggle=""tooltip"" data-html=""true"" data-placement=""bottom"" title=""Context: @username The circumcision, #acetaminophen &amp; autism studies:   (Circumcision is associated w/ autism &amp; ADHD only after Danish guidelines suggest Tylenol use-boys &lt;5yrs only) Animal model  Efficacy? ""><b>Finding C:</b></span> @username The circumcision, #acetaminophen &amp; autism studies:   (Circumcision is associated w/ autism &amp; ADHD only after Danish guidelines suggest Tylenol use-boys &lt;5yrs only) Animal model  Efficacy? <br><span id=""hover_text_news"" data-toggle=""tooltip"" data-html=""true"" data-placement=""bottom"" title=""Context: Of the 758 young adults recruited for the study, 61 percent were female. In total,19 percent of the young volunteers involved in the study reported that they had been physically abusive to a partner during a dating relationship and 68 percent of the volunteers reported to experiencing corporal punishment as children. There was a positive relationship between corporal punishment and physical violence during a romantic relationship.""><b>Finding D:</b></span> In total,19 percent of the young volunteers involved in the study reported that they had been physically abusive to a partner during a dating relationship and 68 percent of the volunteers reported to experiencing corporal punishment as children."
Psychology_60_r$Psychology_232_p$Psychology_tweet_230_r$Psychology_tweet_156_p	"<span id=""hover_text_news"" data-toggle=""tooltip"" data-html=""true"" data-placement=""bottom"" title=""Context: In Jilin City, from a total population of 7,258, the team identified 77 cases of autism, equating to a prevalence of 108 per 10,000, very similar to that found in the West. In Shenzhen and Jiamusi cities, only data for children in mainstream education was available; in Shenzhen City, 42 out of every 10,000 children in mainstream education had autism, and in Jiamusi City this figure was 19 per 10,000. In all three cities, the researchers identified new cases of autism in mainstream schools, confirming that there is under-diagnosis of autism in China.""><b>Finding A:</b></span> In Shenzhen and Jiamusi cities, only data for children in mainstream education was available; in Shenzhen City, 42 out of every 10,000 children in mainstream education had autism, and in Jiamusi City this figure was 19 per 10,000.<br><span id=""hover_text_paper"" data-toggle=""tooltip"" data-html=""true"" data-placement=""bottom"" title=""Context: Reassuringly, 6 out of 99 ASD diagnoses (97%) in children born 1990-1999 and recorded in the Danish Psychiatric Central Register, the source of psychiatric data in the National Patient Register, were confirmed upon medical chart review. and describe feelings, and our findings suggest that circumcision may somehow trigger the development of ASD in a small fraction of young boys. These findings obviously do not prove the suggested associations.""><b>Finding B:</b></span> and describe feelings, and our findings suggest that circumcision may somehow trigger the development of ASD in a small fraction of young boys.<br><span id=""hover_text_news"" data-toggle=""tooltip"" data-html=""true"" data-placement=""bottom"" title=""Context: It\'s not really manspreading. Expansive posture increases desirability consistent across gender. @username  ""><b>Finding C:</b></span> It\'s not really manspreading. Expansive posture increases desirability consistent across gender. @username  <br><span id=""hover_text_paper"" data-toggle=""tooltip"" data-html=""true"" data-placement=""bottom"" title=""Context: When considered simultaneously, gestational age and mother\'s marital status were no longer independent ASD risk factors. With 57 ASD cases in ritually circumcised boys and 4929 ASD cases in intact boys, the overall ASD risk in the age interval 0-9 years was 46% increased in ritually circumcised boys (HR ¼ 1.46; 95% CI: 1.11-1.93). This was due to noticeably increased ASD risk in the first 0-4 years of life (HR ¼ 1.80; 95% CI: 1.25-2.60), but not in the 5-9 years age interval (HR ¼ 1.15; 95% CI: 0.75-1.77).""><b>Finding D:</b></span> With 57 ASD cases in ritually circumcised boys and 4929 ASD cases in intact boys, the overall ASD risk in the age interval 0-9 years was 46% increased in ritually circumcised boys (HR ¼ 1.46; 95% CI: 1.11-1.93)."
Psychology_20_p$Psychology_tweet_0_r$Psychology_229_p$Psychology_tweet_45_r	"<span id=""hover_text_paper"" data-toggle=""tooltip"" data-html=""true"" data-placement=""bottom"" title=""Context: The Depressive Problems score was positively correlated with poor sleep quality (r = 0.371; P < .001). A total of 162 functional connectivity links involving areas associated with sleep, such as the precuneus, anterior cingulate cortex, and the lateral orbitofrontal cortex, were identified. Of these links, 39 were also associated with the Depressive Problems scores.""><b>Finding A:</b></span> A total of 162 functional connectivity links involving areas associated with sleep, such as the precuneus, anterior cingulate cortex, and the lateral orbitofrontal cortex, were identified.<br><span id=""hover_text_news"" data-toggle=""tooltip"" data-html=""true"" data-placement=""bottom"" title=""Context: Lag in maturation of the brain’s intrinsic functional architecture in ADHD  ""><b>Finding B:</b></span> Lag in maturation of the brain’s intrinsic functional architecture in ADHD  <br><span id=""hover_text_paper"" data-toggle=""tooltip"" data-html=""true"" data-placement=""bottom"" title=""Context: Change in memory accuracy also did not differ when probed after a nap compared to the change in memory accuracy after an interval awake. However, when memory was probed again following overnight sleep, the change in memory accuracy was greater if the child napped the previous day. Greater nap slow wave activity was associated with greater memory decay during the nap.""><b>Finding C:</b></span> However, when memory was probed again following overnight sleep, the change in memory accuracy was greater if the child napped the previous day.<br><span id=""hover_text_news"" data-toggle=""tooltip"" data-html=""true"" data-placement=""bottom"" title=""Context: Immune dysfunction in autism. Pathophysiological pathways. ""><b>Finding D:</b></span> Immune dysfunction in autism. Pathophysiological pathways. "
