id	text
Psychology_229_p$Psychology_239_r$Psychology_434_r$Psychology_tweet_259_p	"<span id=""hover_text_paper"" data-toggle=""tooltip"" data-html=""true"" data-placement=""bottom"" title=""Context: Change in memory accuracy also did not differ when probed after a nap compared to the change in memory accuracy after an interval awake. However, when memory was probed again following overnight sleep, the change in memory accuracy was greater if the child napped the previous day. Greater nap slow wave activity was associated with greater memory decay during the nap.""><b>Finding A:</b></span> However, when memory was probed again following overnight sleep, the change in memory accuracy was greater if the child napped the previous day.<br><span id=""hover_text_news"" data-toggle=""tooltip"" data-html=""true"" data-placement=""bottom"" title=""Context: ""The ad has to be plausible to the consumer for it have any effect,"" Reczek said. While the advertising industry has been reluctant to tout its use of targeted ads because of privacy concerns, this research suggests there may be benefits for companies that indicate to consumers that they are sending ads meant specifically for them. ""If you\'re a person who goes out hiking occasionally and you see a behaviorally targeted ad for hiking boots that suggests you\'re rugged and outdoorsy, our results suggest you will feel more outdoorsy and then be more likely to buy that product,"" Reczek said.""><b>Finding B:</b></span> While the advertising industry has been reluctant to tout its use of targeted ads because of privacy concerns, this research suggests there may be benefits for companies that indicate to consumers that they are sending ads meant specifically for them.<br><span id=""hover_text_news"" data-toggle=""tooltip"" data-html=""true"" data-placement=""bottom"" title=""Context: The study, conducted by Weiss, and clinical developmental psychology PhD candidates Stephanie Brown-Lavoie and Michelle Viecili, found that the lack of sexual knowledge in adults with autism played a role in increasing the risk of sexual victimization -- experiences of sexual coercion, unwanted sexual contact, attempted rape or rape. Of the 95 participants with ASD, 78 per cent reported at least one occurrence of sexual victimization compared to 47.4 per cent of the 117 adults without ASD who participated in the study. Brown-Lavoie points out that the study participants were asked about specific situations, not just a general ""have you been sexually victimized"" question.""><b>Finding C:</b></span> Of the 95 participants with ASD, 78 per cent reported at least one occurrence of sexual victimization compared to 47.4 per cent of the 117 adults without ASD who participated in the study.<br><span id=""hover_text_paper"" data-toggle=""tooltip"" data-html=""true"" data-placement=""bottom"" title=""Context: In the cohort born between 1926 and 1943, the hazard of developing dementia was 1.68 times higher (hazard ratio [HR] = 1.68 [95% CI, 1.05-2.86]) for those in the lowest wealth quintile compared with those in the highest quintile, independent of education, index of multiple deprivation, and health indicators. Higher hazards were also observed for those in the second-highest quintile of index of multiple deprivation (HR = 1.62 [95% CI, 1.06-2.46]) compared with those in the lowest (least deprived) quintile. In an English nationally representative sample, the incidence of dementia appeared to be socioeconomically patterned primarily by the level of wealth.""><b>Finding D:</b></span> Higher hazards were also observed for those in the second-highest quintile of index of multiple deprivation (HR = 1.62 [95% CI, 1.06-2.46]) compared with those in the lowest (least deprived) quintile."
Psychology_89_p$Psychology_503_r$Psychology_tweet_119_p$Psychology_124_p	"<span id=""hover_text_paper"" data-toggle=""tooltip"" data-html=""true"" data-placement=""bottom"" title=""Context: Even after controlling for sex, ethnicity, age, parental education, and child physical abuse, childhood corporal punishment was associated significantly with physical dating violence perpetration (aOR 1.29, 95% CI 1.02-1.62). The finding that childhood corporal punishment was associated with perpetration of young adult physical dating violence, even after controlling for several demographic variables and childhood physical abuse, adds to the growing literature demonstrating deleterious outcomes associated with corporal punishment. (J Pediatr 2018;194:233-7).""><b>Finding A:</b></span> The finding that childhood corporal punishment was associated with perpetration of young adult physical dating violence, even after controlling for several demographic variables and childhood physical abuse, adds to the growing literature demonstrating deleterious outcomes associated with corporal punishment.<br><span id=""hover_text_news"" data-toggle=""tooltip"" data-html=""true"" data-placement=""bottom"" title=""Context: ""We found that surprising because we weren\'t certain participants would self report that. While it\'s true that people are generally averse to harming others, the bottom line is that people don\'t feel this way all the time."" Again, the findings matched earlier experiments -- participants rated the articles associated with disgust and envy with less warmth than the pride or pity scenarios.""><b>Finding B:</b></span> While it\'s true that people are generally averse to harming others, the bottom line is that people don\'t feel this way all the time.""<br><span id=""hover_text_paper"" data-toggle=""tooltip"" data-html=""true"" data-placement=""bottom"" title=""Context: It is difficult to imagine that a parent would be able to meet all these criteria when administering spanking; indeed, it would likely be both inadvisable and bordering on abusive if parents spanked children following every instance of a given misbehavior. Spanking alone does not teach children why their behavior was wrong or what they should do instead . Rather, it teaches them that they must behave when the threat of physical punishment exists, but once the threat is gone, they have no reason to behave appropriately .""><b>Finding C:</b></span> Spanking alone does not teach children why their behavior was wrong or what they should do instead .<br><span id=""hover_text_paper"" data-toggle=""tooltip"" data-html=""true"" data-placement=""bottom"" title=""Context: By the 9-month follow-up, two fifths (42%) reported at least one penetrative casual encounter over the academic year; percentages were similar in both sexes, w 2 (1) < 1. Sociosexuality significantly predicted casual sex engagement after controlling for demographics, OR ¼ 2.06 [1.70, 2.49], p < .001; the interaction with gender was not significant, OR ¼ 1.13 [0.93, 1.36]. Only 23% of those scoring below the median on sociosexuality engaged in casual sex compared to 62% of those scoring above the median, w 2 (1) ¼ 57.73, p < .001.""><b>Finding D:</b></span> Sociosexuality significantly predicted casual sex engagement after controlling for demographics, OR ¼ 2.06 [1.70, 2.49], p < .001; the interaction with gender was not significant, OR ¼ 1.13 [0.93, 1.36]."
Psychology_456_p$Psychology_147_p$Psychology_tweet_154_p$Psychology_193_r	"<span id=""hover_text_paper"" data-toggle=""tooltip"" data-html=""true"" data-placement=""bottom"" title=""Context: Such motivation can be beneficial, behaviorally and affectively, especially when goals become increasingly difficult over time. Practitioners who aim to facilitate effective goal setting in sport, business, and educational settings would benefit from guidelines for developing autonomous motivation. To conclude, the present research supports and extends previous findings regarding the role of autonomous motivation for adaptive goal striving.""><b>Finding A:</b></span> Practitioners who aim to facilitate effective goal setting in sport, business, and educational settings would benefit from guidelines for developing autonomous motivation.<br><span id=""hover_text_paper"" data-toggle=""tooltip"" data-html=""true"" data-placement=""bottom"" title=""Context: , .0046-.1719), indicating that behavioral targeting increases purchase intentions for the advertised product through the recognition of the implied social label. The results from study 1 provide support for the hypothesis that behaviorally targeted advertisements can act as implied social labels, resulting in adjustments to behavior consistent with the label. Consumers in the behaviorally targeted and the demographically targeted condition felt equally that the ad was matched to personal information from earlier in the experimental session (to a significantly greater extent than participants in the control, nontargeted condition).""><b>Finding B:</b></span> The results from study 1 provide support for the hypothesis that behaviorally targeted advertisements can act as implied social labels, resulting in adjustments to behavior consistent with the label.<br><span id=""hover_text_paper"" data-toggle=""tooltip"" data-html=""true"" data-placement=""bottom"" title=""Context: The HR was higher, though not significantly so, for boys circumcised at age 24 months or older (HR ¼ 1.96; 95% CI: 0.93-4.14), an estimate based on only seven cases of ASD in that group ( Table 2) . The increased risk of ASD in circumcised boys under the age of 5 years was present among boys in both Muslim and non-Muslim families ( Table 2) . Risk in this age group was markedly elevated among boys in non-Muslim families (HR ¼ 4.23; 95% CI: 1.90-9.44), a finding based on six ASD cases in circumcised boys versus 1165 cases in intact boys.""><b>Finding C:</b></span> The increased risk of ASD in circumcised boys under the age of 5 years was present among boys in both Muslim and non-Muslim families ( Table 2) .<br><span id=""hover_text_news"" data-toggle=""tooltip"" data-html=""true"" data-placement=""bottom"" title=""Context: The researchers found functional connectivity between the areas of the brain associated with short-term memory, self, and negative emotions, which cause sufferers to dwell on bad thoughts and lead to a poor quality of sleep. This research could lead to better sleep quality for people with depression, and opens up the possibility of new targeted treatments. In the brains of those living with depressive problems, they discovered a strong connection between the dorsolateral prefrontal cortex (associated with short-term memory), the precuneus (associated with the self), and the lateral orbitofrontal cortex (associated with negative emotion).""><b>Finding D:</b></span> The researchers found functional connectivity between the areas of the brain associated with short-term memory, self, and negative emotions, which cause sufferers to dwell on bad thoughts and lead to a poor quality of sleep."
Psychology_448_r$Psychology_17_p$Psychology_229_r$Psychology_293_r	"<span id=""hover_text_news"" data-toggle=""tooltip"" data-html=""true"" data-placement=""bottom"" title=""Context: ""Controlling these factors is just as important as taking medications,"" Fries said. They also found that while older bipolar disorder patients had significantly accelerated epigenetic aging compared to controls, no difference was found in younger patients. ""We believe a difference wasn\'t detected in younger patients because they haven\'t had as much exposure to stressful events,"" Fries said.""><b>Finding A:</b></span> They also found that while older bipolar disorder patients had significantly accelerated epigenetic aging compared to controls, no difference was found in younger patients.<br><span id=""hover_text_paper"" data-toggle=""tooltip"" data-html=""true"" data-placement=""bottom"" title=""Context: Risk was particularly high for infantile autism before age five years (HR ¼ 2.06; 95% CI: 1.36-3.13). Circumcised boys in non-Muslim families were also more likely to develop hyperkinetic disorder (HR ¼ 1.81; 95% CI: 1.11-2.96). Associations with asthma were consistently inconspicuous (HR ¼ 0.96; 95% CI: 0.84-1.10).""><b>Finding B:</b></span> Circumcised boys in non-Muslim families were also more likely to develop hyperkinetic disorder (HR ¼ 1.81; 95% CI: 1.11-2.96).<br><span id=""hover_text_news"" data-toggle=""tooltip"" data-html=""true"" data-placement=""bottom"" title=""Context: This supports an interplay between the nap and subsequent overnight sleep in the consolidation of memories in young children."" The researchers say another highlight of their work is finding that naps do contribute to emotion processing in preschool children, which is consistent with parents\' and early childhood teachers\' observations, though this benefit in emotional memory is delayed, say Spencer and colleagues. This delay may reflect ""short-term destabilization of an enriched memory,"" they add.""><b>Finding C:</b></span> The researchers say another highlight of their work is finding that naps do contribute to emotion processing in preschool children, which is consistent with parents\' and early childhood teachers\' observations, though this benefit in emotional memory is delayed, say Spencer and colleagues.<br><span id=""hover_text_news"" data-toggle=""tooltip"" data-html=""true"" data-placement=""bottom"" title=""Context: Depression and sleeplessness go hand in hand.A petitefox/Flickr\n\naAn important part of the research was that we showed that in a population from the US, available because of the Human Connectome Project, the orbitofrontal cortex had increased functional connectivity with the other brain regions in people with depressive problems,a co-author and fellow University of Warwick professor Edmund Rolls, Ph.D. tells Inverse, referring to the large-scale effort to map the complete structural and functional neural connections within the human brain. A total of 162 functional connectivity neural links involved in the areas of the brain associated with sleep were identified from these scans. While anyone whoas experienced the difficulty of depression or insomnia may not be surprised that theyare connected, this study marks the first time scientists can definitively say there are neural mechanisms underlying the relationship between the two.""><b>Finding D:</b></span> A total of 162 functional connectivity neural links involved in the areas of the brain associated with sleep were identified from these scans."
Psychology_275_r$Psychology_171_r$Psychology_230_r$Psychology_tweet_283_p	"<span id=""hover_text_news"" data-toggle=""tooltip"" data-html=""true"" data-placement=""bottom"" title=""Context: For example, in one experiment, people felt more environmentally conscious after they received a behaviorally targeted ad for a ""green"" product. ""The power of a behaviorally targeted ad for a green product isn\'t just that it persuades you to buy the advertised product. It actually makes you feel more environmentally conscious and can change your behavior,"" said Rebecca Walker Reczek, co-author of the study and associate professor of marketing at The Ohio State University\'s Fisher College of Business.""><b>Finding A:</b></span> For example, in one experiment, people felt more environmentally conscious after they received a behaviorally targeted ad for a ""green"" product.<br><span id=""hover_text_news"" data-toggle=""tooltip"" data-html=""true"" data-placement=""bottom"" title=""Context: Those aged 35 to 49 experienced the highest level of happiness, while those between age 18 and 22 reported a decline in their happiness. A first-born child brought the most happiness, no matter what age the parents were. There was a 50 percent decrease in happiness during the birth of a second child, followed by a total slump by the time the third child is born.""><b>Finding B:</b></span> A first-born child brought the most happiness, no matter what age the parents were.<br><span id=""hover_text_news"" data-toggle=""tooltip"" data-html=""true"" data-placement=""bottom"" title=""Context: A significant benefit of napping was observed only when changes across the entire 24-hour period were considered. This supports an interplay between the nap and subsequent overnight sleep in the consolidation of memories in young children."" The researchers say another highlight of their work is finding that naps do contribute to emotion processing in preschool children, which is consistent with parents\' and early childhood teachers\' observations, though this benefit in emotional memory is delayed, say Spencer and colleagues.""><b>Finding C:</b></span> This supports an interplay between the nap and subsequent overnight sleep in the consolidation of memories in young children.""<br><span id=""hover_text_paper"" data-toggle=""tooltip"" data-html=""true"" data-placement=""bottom"" title=""Context: Sympathetic synchrony predicted perceived similarity between partners and this was true regardless of the social or physiological context. That is, sharing similar amounts sympathetic reactivity was sufficient to increase perceptions of similarity regardless of social context and no matter the arousal levels partners shared. Although this finding runs counter to the expectation that physiological synchrony would be most socially meaningful in the context of physiological reactivity, the finding is supported by prior work demonstrating a link between sympathetic synchrony and affiliation among strangers in similarly benign settings .""><b>Finding D:</b></span> That is, sharing similar amounts sympathetic reactivity was sufficient to increase perceptions of similarity regardless of social context and no matter the arousal levels partners shared."
Psychology_74_p$Psychology_tweet_73_r$Psychology_534_p$Psychology_42_r	"<span id=""hover_text_paper"" data-toggle=""tooltip"" data-html=""true"" data-placement=""bottom"" title=""Context: IMPORTANCE Depression is associated with poor sleep quality. Understanding the neural connectivity that underlies both conditions and mediates the association between them is likely to lead to better-directed treatments for depression and associated sleep problems. The Depressive Problems score was positively correlated with poor sleep quality (r = 0.371; P < .001).""><b>Finding A:</b></span> Understanding the neural connectivity that underlies both conditions and mediates the association between them is likely to lead to better-directed treatments for depression and associated sleep problems.<br><span id=""hover_text_news"" data-toggle=""tooltip"" data-html=""true"" data-placement=""bottom"" title=""Context: Childhood Corporal #Punishment and Future Perpetration of Physical Dating Violence [a]  HT @username  #DV #IPV #VAW #Parenting ""><b>Finding B:</b></span> Childhood Corporal #Punishment and Future Perpetration of Physical Dating Violence [a]  HT @username  #DV #IPV #VAW #Parenting <br><span id=""hover_text_paper"" data-toggle=""tooltip"" data-html=""true"" data-placement=""bottom"" title=""Context: 1 These findings point toward the existence of provider-generated obstacles to access. However, questions of bias in diagnosis and patient management are secondary to questions of access because the former presuppose a clinical encounter that only a subset of disadvantaged help seekers will obtain if there exists systematic bias in access. I posit that racial and class bias influence decision making at the pre-encounter stage-namely, at the first request for care.""><b>Finding C:</b></span> However, questions of bias in diagnosis and patient management are secondary to questions of access because the former presuppose a clinical encounter that only a subset of disadvantaged help seekers will obtain if there exists systematic bias in access.<br><span id=""hover_text_news"" data-toggle=""tooltip"" data-html=""true"" data-placement=""bottom"" title=""Context: Mikko Myrskyla, professor of demography at LSE and Director of the Max Planck Institute for Demographic Research in Rostock, Germany, said: ""Our results show a temporary and transitory gain in parents\' happiness around the birth of first and second children. ""The fact that parental happiness increases before these children are born suggests that we are capturing broader issues relating to childbearing such as couples forming partnerships and making plans for the future. ""The arrival of a third child is not associated with an increase in the parents\' happiness, but this is not to suggest they are any less loved than their older siblings.""><b>Finding D:</b></span> ""The fact that parental happiness increases before these children are born suggests that we are capturing broader issues relating to childbearing such as couples forming partnerships and making plans for the future."
Psychology_tweet_230_r$Psychology_tweet_258_r$Psychology_410_r$Psychology_tweet_106_p	"<span id=""hover_text_news"" data-toggle=""tooltip"" data-html=""true"" data-placement=""bottom"" title=""Context: It\'s not really manspreading. Expansive posture increases desirability consistent across gender. @username  ""><b>Finding A:</b></span> It\'s not really manspreading. Expansive posture increases desirability consistent across gender. @username  <br><span id=""hover_text_news"" data-toggle=""tooltip"" data-html=""true"" data-placement=""bottom"" title=""Context: ""‘Working is healthy; it keeps you young"" Why older workers work beyond the retirement age - a qualitative study: ""><b>Finding B:</b></span> ""‘Working is healthy; it keeps you young"" Why older workers work beyond the retirement age - a qualitative study: <br><span id=""hover_text_news"" data-toggle=""tooltip"" data-html=""true"" data-placement=""bottom"" title=""Context: The findings revealed that marijuana users showed significantly lower dopamine responses compared to healthy controls, according to personality tests and brain scans. ""Marijuana abusers show lower positive and higher negative emotionality scores than controls, which is consistent, on one hand, with lower reward sensitivity and motivation and, on the other hand, with increased stress reactivity and irritability,"" researchers wrote in the study. ""We found that marijuana abusers display attenuated dopamine (DA) responses to MP, including reduced decreases in striatal distribution volumes.""><b>Finding C:</b></span> ""Marijuana abusers show lower positive and higher negative emotionality scores than controls, which is consistent, on one hand, with lower reward sensitivity and motivation and, on the other hand, with increased stress reactivity and irritability,"" researchers wrote in the study.<br><span id=""hover_text_paper"" data-toggle=""tooltip"" data-html=""true"" data-placement=""bottom"" title=""Context: In addition, when fathers enacted or espoused a more egalitarian distribution of household labor, their daughters in particular expressed a greater interest in working outside the home and having a less stereotypical occupation. Fathers\' implicit gender-role associations also uniquely predicted daughters\' (but not sons\') occupational preferences. These findings suggest that a more balanced division of household labor between parents might promote greater workforce equality in future generations.""><b>Finding D:</b></span> Fathers\' implicit gender-role associations also uniquely predicted daughters\' (but not sons\') occupational preferences."
