id	text
Psychology_19_r$Psychology_342_r$Psychology_tweet_195_r$Psychology_198_p	"<span id=""hover_text_news"" data-toggle=""tooltip"" data-html=""true"" data-placement=""bottom"" title=""Context: The researchers, who followed the boys up to the age of nine, found that almost 5,000 cases of ASD were diagnosed. The study\'s findings showed that, regardless of cultural background, circumcised boys may run a greater risk of developing ASD. The researchers noted they also made an unexpected observation of an increased risk of hyperactivity disorder among circumcised boys in non-Muslim families.""><b>Finding A:</b></span> The study\'s findings showed that, regardless of cultural background, circumcised boys may run a greater risk of developing ASD.<br><span id=""hover_text_news"" data-toggle=""tooltip"" data-html=""true"" data-placement=""bottom"" title=""Context: To do this, they presented children ages approximately three to five years (34-64 months) with faces paired with mean or nice word descriptions, but they saw no significant main effects of emotional valence on recognition memory. Change in memory accuracy also did not differ when tested after a nap compared to the change in memory accuracy after an interval awake, they report. However, when memory was tested again following overnight sleep, the change in memory accuracy was greater if the child had napped the previous day.""><b>Finding B:</b></span> Change in memory accuracy also did not differ when tested after a nap compared to the change in memory accuracy after an interval awake, they report.<br><span id=""hover_text_news"" data-toggle=""tooltip"" data-html=""true"" data-placement=""bottom"" title=""Context: How sugary drink options are presented influence consumption. #psychology #science ""><b>Finding C:</b></span> How sugary drink options are presented influence consumption. #psychology #science <br><span id=""hover_text_paper"" data-toggle=""tooltip"" data-html=""true"" data-placement=""bottom"" title=""Context: These data provide the first evidence for the causal involvement of the insula region in some of the cognitions characteristic of gambling behavior. Here, insula patients distributed their choices between the two color options, and showed no apparent differences in basic \'stickiness\' or self-reported confidence, but they deviated from the other groups in that they did not show a gambler\'s fallacy bias. An intriguing feature is that the averaged data for the insula group displayed modest positive recency in their roulette color choice (Fig.""><b>Finding D:</b></span> Here, insula patients distributed their choices between the two color options, and showed no apparent differences in basic \'stickiness\' or self-reported confidence, but they deviated from the other groups in that they did not show a gambler\'s fallacy bias."
Psychology_444_p$Psychology_tweet_92_r$Psychology_468_r$Psychology_123_r	"<span id=""hover_text_paper"" data-toggle=""tooltip"" data-html=""true"" data-placement=""bottom"" title=""Context: Of note, PF is not due to worse recovery from the effects of IFN-α treatment per se, since the changes in clinical symptoms over the sixmonths post-treatment reveal a similar rate of recovery in both the PF and the RF groups. Our study confirms and extends findings from previous longitudinal studies of post-infective fatigue syndrome, which have observed greater fatigue at initial presentation to clinics, around four weeks post-infection, in those who would go on to experience persistent fatigue VollmerConna et al., 2007) . Interestingly, by adding a \'baseline\' assessment before IFN-α (i.e., equivalent to a hitherto unavailable fatigue measurement before the infection), our study shows that pre-treatment levels of fatigue are not a good predictor of the development of CFS in response to an immune challenge.""><b>Finding A:</b></span> Our study confirms and extends findings from previous longitudinal studies of post-infective fatigue syndrome, which have observed greater fatigue at initial presentation to clinics, around four weeks post-infection, in those who would go on to experience persistent fatigue VollmerConna et al., 2007) .<br><span id=""hover_text_news"" data-toggle=""tooltip"" data-html=""true"" data-placement=""bottom"" title=""Context: A new study shows that Circumcision more than doubles the risk of autism... ""><b>Finding B:</b></span> A new study shows that Circumcision more than doubles the risk of autism... <br><span id=""hover_text_news"" data-toggle=""tooltip"" data-html=""true"" data-placement=""bottom"" title=""Context: iStock On one level, that\'s evidence that gender stereotypes are alive and well and living in our offices. Across the board, we seem to perceive leaders as more charismatic when they fit with our gendered expectations. Just as we expect leaders of hierarchies to exhibit traits we associate with men, we expect leaders of more cohesive networks to ""strive for intimacy and solidarity"" -- traits we tacitly associate with women.""><b>Finding C:</b></span> Across the board, we seem to perceive leaders as more charismatic when they fit with our gendered expectations.<br><span id=""hover_text_news"" data-toggle=""tooltip"" data-html=""true"" data-placement=""bottom"" title=""Context: By the time these ""cool"" kids turned 23, many of them were having problems with criminal behavior and alcohol and marijuana use -- significantly more than the other subjects in the study, who were not ranked in the ""cool"" category at the study\'s onset. The researchers conclude with this scary notion:\n\n""The findings support the proposition that early adolescent attempts to gain status via pseudomature behavior are not simply passing annoyances of this developmental stage, but rather may signal movement down a problematic pathway and away from progress toward real psychosocial competence."" In other words, if you\'re acting extreme to look cool, chances are good that you might be the only one who thinks so.""><b>Finding D:</b></span> The researchers conclude with this scary notion:\n\n""The findings support the proposition that early adolescent attempts to gain status via pseudomature behavior are not simply passing annoyances of this developmental stage, but rather may signal movement down a problematic pathway and away from progress toward real psychosocial competence."""
Psychology_594_r$Psychology_tweet_108_p$Psychology_tweet_126_r$Psychology_239_r	"<span id=""hover_text_news"" data-toggle=""tooltip"" data-html=""true"" data-placement=""bottom"" title=""Context: There was, however, a difference in the quality of the foods added to their carts. Hungry shoppers bought more high-calorie foods, many of which were processed snacks and candy. Satiated shoppers tended towards lower-calorie foods such as fruits and fresh vegetables.""><b>Finding A:</b></span> Hungry shoppers bought more high-calorie foods, many of which were processed snacks and candy.<br><span id=""hover_text_paper"" data-toggle=""tooltip"" data-html=""true"" data-placement=""bottom"" title=""Context: Four additional experiments (n = 2,737) reveal that allowing viewers to see both regular speed and slow motion replay mitigates the bias, but does not eliminate it. We conclude that an empirical understanding of the effect of slow motion on mental state attribution should inform the life-or-death decisions that are currently based on tacit assumptions about the objectivity of human perception. This slow motion intentionality bias occurred, in part, because slow motion video caused participants to feel like the actor had more time to act, even when they knew how much clock time had actually elapsed.""><b>Finding B:</b></span> We conclude that an empirical understanding of the effect of slow motion on mental state attribution should inform the life-or-death decisions that are currently based on tacit assumptions about the objectivity of human perception.<br><span id=""hover_text_news"" data-toggle=""tooltip"" data-html=""true"" data-placement=""bottom"" title=""Context: Role of touch in regulating inter-partner physiological coupling during #empathy for #pain  MT @username ""><b>Finding C:</b></span> Role of touch in regulating inter-partner physiological coupling during #empathy for #pain  MT @username <br><span id=""hover_text_news"" data-toggle=""tooltip"" data-html=""true"" data-placement=""bottom"" title=""Context: ""The ad has to be plausible to the consumer for it have any effect,"" Reczek said. While the advertising industry has been reluctant to tout its use of targeted ads because of privacy concerns, this research suggests there may be benefits for companies that indicate to consumers that they are sending ads meant specifically for them. ""If you\'re a person who goes out hiking occasionally and you see a behaviorally targeted ad for hiking boots that suggests you\'re rugged and outdoorsy, our results suggest you will feel more outdoorsy and then be more likely to buy that product,"" Reczek said.""><b>Finding D:</b></span> While the advertising industry has been reluctant to tout its use of targeted ads because of privacy concerns, this research suggests there may be benefits for companies that indicate to consumers that they are sending ads meant specifically for them."
Psychology_tweet_120_r$Psychology_119_p$Psychology_tweet_183_r$Psychology_tweet_172_p	"<span id=""hover_text_news"" data-toggle=""tooltip"" data-html=""true"" data-placement=""bottom"" title=""Context: Thosewho were sociosexually unrestricted reported lower stress and greater overall emotional health after casual sex \xa0""><b>Finding A:</b></span> Thosewho were sociosexually unrestricted reported lower stress and greater overall emotional health after casual sex \xa0<br><span id=""hover_text_paper"" data-toggle=""tooltip"" data-html=""true"" data-placement=""bottom"" title=""Context: Participants in the demographically targeted condition recognized an implied label marginally more than those in the nontargeted condition (F(1, 185) ¼ 3.06, p ¼ .08, g 2 ¼ .02). Thus, as expected, consumers in the behaviorally targeted ad condition recognized that the ad implied a social label to a greater extent than those in the other conditions. An ANOVA on purchase intentions for the restaurant Groupon revealed a significant difference between the conditions (F(2, 185) ¼ 3.81, p < .05, g 2 ¼ .04).""><b>Finding B:</b></span> Thus, as expected, consumers in the behaviorally targeted ad condition recognized that the ad implied a social label to a greater extent than those in the other conditions.<br><span id=""hover_text_news"" data-toggle=""tooltip"" data-html=""true"" data-placement=""bottom"" title=""Context: Quality better than quantity for adolescent friendships (£)  by @username Study here ""><b>Finding C:</b></span> Quality better than quantity for adolescent friendships (£)  by @username Study here <br><span id=""hover_text_paper"" data-toggle=""tooltip"" data-html=""true"" data-placement=""bottom"" title=""Context: Second, the fact that display condition did not affect the duration of gaze on the subject noun suggests that our manipulation did not dramatically affect the initial reading process. Third, the fact that subjects were much less likely to make a regression in the trailing-mask condition than in the normal-reading condition suggests that readers do have control over their eye movement behavior and adapt to conditions such as the trailing-mask manipulation. Finally, and most important, our data showing the relationship between regressions and reading comprehension are the most compelling evidence suggesting that reading without the ability to reread parts of the text, when necessary, decreases comprehension accuracy.""><b>Finding D:</b></span> Third, the fact that subjects were much less likely to make a regression in the trailing-mask condition than in the normal-reading condition suggests that readers do have control over their eye movement behavior and adapt to conditions such as the trailing-mask manipulation."
Psychology_tweet_5_r$Psychology_275_p$Psychology_9_r$Psychology_322_p	"<span id=""hover_text_news"" data-toggle=""tooltip"" data-html=""true"" data-placement=""bottom"" title=""Context: My first, first author paper for my PhD 💃🎉🎊\n\nLooking at the association between psychotic experiences (PE) &amp; suicide. PE are important risk markers for future suicidal thoughts and behaviour. In future, let\'s ask about them! \n\n ""><b>Finding A:</b></span> My first, first author paper for my PhD 💃🎉🎊\n\nLooking at the association between psychotic experiences (PE) &amp; suicide. PE are important risk markers for future suicidal thoughts and behaviour. In future, let\'s ask about them! \n\n <br><span id=""hover_text_paper"" data-toggle=""tooltip"" data-html=""true"" data-placement=""bottom"" title=""Context: , and this effect was not present when the order of the mediators was reversed (b ¼ .0046, SE ¼ .02, 95% CI, À.0297 to .0607). The results of study 3 replicate previous results by showing that ads identified as behaviorally targeted can affect consumer self-perceptions and hence behavior. Specifically, consumers receiving a behaviorally targeted ad for an environmentally friendly ""green"" product viewed themselves as possessing stronger green consumption values.""><b>Finding B:</b></span> The results of study 3 replicate previous results by showing that ads identified as behaviorally targeted can affect consumer self-perceptions and hence behavior.<br><span id=""hover_text_news"" data-toggle=""tooltip"" data-html=""true"" data-placement=""bottom"" title=""Context: Risk was particularly high for infantile autism before the age of five, at least in epidemiology. The researchers say that the pain associated with circumcision in very young babies is likely to be more severe during the operation and post-operatively. ""Given the widespread practice of non-therapeutic circumcision in infancy and childhood around the world, our findings should prompt other researchers to examine the possibility that circumcision trauma in infancy or early childhood might carry an increased risk of serious neurodevelopmental and psychological consequences.""""><b>Finding C:</b></span> The researchers say that the pain associated with circumcision in very young babies is likely to be more severe during the operation and post-operatively.<br><span id=""hover_text_paper"" data-toggle=""tooltip"" data-html=""true"" data-placement=""bottom"" title=""Context: Restricting to probable AD (n 5 522) resulted in similar estimates for recent ( For all-cause dementia, glaucoma risks were attenuated though still non-null for recent diagnosis. Recent and established AMD and DR were associated with allcause dementia, and risks for DR were much larger (Supplementary Table 1 ). Models with non-AD dementia that treated AD as a competing risk confirmed the expected strong relationship between DR and non-AD dementia (Supplementary Table 1 ).""><b>Finding D:</b></span> Recent and established AMD and DR were associated with allcause dementia, and risks for DR were much larger (Supplementary Table 1 )."
Psychology_426_p$Psychology_25_r$Psychology_tweet_6_p$Psychology_tweet_25_p	"<span id=""hover_text_paper"" data-toggle=""tooltip"" data-html=""true"" data-placement=""bottom"" title=""Context: The most important reason for the reproducibility of behavioral genetic results is that genetic effect sizes are large. Heritability estimates for behavioral traits, typically between 30% and 50%, are by far the largest effect sizes in psychological science. In retrospect, it is amazing that inherited DNA differences can work their way through the complexities of pathways from genes to brain to behavior and end up accounting for so much of the variance of complex psychological traits.""><b>Finding A:</b></span> Heritability estimates for behavioral traits, typically between 30% and 50%, are by far the largest effect sizes in psychological science.<br><span id=""hover_text_news"" data-toggle=""tooltip"" data-html=""true"" data-placement=""bottom"" title=""Context: In the brains of those living with depressive problems, they discovered a strong connection between the dorsolateral prefrontal cortex (associated with short-term memory), the precuneus (associated with the self), and the lateral orbitofrontal cortex (associated with negative emotion). The analysis showed that these functional connectivities underlie the relation between depressive problems and sleep quality. The researchers conclude that increased functional connectivity among these brain regions provides a neural basis for how depression is related to poor sleep quality.""><b>Finding B:</b></span> The analysis showed that these functional connectivities underlie the relation between depressive problems and sleep quality.<br><span id=""hover_text_paper"" data-toggle=""tooltip"" data-html=""true"" data-placement=""bottom"" title=""Context: Specifically, we found that labels that are unconnected to prior behavior (i.e., inconsistent with consumers\' a priori interest in trait-related products) do not prompt adjustments to self-perceptions and affect behavior; low levels of accuracy yield no effect, whereas moderate to high levels of accuracy produce social labeling effects. The results further indicate that while consumers recognize even inaccurate behaviorally targeted ads as implied social labels, it is accuracy (i.e., the match between this prior behavior and the implied label) that determines whether this label is perceived to be relevant to the self, leading to adjustments in self-perceptions that play a mediating role in subsequent trait-related behavior. Importantly, however, we find that adjustments in consumer self-perceptions in response to behaviorally targeted advertisements depend on the plausibility of the connection between the label and past behavior.""><b>Finding C:</b></span> The results further indicate that while consumers recognize even inaccurate behaviorally targeted ads as implied social labels, it is accuracy (i.e., the match between this prior behavior and the implied label) that determines whether this label is perceived to be relevant to the self, leading to adjustments in self-perceptions that play a mediating role in subsequent trait-related behavior.<br><span id=""hover_text_paper"" data-toggle=""tooltip"" data-html=""true"" data-placement=""bottom"" title=""Context: Considering the broadest category of any psychiatric diagnosis (ICD-10-DCR codes F00-F99) as the outcome of interest, the offspring of the youngest mothers were at the highest risk for any mental disorders. Compared with the offspring of mothers aged 25 to 29 years, the offspring of mothers aged 12 to 19 years had a 51% increased risk of having a mental disorder (IRR, 1.51 [95% CI, 1.48-1.54]). No significantly increased risk for the offspring of older mothers was found.""><b>Finding D:</b></span> Compared with the offspring of mothers aged 25 to 29 years, the offspring of mothers aged 12 to 19 years had a 51% increased risk of having a mental disorder (IRR, 1.51 [95% CI, 1.48-1.54])."
Psychology_tweet_92_p$Psychology_tweet_91_r$Psychology_tweet_75_p$Psychology_tweet_125_p	"<span id=""hover_text_paper"" data-toggle=""tooltip"" data-html=""true"" data-placement=""bottom"" title=""Context: Our HR estimates for ASD are therefore most likely conservative. As with the missing circumcisions performed by religious circumcisers, such non-differential exposure misclassification will most likely produce conservative estimates of any real difference in ASD risk between circumcised and intact boys. Reassuringly, our robustness analysis in which we restricted the observation period to 1994-2003, when ritual circumcisions and ASD outcomes were covered, revealed a stronger association of ritual circumcision with ASD risk (HR ¼ 1.62) than in the main analysis (HR ¼ 1.46).""><b>Finding A:</b></span> As with the missing circumcisions performed by religious circumcisers, such non-differential exposure misclassification will most likely produce conservative estimates of any real difference in ASD risk between circumcised and intact boys.<br><span id=""hover_text_news"" data-toggle=""tooltip"" data-html=""true"" data-placement=""bottom"" title=""Context: Learning a lot about sleep from @username. Naps and sleep are very important for young children to enhance emotional memory. Even more reasons for a daytime siesta. ""><b>Finding B:</b></span> Learning a lot about sleep from @username. Naps and sleep are very important for young children to enhance emotional memory. Even more reasons for a daytime siesta. <br><span id=""hover_text_paper"" data-toggle=""tooltip"" data-html=""true"" data-placement=""bottom"" title=""Context: Our results provide strong initial evidence that these alterations arise from delays in typical maturational patterns. Our results invite further investigation into the neurobiological mechanisms in ADHD that produce delays in development of large-scale networks. We found significant and specific maturational lag in connections within default mode network (DMN) and in DMN interconnections with two task positive networks (TPNs): frontoparietal network and ventral attention network.""><b>Finding C:</b></span> Our results invite further investigation into the neurobiological mechanisms in ADHD that produce delays in development of large-scale networks.<br><span id=""hover_text_paper"" data-toggle=""tooltip"" data-html=""true"" data-placement=""bottom"" title=""Context: Participants were Hispanic (32.6%), white (28.8%), African American (26.0%), and other (12.7%). Nineteen percent of participants (n = 134) reported physical perpetration of dating violence, and more than one-half (68%) reported experiencing corporal punishment as children (n = 498, mean = 1.07, SD = 0.96). There was no significant association by sex (c 2 [3] = 3.52, P = .32), ethnicity (c 2 = 15.86, P =.07), or parental education (c 2 = 9.38, P = .40) differences in terms of corporal punishment (Table II) .""><b>Finding D:</b></span> Nineteen percent of participants (n = 134) reported physical perpetration of dating violence, and more than one-half (68%) reported experiencing corporal punishment as children (n = 498, mean = 1.07, SD = 0.96)."
