653297686fc1264370405c94	Experience.html	Experience											5			2								1			[]	[]
60f0102ca3ecb53656f7197d	Computer_Science_347_r	"<span id=""hover_text_news"" data-toggle=""tooltip"" data-html=""true"" data-placement=""bottom"" title=""Context: Chances are, just having your phone out is offending somebody: A full 20 percent of professionals said simply having your phone out at a business lunch is rude. Saying ""Excuse me"" to take a call didn't cut it: over 30 percent still found it to be rarely/never appropriate during informal/offsite lunch meetings. With a national sample of more than 550 full-time working professionals, the study reveals what business professionals perceive as acceptable, courteous or rude use of mobile phones in the workplace.""><b>Finding:</b></span> Saying ""Excuse me"" to take a call didn't cut it: over 30 percent still found it to be rarely/never appropriate during informal/offsite lunch meetings."				3																					[]	[{'start': 884, 'end': 899, 'span': 'over 30 percent', 'annotation': 'Words indicating certainty'}]
60f0102ca3ecb53656f7197d	Computer_Science_412_r	"<span id=""hover_text_news"" data-toggle=""tooltip"" data-html=""true"" data-placement=""bottom"" title=""Context: The researchers noted that Chicago has one of the most advanced monitoring programs in the nation and already employs social media mining techniques, yet this new model proved more precise in identifying restaurants that had food safety violations. Compared with routine inspections performed by the health department, it had a higher precision rate of identifying unsafe restaurants. When the researchers compared the model with routine inspections by health departments in Las Vegas and Chicago, they found that the overall rate across both cities of unsafe restaurants detected by the model was 52.3%, whereas the overall rate of detection of unsafe restaurants via routine inspections across the two cities was 22.7%.""><b>Finding:</b></span> Compared with routine inspections performed by the health department, it had a higher precision rate of identifying unsafe restaurants."	2																								[{'start': 903, 'end': 911, 'span': 'Compared', 'annotation': 'Words indicating uncertainty'}]	[]
60f0102ca3ecb53656f7197d	Computer_Science_86_p	"<span id=""hover_text_paper"" data-toggle=""tooltip"" data-html=""true"" data-placement=""bottom"" title=""Context: Finally, the expected employment returns associated with personal characteristics can vary across different resettlement locations (Fig. This indicates that there are synergies between places and people; certain characteristics will make a refugee a better match for a particular location. In Switzerland, for example, we find that the ability to speak French (i.e., among French-speaking African refugees) results in a larger payoff for refugees assigned to Frenchspeaking cantons than for those assigned to German-speaking cantons ( fig.""><b>Finding:</b></span> This indicates that there are synergies between places and people; certain characteristics will make a refugee a better match for a particular location."			4																						[]	[{'start': 722, 'end': 742, 'span': 'This indicates that ', 'annotation': 'Words indicating certainty'}]
60f0102ca3ecb53656f7197d	Certainty Examples.html	Certainty Examples					I carefully went over the examples and the instructions.:::Yes																				[]	[]
60f0102ca3ecb53656f7197d	Computer_Science_188_p	"<span id=""hover_text_paper"" data-toggle=""tooltip"" data-html=""true"" data-placement=""bottom"" title=""Context: A notable exception to the charging for checked bags trend was Southwest Airlines, who turned their resistance to this practice into a ""Bags Fly Free"" marketing campaign. At the aggregate level we find that the airlines that began charging for one checked bag saw a significant relative improvement in their on-time departure performance in the 35-day period afterwards, compared to the airlines that were not charging for a checked bag during the same time period. However, charging a fee for both checked bags results in a worse on-time departure performance compared to charging for one checked bag.""><b>Finding:</b></span> At the aggregate level we find that the airlines that began charging for one checked bag saw a significant relative improvement in their on-time departure performance in the 35-day period afterwards, compared to the airlines that were not charging for a checked bag during the same time period."				3																					[]	[{'start': 782, 'end': 794, 'span': 'we find that', 'annotation': 'Words indicating certainty'}]
60f0102ca3ecb53656f7197d	Computer_Science_188_r	"<span id=""hover_text_news"" data-toggle=""tooltip"" data-html=""true"" data-placement=""bottom"" title=""Context: The below-the-cabin effect dominates the above-the-cabin effect."" The findings, published in the journal Management Science, shows airlines improved their median departure time between 3.3 to 4.2 minutes and reduced average departure delays between 1.3 to 2 minutes, depending on whether they charged for the first or second checked bag. The reductions are significant because departure times and mitigating delays are crucial to so many other facets of the business, such as the number of flights airlines can offer and their image among potential customers.""><b>Finding:</b></span> The findings, published in the journal Management Science, shows airlines improved their median departure time between 3.3 to 4.2 minutes and reduced average departure delays between 1.3 to 2 minutes, depending on whether they charged for the first or second checked bag."			4																						[]	[{'start': 834, 'end': 842, 'span': 'findings', 'annotation': 'Words indicating certainty'}, {'start': 889, 'end': 894, 'span': 'shows', 'annotation': 'Words indicating certainty'}]
60f0102ca3ecb53656f7197d	Computer_Science_61_p	"<span id=""hover_text_paper"" data-toggle=""tooltip"" data-html=""true"" data-placement=""bottom"" title=""Context: While their vastly superior London knowledge distinguished them, an examination of grey matter volume in the brains of taxi drivers revealed further differences. Compared with controls, taxi drivers had greater grey matter volume in the posterior hippocampi (Maguire et al. 2000) .""><b>Finding:</b></span> Compared with controls, taxi drivers had greater grey matter volume in the posterior hippocampi (Maguire et al."	2																								[{'start': 464, 'end': 473, 'span': 'Compared ', 'annotation': 'Words indicating uncertainty'}]	[]
60f0102ca3ecb53656f7197d	test_question_testing_Somewhat certain	<b>Reported Finding:</b> New study suggests that sunscreen could prevent skin damage. This is a test question, please select Somewhat certain. Do not mark any words or phrases.			4																						[]	[]
60f0102ca3ecb53656f7197d	Computer_Science_412_p	"<span id=""hover_text_paper"" data-toggle=""tooltip"" data-html=""true"" data-placement=""bottom"" title=""Context: We used this information to focus restaurant inspections in two cities and demonstrated that FINDER improves the accuracy of health inspections; restaurants identified by FINDER are 3.1 times as likely to be deemed unsafe during the inspection as restaurants identified by existing methods. Additionally, FINDER enables us to ascertain previously intractable epidemiological information, for example, in 38% of cases the restaurant potentially causing food poisoning was not the last one visited, which may explain the lower precision of complaint-based inspections. We found that FINDER is able to reliably identify restaurants that have an active lapse in food safety, allowing for implementation of corrective actions that would prevent the potential spread of foodborne illness.""><b>Finding:</b></span> We used this information to focus restaurant inspections in two cities and demonstrated that FINDER improves the accuracy of health inspections; restaurants identified by FINDER are 3.1 times as likely to be deemed unsafe during the inspection as restaurants identified by existing methods."	2																								[{'start': 1160, 'end': 1172, 'span': 'likely to be', 'annotation': 'Words indicating uncertainty'}]	[]
60f0102ca3ecb53656f7197d	Computer_Science_418_r	"<span id=""hover_text_news"" data-toggle=""tooltip"" data-html=""true"" data-placement=""bottom"" title=""Context: However, Reece warned that the program still needs a lot more fine tuning. ""This is preliminary work, and it needs to be more thoroughly tested, vetted and replicated before we can safely claim that an algorithm can truly identify markers of depression in Instagram posts,"" Reece said. The real promise held by this line of research could be in suicide prevention, Galynker said.""><b>Finding:</b></span> ""This is preliminary work, and it needs to be more thoroughly tested, vetted and replicated before we can safely claim that an algorithm can truly identify markers of depression in Instagram posts,"" Reece said."	2																								[{'start': 718, 'end': 722, 'span': 'more', 'annotation': 'Words indicating uncertainty'}, {'start': 723, 'end': 733, 'span': 'thoroughly', 'annotation': 'Words indicating uncertainty'}, {'start': 809, 'end': 818, 'span': 'can truly', 'annotation': 'Words indicating uncertainty'}]	[]
60f0102ca3ecb53656f7197d	test_question_testing_Uncertain	<b>Reported Finding:</b> New study suggests that sunscreen could prevent skin damage. This is a test question, please select Uncertain. Do not mark any words or phrases.		1																							[]	[]
60f0102ca3ecb53656f7197d	Computer_Science_86_r	"<span id=""hover_text_news"" data-toggle=""tooltip"" data-html=""true"" data-placement=""bottom"" title=""Context: Canton Actual With algorithm OW 0% 40% TI 4% 32% FR 4% 15% LU 7% 18% VS 7% 14% VD 8% 8% BL 11% 12% AG 11% 21% GE 13% 23% ZH 15% 7% BE 16% 35% JU 17% 21% SG 17% 28% SH 20% 51% UR 20% 48% ZG 20% 61% GL 22% 42% BS 25% 25% NE 25% 11% SO 25% 64% GR 29% 64% NW 29% 45% SZ 29% 18% TG 30% 33% AR 33% 46%

Here's roughly how the algorithm works: The process starts with a series of models trained to predict where a certain type of refugee is likely to fare best based on previous cases. In other words, the locations and the number of refugees remain the same, they are just matched more precisely and systematically. ""It's really hard for a human to juggle all of those.""""><b>Finding:</b></span> In other words, the locations and the number of refugees remain the same, they are just matched more precisely and systematically."	2																								[{'start': 882, 'end': 896, 'span': 'In other words', 'annotation': 'Words indicating uncertainty'}]	[]
60f0102ca3ecb53656f7197d	Computer_Science_347_p	"<span id=""hover_text_paper"" data-toggle=""tooltip"" data-html=""true"" data-placement=""bottom"" title=""Context: Table 4 shows the perceived appropriateness of these various mobile phone behaviors during informal, offsite lunch meetings. Roughly two thirds of respondents thought the following actions were rarely or never appropriate: writing and sending text messages or emails (66.3%), answering a call (61.4%), and browsing the Internet (61.4%). Approximately half of respondents thought checking text messages or emails (53.1%) is rarely or never appropriate.""><b>Finding:</b></span> Roughly two thirds of respondents thought the following actions were rarely or never appropriate: writing and sending text messages or emails (66.3%), answering a call (61.4%), and browsing the Internet (61.4%)."	2																								[{'start': 634, 'end': 641, 'span': 'Roughly', 'annotation': 'Words indicating uncertainty'}]	[]
60f0102ca3ecb53656f7197d	Computer_Science_418_p	"<span id=""hover_text_paper"" data-toggle=""tooltip"" data-html=""true"" data-placement=""bottom"" title=""Context: The modest positive correlation of human-rated happiness with the presence and number of faces in a photograph was the only exception to this trend. Our results supported Hypothesis , that markers of depression are observable in Instagram user behavior, and Hypothesis , that these depressive signals are detectable in posts made even before the date of first diagnosis. Human ratings proved capable of distinguishing between Instagram posts made by depressed and healthy individuals (Hypothesis a), but showed little or no correlation with most computational features (Hypothesis b).""><b>Finding:</b></span> Our results supported Hypothesis , that markers of depression are observable in Instagram user behavior, and Hypothesis , that these depressive signals are detectable in posts made even before the date of first diagnosis."			4																						[]	[{'start': 783, 'end': 792, 'span': 'supported', 'annotation': 'Words indicating certainty'}]
60f0102ca3ecb53656f7197d	Computer_Science_61_r	"<span id=""hover_text_news"" data-toggle=""tooltip"" data-html=""true"" data-placement=""bottom"" title=""Context: In other words, taxi drivers had plumper memory centers than their peers. It seemed that the longer someone had been driving a taxi, the larger his hippocampus, as though the brain expanded to accommodate the cognitive demands of navigating London's streets. But it was also possible that The Knowledge selected for people whose memory centers were larger than average in the first place.""><b>Finding:</b></span> It seemed that the longer someone had been driving a taxi, the larger his hippocampus, as though the brain expanded to accommodate the cognitive demands of navigating London's streets."		1																							[{'start': 573, 'end': 580, 'span': 'seemed ', 'annotation': 'Words indicating uncertainty'}]	[]
60f0102ca3ecb53656f7197d	Consent.html	Consent						I have read and understood the instructions.:::Yes	I have read and understood the content warning.:::Yes	I want to participate in this research and continue with the study.:::Yes																	[]	[]
60f0102ca3ecb53656f7197d	Experience.html	Experience											5			2						4					[]	[]
613d0ef50abfe24aa600bc84	Computer_Science_347_r	"<span id=""hover_text_news"" data-toggle=""tooltip"" data-html=""true"" data-placement=""bottom"" title=""Context: Chances are, just having your phone out is offending somebody: A full 20 percent of professionals said simply having your phone out at a business lunch is rude. Saying ""Excuse me"" to take a call didn't cut it: over 30 percent still found it to be rarely/never appropriate during informal/offsite lunch meetings. With a national sample of more than 550 full-time working professionals, the study reveals what business professionals perceive as acceptable, courteous or rude use of mobile phones in the workplace.""><b>Finding:</b></span> Saying ""Excuse me"" to take a call didn't cut it: over 30 percent still found it to be rarely/never appropriate during informal/offsite lunch meetings."				3																					[]	[{'start': 905, 'end': 920, 'span': ' found it to be', 'annotation': 'Words indicating certainty'}]
613d0ef50abfe24aa600bc84	Computer_Science_412_r	"<span id=""hover_text_news"" data-toggle=""tooltip"" data-html=""true"" data-placement=""bottom"" title=""Context: The researchers noted that Chicago has one of the most advanced monitoring programs in the nation and already employs social media mining techniques, yet this new model proved more precise in identifying restaurants that had food safety violations. Compared with routine inspections performed by the health department, it had a higher precision rate of identifying unsafe restaurants. When the researchers compared the model with routine inspections by health departments in Las Vegas and Chicago, they found that the overall rate across both cities of unsafe restaurants detected by the model was 52.3%, whereas the overall rate of detection of unsafe restaurants via routine inspections across the two cities was 22.7%.""><b>Finding:</b></span> Compared with routine inspections performed by the health department, it had a higher precision rate of identifying unsafe restaurants."			4																						[]	[{'start': 972, 'end': 979, 'span': ' it had', 'annotation': 'Words indicating certainty'}]
613d0ef50abfe24aa600bc84	test_question_testing_Certain	<b>Reported Finding:</b> New study suggests that sunscreen could prevent skin damage. This is a test question, please select Certain. Do not mark any words or phrases.			4																						[]	[]
613d0ef50abfe24aa600bc84	Computer_Science_86_p	"<span id=""hover_text_paper"" data-toggle=""tooltip"" data-html=""true"" data-placement=""bottom"" title=""Context: Finally, the expected employment returns associated with personal characteristics can vary across different resettlement locations (Fig. This indicates that there are synergies between places and people; certain characteristics will make a refugee a better match for a particular location. In Switzerland, for example, we find that the ability to speak French (i.e., among French-speaking African refugees) results in a larger payoff for refugees assigned to Frenchspeaking cantons than for those assigned to German-speaking cantons ( fig.""><b>Finding:</b></span> This indicates that there are synergies between places and people; certain characteristics will make a refugee a better match for a particular location."			4																						[]	[{'start': 813, 'end': 822, 'span': 'will make', 'annotation': 'Words indicating certainty'}]
613d0ef50abfe24aa600bc84	Certainty Examples.html	Certainty Examples					I carefully went over the examples and the instructions.:::Yes																				[]	[]
613d0ef50abfe24aa600bc84	Computer_Science_188_p	"<span id=""hover_text_paper"" data-toggle=""tooltip"" data-html=""true"" data-placement=""bottom"" title=""Context: A notable exception to the charging for checked bags trend was Southwest Airlines, who turned their resistance to this practice into a ""Bags Fly Free"" marketing campaign. At the aggregate level we find that the airlines that began charging for one checked bag saw a significant relative improvement in their on-time departure performance in the 35-day period afterwards, compared to the airlines that were not charging for a checked bag during the same time period. However, charging a fee for both checked bags results in a worse on-time departure performance compared to charging for one checked bag.""><b>Finding:</b></span> At the aggregate level we find that the airlines that began charging for one checked bag saw a significant relative improvement in their on-time departure performance in the 35-day period afterwards, compared to the airlines that were not charging for a checked bag during the same time period."			4																						[]	[{'start': 782, 'end': 789, 'span': 'we find', 'annotation': 'Words indicating certainty'}]
613d0ef50abfe24aa600bc84	Computer_Science_188_r	"<span id=""hover_text_news"" data-toggle=""tooltip"" data-html=""true"" data-placement=""bottom"" title=""Context: The below-the-cabin effect dominates the above-the-cabin effect."" The findings, published in the journal Management Science, shows airlines improved their median departure time between 3.3 to 4.2 minutes and reduced average departure delays between 1.3 to 2 minutes, depending on whether they charged for the first or second checked bag. The reductions are significant because departure times and mitigating delays are crucial to so many other facets of the business, such as the number of flights airlines can offer and their image among potential customers.""><b>Finding:</b></span> The findings, published in the journal Management Science, shows airlines improved their median departure time between 3.3 to 4.2 minutes and reduced average departure delays between 1.3 to 2 minutes, depending on whether they charged for the first or second checked bag."	2																								[{'start': 889, 'end': 895, 'span': 'shows ', 'annotation': 'Words indicating uncertainty'}]	[]
613d0ef50abfe24aa600bc84	Computer_Science_61_p	"<span id=""hover_text_paper"" data-toggle=""tooltip"" data-html=""true"" data-placement=""bottom"" title=""Context: While their vastly superior London knowledge distinguished them, an examination of grey matter volume in the brains of taxi drivers revealed further differences. Compared with controls, taxi drivers had greater grey matter volume in the posterior hippocampi (Maguire et al. 2000) .""><b>Finding:</b></span> Compared with controls, taxi drivers had greater grey matter volume in the posterior hippocampi (Maguire et al."				3																					[]	[{'start': 488, 'end': 505, 'span': 'taxi drivers had ', 'annotation': 'Words indicating certainty'}]
613d0ef50abfe24aa600bc84	Computer_Science_412_p	"<span id=""hover_text_paper"" data-toggle=""tooltip"" data-html=""true"" data-placement=""bottom"" title=""Context: We used this information to focus restaurant inspections in two cities and demonstrated that FINDER improves the accuracy of health inspections; restaurants identified by FINDER are 3.1 times as likely to be deemed unsafe during the inspection as restaurants identified by existing methods. Additionally, FINDER enables us to ascertain previously intractable epidemiological information, for example, in 38% of cases the restaurant potentially causing food poisoning was not the last one visited, which may explain the lower precision of complaint-based inspections. We found that FINDER is able to reliably identify restaurants that have an active lapse in food safety, allowing for implementation of corrective actions that would prevent the potential spread of foodborne illness.""><b>Finding:</b></span> We used this information to focus restaurant inspections in two cities and demonstrated that FINDER improves the accuracy of health inspections; restaurants identified by FINDER are 3.1 times as likely to be deemed unsafe during the inspection as restaurants identified by existing methods."				3																					[]	[{'start': 1065, 'end': 1086, 'span': 'improves the accuracy', 'annotation': 'Words indicating certainty'}]
613d0ef50abfe24aa600bc84	Computer_Science_418_r	"<span id=""hover_text_news"" data-toggle=""tooltip"" data-html=""true"" data-placement=""bottom"" title=""Context: However, Reece warned that the program still needs a lot more fine tuning. ""This is preliminary work, and it needs to be more thoroughly tested, vetted and replicated before we can safely claim that an algorithm can truly identify markers of depression in Instagram posts,"" Reece said. The real promise held by this line of research could be in suicide prevention, Galynker said.""><b>Finding:</b></span> ""This is preliminary work, and it needs to be more thoroughly tested, vetted and replicated before we can safely claim that an algorithm can truly identify markers of depression in Instagram posts,"" Reece said."			4																						[]	[{'start': 706, 'end': 712, 'span': 'needs ', 'annotation': 'Words indicating certainty'}]
613d0ef50abfe24aa600bc84	test_question_testing_Uncertain	<b>Reported Finding:</b> New study suggests that sunscreen could prevent skin damage. This is a test question, please select Uncertain. Do not mark any words or phrases.		1																							[]	[]
613d0ef50abfe24aa600bc84	Computer_Science_86_r	"<span id=""hover_text_news"" data-toggle=""tooltip"" data-html=""true"" data-placement=""bottom"" title=""Context: Canton Actual With algorithm OW 0% 40% TI 4% 32% FR 4% 15% LU 7% 18% VS 7% 14% VD 8% 8% BL 11% 12% AG 11% 21% GE 13% 23% ZH 15% 7% BE 16% 35% JU 17% 21% SG 17% 28% SH 20% 51% UR 20% 48% ZG 20% 61% GL 22% 42% BS 25% 25% NE 25% 11% SO 25% 64% GR 29% 64% NW 29% 45% SZ 29% 18% TG 30% 33% AR 33% 46%

Here's roughly how the algorithm works: The process starts with a series of models trained to predict where a certain type of refugee is likely to fare best based on previous cases. In other words, the locations and the number of refugees remain the same, they are just matched more precisely and systematically. ""It's really hard for a human to juggle all of those.""""><b>Finding:</b></span> In other words, the locations and the number of refugees remain the same, they are just matched more precisely and systematically."			4																						[]	[{'start': 956, 'end': 965, 'span': 'they are ', 'annotation': 'Words indicating certainty'}]
613d0ef50abfe24aa600bc84	Computer_Science_347_p	"<span id=""hover_text_paper"" data-toggle=""tooltip"" data-html=""true"" data-placement=""bottom"" title=""Context: Table 4 shows the perceived appropriateness of these various mobile phone behaviors during informal, offsite lunch meetings. Roughly two thirds of respondents thought the following actions were rarely or never appropriate: writing and sending text messages or emails (66.3%), answering a call (61.4%), and browsing the Internet (61.4%). Approximately half of respondents thought checking text messages or emails (53.1%) is rarely or never appropriate.""><b>Finding:</b></span> Roughly two thirds of respondents thought the following actions were rarely or never appropriate: writing and sending text messages or emails (66.3%), answering a call (61.4%), and browsing the Internet (61.4%)."				3																					[]	[{'start': 634, 'end': 642, 'span': 'Roughly ', 'annotation': 'Words indicating certainty'}]
