5d474ed70f79810001c36084	Computer_Science_423_p	"<span id=""hover_text_paper"" data-toggle=""tooltip"" data-html=""true"" data-placement=""bottom"" title=""Context: Emotional ads spur the largest increases in web traffic when they air in shows with higher volumes of program chatter. Across both measures of online program engagement, we find that ads spur more online purchases when they air in more social shows, with funny ads spurring the largest increases in sales when they air in more social shows and with active and informational ads generating the smallest increases in sales. More affective adsin particular, those with an emotional or funny moodmay be more successful in social shows because such ads effectively recapture viewers' attention from the program and allow for the engaged processing of the program to spillover to ad processing (e.g., ).""><b>Finding:</b></span> Across both measures of online program engagement, we find that ads spur more online purchases when they air in more social shows, with funny ads spurring the largest increases in sales when they air in more social shows and with active and informational ads generating the smallest increases in sales."				3																					[]	[{'start': 931, 'end': 939, 'span': 'we find ', 'annotation': 'Words indicating certainty'}]
5d474ed70f79810001c36084	Computer_Science_12_r	"<span id=""hover_text_news"" data-toggle=""tooltip"" data-html=""true"" data-placement=""bottom"" title=""Context: Despite the casual reputation, professionals from the West Coast were less accepting of mobile phone use in meetings than people from the East Coast. Higher-income professionals had less tolerance for smartphone use in business meetings. Dramatic age gap: Younger professionals were nearly three times as likely as older professionals to think tapping out a message over a business lunch is appropriate -- 66 percent of people under 30 said texting or emailing was okay, compared to just 20 percent of those aged 51-65.""><b>Finding:</b></span> Higher-income professionals had less tolerance for smartphone use in business meetings."				3																					[]	[{'start': 715, 'end': 748, 'span': 'professionals had less tolerance ', 'annotation': 'Words indicating certainty'}]
5d474ed70f79810001c36084	Certainty Examples.html	Certainty Examples					I carefully went over the examples and the instructions.:::Yes																				[]	[]
5d474ed70f79810001c36084	Computer_Science_267_r	"<span id=""hover_text_news"" data-toggle=""tooltip"" data-html=""true"" data-placement=""bottom"" title=""Context: You could probably extrapolate this effect out to relationships within large or small companies for those of us whose social lives largely overlap with our careers. For example, people working in small startups might have a larger number of intense relationships than those in the wider corporate world. But the bottom line here is that having more close relationships in your life should be possible at any time, but it's going to mean putting in the work, which will probably come at the expense of losing some less intimate relationships.""><b>Finding:</b></span> For example, people working in small startups might have a larger number of intense relationships than those in the wider corporate world."	2																								[{'start': 769, 'end': 775, 'span': 'might ', 'annotation': 'Words indicating uncertainty'}]	[]
5d474ed70f79810001c36084	Computer_Science_423_r	"<span id=""hover_text_news"" data-toggle=""tooltip"" data-html=""true"" data-placement=""bottom"" title=""Context: ""We find that advertisements that air in programs with more social activity see increased ad responsiveness in terms of subsequent online shopping behavior. This result varies with the mood of the ad, with more affective ads -- in particular, funny and emotional ads -- seeing the largest increases in online shopping activity. ""Our results shed light on how advertisers can encourage online shopping activity on their websites in the age of multiscreen consumers.""""><b>Finding:</b></span> This result varies with the mood of the ad, with more affective ads -- in particular, funny and emotional ads -- seeing the largest increases in online shopping activity."	2																								[{'start': 816, 'end': 823, 'span': 'seeing ', 'annotation': 'Words indicating uncertainty'}]	[]
5d474ed70f79810001c36084	Computer_Science_12_p	"<span id=""hover_text_paper"" data-toggle=""tooltip"" data-html=""true"" data-placement=""bottom"" title=""Context: Also, higher-income professionals showed lower acceptance for mobile phone use during meetings. Finally, professionals in the Western region of the United States were less accepting of mobile phone use during meetings. In the informal meeting setting (see Model 2 in Table 5 ), the following variables were significant predictors: age, gender, and region.""><b>Finding:</b></span> Finally, professionals in the Western region of the United States were less accepting of mobile phone use during meetings."				3																					[]	[{'start': 604, 'end': 624, 'span': 'were less accepting ', 'annotation': 'Words indicating certainty'}]
5d474ed70f79810001c36084	Computer_Science_231_r	"<span id=""hover_text_news"" data-toggle=""tooltip"" data-html=""true"" data-placement=""bottom"" title=""Context: Researchers noticed that a part of the brain called the hippocampus was much larger in these animals than in similar species that did not secret away their snacks. In other words, taxi drivers had plumper memory centers than their peers. It seemed that the longer someone had been driving a taxi, the larger his hippocampus, as though the brain expanded to accommodate the cognitive demands of navigating London's streets.""><b>Finding:</b></span> In other words, taxi drivers had plumper memory centers than their peers."			4																						[]	[]
5d474ed70f79810001c36084	test_question_testing_Somewhat certain	<b>Reported Finding:</b> New study suggests that sunscreen could prevent skin damage. This is a test question, please select Somewhat certain. Do not mark any words or phrases.				3																					[]	[]
5d474ed70f79810001c36084	Computer_Science_267_p	"<span id=""hover_text_paper"" data-toggle=""tooltip"" data-html=""true"" data-placement=""bottom"" title=""Context: Of itself, this distribution yields no structure whatsoever but it is a reasonable More interestingly, it predicts that when the number of available relationships is small, this structure is inverted, having more close relationships than acquaintances. We provide evidence of the existence of both regimes in real communities and analyze the consequences of these findings in our understanding of social groups.""><b>Finding:</b></span> More interestingly, it predicts that when the number of available relationships is small, this structure is inverted, having more close relationships than acquaintances."				3																					[]	[{'start': 617, 'end': 626, 'span': 'predicts ', 'annotation': 'Words indicating certainty'}]
5d474ed70f79810001c36084	test_question_testing_Somewhat uncertain	<b>Reported Finding:</b> New study suggests that sunscreen could prevent skin damage. This is a test question, please select Somewhat uncertain. Do not mark any words or phrases.	2																								[]	[]
5d474ed70f79810001c36084	Computer_Science_222_p	"<span id=""hover_text_paper"" data-toggle=""tooltip"" data-html=""true"" data-placement=""bottom"" title=""Context: Exceptional memory in these individuals was not found to be associated with higher IQ or any structural brain differences relative to control participants . However, fMRI scanning revealed that they activated brain areas associated with navigation, including the hippocampus, more than control participants. With extensive practice, this method is effective at enabling one to remember the order of stimuli by imagining familiar routes and placing the to-be-remembered items along the routes thus promoting deeper encoding of the stimuli with rich associations.""><b>Finding:</b></span> However, fMRI scanning revealed that they activated brain areas associated with navigation, including the hippocampus, more than control participants."			4																						[]	[{'start': 767, 'end': 776, 'span': 'revealed ', 'annotation': 'Words indicating certainty'}]
5d474ed70f79810001c36084	Computer_Science_30_r	"<span id=""hover_text_news"" data-toggle=""tooltip"" data-html=""true"" data-placement=""bottom"" title=""Context: Photo by John T. C This data is exciting in that it suggests that immersive environments could offer new pathways for improved outcomes in education and high-proficiency training. The researchers found that people remember information better if it is presented to them in a virtual environment. ""This data is exciting in that it suggests that immersive environments could offer new pathways for improved outcomes in education and high-proficiency training,"" says Amitabh Varshney, professor of computer science and dean of the College of Computer, Mathematical, and Natural Sciences at UMD.""><b>Finding:</b></span> The researchers found that people remember information better if it is presented to them in a virtual environment."				3																					[]	[]
5d474ed70f79810001c36084	Computer_Science_222_r	"<span id=""hover_text_news"" data-toggle=""tooltip"" data-html=""true"" data-placement=""bottom"" title=""Context: A map of its streets looks more like a tangle of yarn that a preschooler glued to construction paper than a metropolis designed with architectural foresight. These navigational demands stimulate brain development, concludes a study five years in the making. With the new research, scientists can definitively say that London taxi drivers not only have larger-than-average memory centers in their brains, but also that their intensive training is responsible for the growth.""><b>Finding:</b></span> These navigational demands stimulate brain development, concludes a study five years in the making."			4																						[]	[{'start': 754, 'end': 764, 'span': 'concludes ', 'annotation': 'Words indicating certainty'}]
5d474ed70f79810001c36084	Computer_Science_231_p	"<span id=""hover_text_paper"" data-toggle=""tooltip"" data-html=""true"" data-placement=""bottom"" title=""Context: In line with the pattern of behavioural tests, it seems that the structural brain changes observed in taxi drivers in our previous studies may also reverse in retired taxi drivers. Full-time taxi drivers had significantly greater grey matter volume in the posterior hippocampus than retired taxi drivers, who had greater volume in this region than the non-taxi driver retired control participants (figure 6d ). Clearly, increased numbers of participants are required to confirm these findings.""><b>Finding:</b></span> Full-time taxi drivers had significantly greater grey matter volume in the posterior hippocampus than retired taxi drivers, who had greater volume in this region than the non-taxi driver retired control participants (figure 6d )."				3																					[]	[{'start': 703, 'end': 717, 'span': 'significantly ', 'annotation': 'Words indicating certainty'}]
5d474ed70f79810001c36084	Computer_Science_30_p	"<span id=""hover_text_paper"" data-toggle=""tooltip"" data-html=""true"" data-placement=""bottom"" title=""Context: The HMD condition was found to have 8.8% improvement in recall accuracy compared to the desktop condition, and this was found to be statistically significant. This suggests an exciting opportunity for the role of immersive virtual environments in assisting in recall. Given the results of our user study, we believe that virtual memory palaces offer us a fascinating insight into how we may be able to organize and structure large information spaces and navigate them in ways that assist in superior recall.""><b>Finding:</b></span> This suggests an exciting opportunity for the role of immersive virtual environments in assisting in recall."				3																					[]	[{'start': 695, 'end': 704, 'span': 'suggests ', 'annotation': 'Words indicating certainty'}]
5d474ed70f79810001c36084	Consent.html	Consent						I have read and understood the instructions.:::Yes	I have read and understood the content warning.:::Yes	I want to participate in this research and continue with the study.:::Yes																	[]	[]
5d474ed70f79810001c36084	Experience.html	Experience										4								3	2						[]	[]
614ddb23e026c9f38155d7e4	Computer_Science_423_p	"<span id=""hover_text_paper"" data-toggle=""tooltip"" data-html=""true"" data-placement=""bottom"" title=""Context: Emotional ads spur the largest increases in web traffic when they air in shows with higher volumes of program chatter. Across both measures of online program engagement, we find that ads spur more online purchases when they air in more social shows, with funny ads spurring the largest increases in sales when they air in more social shows and with active and informational ads generating the smallest increases in sales. More affective adsin particular, those with an emotional or funny moodmay be more successful in social shows because such ads effectively recapture viewers' attention from the program and allow for the engaged processing of the program to spillover to ad processing (e.g., ).""><b>Finding:</b></span> Across both measures of online program engagement, we find that ads spur more online purchases when they air in more social shows, with funny ads spurring the largest increases in sales when they air in more social shows and with active and informational ads generating the smallest increases in sales."				3																					[]	[{'start': 891, 'end': 900, 'span': ' measures', 'annotation': 'Words indicating certainty'}]
614ddb23e026c9f38155d7e4	Computer_Science_12_r	"<span id=""hover_text_news"" data-toggle=""tooltip"" data-html=""true"" data-placement=""bottom"" title=""Context: Despite the casual reputation, professionals from the West Coast were less accepting of mobile phone use in meetings than people from the East Coast. Higher-income professionals had less tolerance for smartphone use in business meetings. Dramatic age gap: Younger professionals were nearly three times as likely as older professionals to think tapping out a message over a business lunch is appropriate -- 66 percent of people under 30 said texting or emailing was okay, compared to just 20 percent of those aged 51-65.""><b>Finding:</b></span> Higher-income professionals had less tolerance for smartphone use in business meetings."	2																								[{'start': 733, 'end': 747, 'span': 'less tolerance', 'annotation': 'Words indicating uncertainty'}]	[]
614ddb23e026c9f38155d7e4	Certainty Examples.html	Certainty Examples					I carefully went over the examples and the instructions.:::Yes																				[]	[]
614ddb23e026c9f38155d7e4	Computer_Science_267_r	"<span id=""hover_text_news"" data-toggle=""tooltip"" data-html=""true"" data-placement=""bottom"" title=""Context: You could probably extrapolate this effect out to relationships within large or small companies for those of us whose social lives largely overlap with our careers. For example, people working in small startups might have a larger number of intense relationships than those in the wider corporate world. But the bottom line here is that having more close relationships in your life should be possible at any time, but it's going to mean putting in the work, which will probably come at the expense of losing some less intimate relationships.""><b>Finding:</b></span> For example, people working in small startups might have a larger number of intense relationships than those in the wider corporate world."				3																					[]	[{'start': 769, 'end': 774, 'span': 'might', 'annotation': 'Words indicating certainty'}]
614ddb23e026c9f38155d7e4	Computer_Science_423_r	"<span id=""hover_text_news"" data-toggle=""tooltip"" data-html=""true"" data-placement=""bottom"" title=""Context: ""We find that advertisements that air in programs with more social activity see increased ad responsiveness in terms of subsequent online shopping behavior. This result varies with the mood of the ad, with more affective ads -- in particular, funny and emotional ads -- seeing the largest increases in online shopping activity. ""Our results shed light on how advertisers can encourage online shopping activity on their websites in the age of multiscreen consumers.""""><b>Finding:</b></span> This result varies with the mood of the ad, with more affective ads -- in particular, funny and emotional ads -- seeing the largest increases in online shopping activity."	2																								[{'start': 715, 'end': 721, 'span': 'varies', 'annotation': 'Words indicating uncertainty'}]	[]
614ddb23e026c9f38155d7e4	Computer_Science_12_p	"<span id=""hover_text_paper"" data-toggle=""tooltip"" data-html=""true"" data-placement=""bottom"" title=""Context: Also, higher-income professionals showed lower acceptance for mobile phone use during meetings. Finally, professionals in the Western region of the United States were less accepting of mobile phone use during meetings. In the informal meeting setting (see Model 2 in Table 5 ), the following variables were significant predictors: age, gender, and region.""><b>Finding:</b></span> Finally, professionals in the Western region of the United States were less accepting of mobile phone use during meetings."	2																								[{'start': 609, 'end': 623, 'span': 'less accepting', 'annotation': 'Words indicating uncertainty'}]	[]
614ddb23e026c9f38155d7e4	Computer_Science_231_r	"<span id=""hover_text_news"" data-toggle=""tooltip"" data-html=""true"" data-placement=""bottom"" title=""Context: Researchers noticed that a part of the brain called the hippocampus was much larger in these animals than in similar species that did not secret away their snacks. In other words, taxi drivers had plumper memory centers than their peers. It seemed that the longer someone had been driving a taxi, the larger his hippocampus, as though the brain expanded to accommodate the cognitive demands of navigating London's streets.""><b>Finding:</b></span> In other words, taxi drivers had plumper memory centers than their peers."				3																					[]	[{'start': 633, 'end': 636, 'span': 'had', 'annotation': 'Words indicating certainty'}]
614ddb23e026c9f38155d7e4	Computer_Science_267_p	"<span id=""hover_text_paper"" data-toggle=""tooltip"" data-html=""true"" data-placement=""bottom"" title=""Context: Of itself, this distribution yields no structure whatsoever but it is a reasonable More interestingly, it predicts that when the number of available relationships is small, this structure is inverted, having more close relationships than acquaintances. We provide evidence of the existence of both regimes in real communities and analyze the consequences of these findings in our understanding of social groups.""><b>Finding:</b></span> More interestingly, it predicts that when the number of available relationships is small, this structure is inverted, having more close relationships than acquaintances."			4																						[]	[{'start': 599, 'end': 612, 'span': 'interestingly', 'annotation': 'Words indicating certainty'}]
614ddb23e026c9f38155d7e4	test_question_testing_Somewhat uncertain	<b>Reported Finding:</b> New study suggests that sunscreen could prevent skin damage. This is a test question, please select Somewhat uncertain. Do not mark any words or phrases.	2																								[]	[]
614ddb23e026c9f38155d7e4	Computer_Science_222_p	"<span id=""hover_text_paper"" data-toggle=""tooltip"" data-html=""true"" data-placement=""bottom"" title=""Context: Exceptional memory in these individuals was not found to be associated with higher IQ or any structural brain differences relative to control participants . However, fMRI scanning revealed that they activated brain areas associated with navigation, including the hippocampus, more than control participants. With extensive practice, this method is effective at enabling one to remember the order of stimuli by imagining familiar routes and placing the to-be-remembered items along the routes thus promoting deeper encoding of the stimuli with rich associations.""><b>Finding:</b></span> However, fMRI scanning revealed that they activated brain areas associated with navigation, including the hippocampus, more than control participants."			4																						[]	[{'start': 781, 'end': 795, 'span': 'they activated', 'annotation': 'Words indicating certainty'}]
614ddb23e026c9f38155d7e4	Computer_Science_30_r	"<span id=""hover_text_news"" data-toggle=""tooltip"" data-html=""true"" data-placement=""bottom"" title=""Context: Photo by John T. C This data is exciting in that it suggests that immersive environments could offer new pathways for improved outcomes in education and high-proficiency training. The researchers found that people remember information better if it is presented to them in a virtual environment. ""This data is exciting in that it suggests that immersive environments could offer new pathways for improved outcomes in education and high-proficiency training,"" says Amitabh Varshney, professor of computer science and dean of the College of Computer, Mathematical, and Natural Sciences at UMD.""><b>Finding:</b></span> The researchers found that people remember information better if it is presented to them in a virtual environment."			4																						[]	[{'start': 878, 'end': 883, 'span': 'found', 'annotation': 'Words indicating certainty'}]
614ddb23e026c9f38155d7e4	Computer_Science_222_r	"<span id=""hover_text_news"" data-toggle=""tooltip"" data-html=""true"" data-placement=""bottom"" title=""Context: A map of its streets looks more like a tangle of yarn that a preschooler glued to construction paper than a metropolis designed with architectural foresight. These navigational demands stimulate brain development, concludes a study five years in the making. With the new research, scientists can definitively say that London taxi drivers not only have larger-than-average memory centers in their brains, but also that their intensive training is responsible for the growth.""><b>Finding:</b></span> These navigational demands stimulate brain development, concludes a study five years in the making."				3																					[]	[{'start': 674, 'end': 691, 'span': 'demands stimulate', 'annotation': 'Words indicating certainty'}]
614ddb23e026c9f38155d7e4	test_question_testing_Uncertain	<b>Reported Finding:</b> New study suggests that sunscreen could prevent skin damage. This is a test question, please select Uncertain. Do not mark any words or phrases.		1																							[]	[]
614ddb23e026c9f38155d7e4	Computer_Science_231_p	"<span id=""hover_text_paper"" data-toggle=""tooltip"" data-html=""true"" data-placement=""bottom"" title=""Context: In line with the pattern of behavioural tests, it seems that the structural brain changes observed in taxi drivers in our previous studies may also reverse in retired taxi drivers. Full-time taxi drivers had significantly greater grey matter volume in the posterior hippocampus than retired taxi drivers, who had greater volume in this region than the non-taxi driver retired control participants (figure 6d ). Clearly, increased numbers of participants are required to confirm these findings.""><b>Finding:</b></span> Full-time taxi drivers had significantly greater grey matter volume in the posterior hippocampus than retired taxi drivers, who had greater volume in this region than the non-taxi driver retired control participants (figure 6d )."			4																						[]	[{'start': 699, 'end': 716, 'span': 'had significantly', 'annotation': 'Words indicating certainty'}]
614ddb23e026c9f38155d7e4	Computer_Science_30_p	"<span id=""hover_text_paper"" data-toggle=""tooltip"" data-html=""true"" data-placement=""bottom"" title=""Context: The HMD condition was found to have 8.8% improvement in recall accuracy compared to the desktop condition, and this was found to be statistically significant. This suggests an exciting opportunity for the role of immersive virtual environments in assisting in recall. Given the results of our user study, we believe that virtual memory palaces offer us a fascinating insight into how we may be able to organize and structure large information spaces and navigate them in ways that assist in superior recall.""><b>Finding:</b></span> This suggests an exciting opportunity for the role of immersive virtual environments in assisting in recall."			4																						[]	[{'start': 744, 'end': 753, 'span': 'immersive', 'annotation': 'Words indicating certainty'}]
614ddb23e026c9f38155d7e4	Consent.html	Consent						I have read and understood the instructions.:::Yes	I have read and understood the content warning.:::Yes	I want to participate in this research and continue with the study.:::Yes																	[]	[]
614ddb23e026c9f38155d7e4	Experience.html	Experience											5							3					3		[]	[]
