5f3c1274ebadcc9ff00b3113	Computer_Science_123_r	"<span id=""hover_text_news"" data-toggle=""tooltip"" data-html=""true"" data-placement=""bottom"" title=""Context: Or, as the researchers write in the new paper, ""For the time being, there seems to be no easy way to design algorithms that would reconcile moral values and personal self-interest."" The results consistently showed that people will take a utilitarian approach to the ethics of autonomous vehicles, one emphasizing the sheer number of lives that could be saved. For instance, 76 percent of respondents believe it is more moral for an autonomous vehicle, should such a circumstance arise, to sacrifice one passenger rather than 10 pedestrians.""><b>Finding:</b></span> The results consistently showed that people will take a utilitarian approach to the ethics of autonomous vehicles, one emphasizing the sheer number of lives that could be saved."			4																						[]	[]
5f3c1274ebadcc9ff00b3113	Consent.html	Consent						I have read and understood the instructions.:::Yes	I have read and understood the content warning.:::Yes	I want to participate in this research and continue with the study.:::Yes																	[]	[]
5f3c1274ebadcc9ff00b3113	Computer_Science_tweet_50_r	"<span id=""hover_text_news"" data-toggle=""tooltip"" data-html=""true"" data-placement=""bottom"" title=""Context: Mixed reality variations improve learning, over screen-only options. CMU researchers. ""><b>Finding:</b></span> Mixed reality variations improve learning, over screen-only options. CMU researchers. "			4																						[]	[]
5f3c1274ebadcc9ff00b3113	Experience.html	Experience										4								3		4					[]	[]
5ebae1553421dc07a5fc6673	Computer_Science_225_r	"<span id=""hover_text_news"" data-toggle=""tooltip"" data-html=""true"" data-placement=""bottom"" title=""Context: ""If everybody does that, then we would end up in a tragedy ... whereby the cars will not minimize casualties,"" Rahwan adds. Or, as the researchers write in the new paper, ""For the time being, there seems to be no easy way to design algorithms that would reconcile moral values and personal self-interest."" The results consistently showed that people will take a utilitarian approach to the ethics of autonomous vehicles, one emphasizing the sheer number of lives that could be saved.""><b>Finding:</b></span> Or, as the researchers write in the new paper, ""For the time being, there seems to be no easy way to design algorithms that would reconcile moral values and personal self-interest."""	2																								[{'start': 867, 'end': 896, 'span': 'there seems to be no easy way', 'annotation': 'Words indicating uncertainty'}]	[]
5ebae1553421dc07a5fc6673	Computer_Science_404_r	"<span id=""hover_text_news"" data-toggle=""tooltip"" data-html=""true"" data-placement=""bottom"" title=""Context: The study revealed that activations in several areas in the brain belonging to the auditory, limbic, and motor regions were activated by all musical pieces. Notable, areas in the medial orbitofrontal region and the anterior cingulate cortex, which are relevant for self-referential appraisal and aesthetic judgments, were found to be activated during the listening. A further interesting finding was that vocal and instrumental music were processed differently.""><b>Finding:</b></span> Notable, areas in the medial orbitofrontal region and the anterior cingulate cortex, which are relevant for self-referential appraisal and aesthetic judgments, were found to be activated during the listening."			4																						[]	[{'start': 734, 'end': 746, 'span': 'are relevant', 'annotation': 'Words indicating certainty'}]
5ebae1553421dc07a5fc6673	Computer_Science_151_r	"<span id=""hover_text_news"" data-toggle=""tooltip"" data-html=""true"" data-placement=""bottom"" title=""Context: Virtual Reality helped patients recall old memories by providing new stimuli difficult to achieve, due to ill health, or inaccessible within a secure environment. They found that people remember information better if it is presented to them in a virtual environment. ""This data is exciting in that it suggests that immersive environments could offer new pathways for improved outcomes in education and high-proficiency training,"" said Amitabh Varshney, Professor of Computer Science, in a survey published in the journal Virtual Reality.""><b>Finding:</b></span> They found that people remember information better if it is presented to them in a virtual environment."				3																					[]	[{'start': 811, 'end': 827, 'span': 'They found that ', 'annotation': 'Words indicating certainty'}]
5ebae1553421dc07a5fc6673	Certainty Examples.html	Certainty Examples					I carefully went over the examples and the instructions.:::Yes																				[]	[]
5ebae1553421dc07a5fc6673	Computer_Science_23_p	"<span id=""hover_text_paper"" data-toggle=""tooltip"" data-html=""true"" data-placement=""bottom"" title=""Context: Our findings highlight factors, such as the effect of carry-on bags, that need to be incorporated in designing incentive schemes. Our research also sheds some light on the decisions made by a very operationally focused airline. When the other airlines started charging for one checked bag, Southwest Airlines' decision to not charge for bags went against their high operational service level strategy as their relative departure delay performance initially decreased.""><b>Finding:</b></span> Our research also sheds some light on the decisions made by a very operationally focused airline."				3																					[]	[{'start': 667, 'end': 684, 'span': ' sheds some light', 'annotation': 'Words indicating certainty'}]
5ebae1553421dc07a5fc6673	Computer_Science_404_p	"<span id=""hover_text_paper"" data-toggle=""tooltip"" data-html=""true"" data-placement=""bottom"" title=""Context: Individual models for the two musical medleys revealed that activations in several areas in the brain belonging to the auditory, limbic, and motor regions could be predicted. Notably, activations in the medial orbitofrontal region and the anterior cingulate cortex, relevant for self-referential appraisal and aesthetic judgments, could be predicted successfully. Cross-validation across musical stimuli and participant pools helped identify a region of the right superior temporal gyrus, encompassing the planum polare and the Heschl's gyrus, as the core structure that processed complex acoustic features of musical pieces from various genres, with or without lyrics.""><b>Finding:</b></span> Notably, activations in the medial orbitofrontal region and the anterior cingulate cortex, relevant for self-referential appraisal and aesthetic judgments, could be predicted successfully."				3																					[]	[{'start': 1008, 'end': 1016, 'span': 'could be', 'annotation': 'Words indicating certainty'}]
5ebae1553421dc07a5fc6673	test_question_testing_Somewhat certain	<b>Reported Finding:</b> New study suggests that sunscreen could prevent skin damage. This is a test question, please select Somewhat certain. Do not mark any words or phrases.				3																					[]	[]
5ebae1553421dc07a5fc6673	Computer_Science_183_p	"<span id=""hover_text_paper"" data-toggle=""tooltip"" data-html=""true"" data-placement=""bottom"" title=""Context: We have established that navigation expertise is associated with structural brain differences and behavioural consequences, both positive and negative. In particular, the correlations between time taxi driving and hippocampal grey matter volume suggest that experience drives the patterns observed. This longitudinal approach will also permit the examination of the characteristics of those who succeed at taxi driver training, and whether innate pre-training cognitive factors and/or hippocampal volume are predictive of subsequent successful qualification.""><b>Finding:</b></span> In particular, the correlations between time taxi driving and hippocampal grey matter volume suggest that experience drives the patterns observed."				3																					[]	[{'start': 834, 'end': 842, 'span': 'suggest ', 'annotation': 'Words indicating certainty'}]
5ebae1553421dc07a5fc6673	test_question_testing_Uncertain	<b>Reported Finding:</b> New study suggests that sunscreen could prevent skin damage. This is a test question, please select Uncertain. Do not mark any words or phrases.		1																							[]	[]
5ebae1553421dc07a5fc6673	Computer_Science_23_r	"<span id=""hover_text_news"" data-toggle=""tooltip"" data-html=""true"" data-placement=""bottom"" title=""Context: So, a drop in total baggage volume benefits not only the airlines that charge baggage fees but also those that do not. Southwest's improved departure time performance was not as significant as its rival airlines, which did charge for checked bags, and it appears to have hurt one of Southwest's historical competitive advantages in customer service. Southwest's ""bags fly free"" policy is likely not free based on lost opportunity cost, mostly because it could be offering more flights per day with increased boarding times due to charging for checked bags.""><b>Finding:</b></span> Southwest's improved departure time performance was not as significant as its rival airlines, which did charge for checked bags, and it appears to have hurt one of Southwest's historical competitive advantages in customer service."	2																								"[{'start': 886, 'end': 908, 'span': 'was not as significant', 'annotation': 'Words indicating uncertainty'}, {'start': 974, 'end': 1102, 'span': 'appe<span class=""span_container"" selection_label=""Words indicating uncertainty"" style=""background-color:rgb(0,158,115, 0.25);"">a', 'annotation': 'Words indicating uncertainty'}]"	[]
5ebae1553421dc07a5fc6673	Computer_Science_tweet_299_r	"<span id=""hover_text_news"" data-toggle=""tooltip"" data-html=""true"" data-placement=""bottom"" title=""Context: #BigData and #networking to detect criminal organizations in mobile phone networks @username  #LogAnalysis ""><b>Finding:</b></span> #BigData and #networking to detect criminal organizations in mobile phone networks @username  #LogAnalysis "				3																					[]	[{'start': 314, 'end': 323, 'span': 'to detect', 'annotation': 'Words indicating certainty'}]
5ebae1553421dc07a5fc6673	Computer_Science_225_p	"<span id=""hover_text_paper"" data-toggle=""tooltip"" data-html=""true"" data-placement=""bottom"" title=""Context: Defining the algorithms that will help AVs make these moral decisions is a formidable challenge. We found that participants to six MTurk studies approved of utilitarian AVs (that sacrifice their passengers for the greater good), and would like others to buy them; but they would themselves prefer to ride in AVs that protect their passengers at all costs. They would disapprove of enforcing utilitarian AVs, and would be less willing to buy such a regulated AV.""><b>Finding:</b></span> Defining the algorithms that will help AVs make these moral decisions is a formidable challenge."		1																							[{'start': 719, 'end': 739, 'span': 'formidable challenge', 'annotation': 'Words indicating uncertainty'}]	[]
5ebae1553421dc07a5fc6673	Computer_Science_183_r	"<span id=""hover_text_news"" data-toggle=""tooltip"" data-html=""true"" data-placement=""bottom"" title=""Context: He sees it as confirmation of the idea that cognitive exercise produces physical changes in the brain. ""The initial findings could have been explained by a correlation, that people with big hippocampi become taxi drivers,"" he says. ""But it turns out it really was the training process that caused the growth in the brain.""><b>Finding:</b></span> ""The initial findings could have been explained by a correlation, that people with big hippocampi become taxi drivers,"" he says."				3																					[]	[{'start': 602, 'end': 612, 'span': 'could have', 'annotation': 'Words indicating certainty'}]
5ebae1553421dc07a5fc6673	Consent.html	Consent						I have read and understood the instructions.:::Yes	I have read and understood the content warning.:::Yes	I want to participate in this research and continue with the study.:::Yes																	[]	[]
5ebae1553421dc07a5fc6673	Computer_Science_tweet_299_p	"<span id=""hover_text_paper"" data-toggle=""tooltip"" data-html=""true"" data-placement=""bottom"" title=""Context: It has to be repeated m times, so the worst computational cost is O(m 2 n), or O(n 3 ) for sparse graphs. Note that, although for large networks such high computational cost makes this solution often unfeasible, for criminal networks constituted (most often) by hundreds or at most thousands of nodes, this algorithm works well. The number of the edges to be deleted can be chosen interactively.""><b>Finding:</b></span> Note that, although for large networks such high computational cost makes this solution often unfeasible, for criminal networks constituted (most often) by hundreds or at most thousands of nodes, this algorithm works well."				3																					[{'start': 672, 'end': 682, 'span': 'unfeasible', 'annotation': 'Words indicating uncertainty'}]	[{'start': 774, 'end': 798, 'span': 'this algorithm works wel', 'annotation': 'Words indicating certainty'}]
5ebae1553421dc07a5fc6673	Computer_Science_151_p	"<span id=""hover_text_paper"" data-toggle=""tooltip"" data-html=""true"" data-placement=""bottom"" title=""Context: We found that virtual memory palaces in HMD condition provide a superior memory recall ability compared to the desktop condition. We believe this is a first step in using virtual environments for creating more memorable experiences that enhance productivity through better recall of large amounts of information organized using the idea of virtual memory palaces. The technique of memory palaces provides a natural spatial mnemonic to assist in recall.""><b>Finding:</b></span> We believe this is a first step in using virtual environments for creating more memorable experiences that enhance productivity through better recall of large amounts of information organized using the idea of virtual memory palaces."				3																					[]	[{'start': 635, 'end': 646, 'span': 'We believe ', 'annotation': 'Words indicating certainty'}]
5ebae1553421dc07a5fc6673	Experience.html	Experience											5					5							3		[]	[]
6144742e57a61e489cc9e978	Computer_Science_225_r	"<span id=""hover_text_news"" data-toggle=""tooltip"" data-html=""true"" data-placement=""bottom"" title=""Context: ""If everybody does that, then we would end up in a tragedy ... whereby the cars will not minimize casualties,"" Rahwan adds. Or, as the researchers write in the new paper, ""For the time being, there seems to be no easy way to design algorithms that would reconcile moral values and personal self-interest."" The results consistently showed that people will take a utilitarian approach to the ethics of autonomous vehicles, one emphasizing the sheer number of lives that could be saved.""><b>Finding:</b></span> Or, as the researchers write in the new paper, ""For the time being, there seems to be no easy way to design algorithms that would reconcile moral values and personal self-interest."""				3																					[]	[]
6144742e57a61e489cc9e978	Computer_Science_404_r	"<span id=""hover_text_news"" data-toggle=""tooltip"" data-html=""true"" data-placement=""bottom"" title=""Context: The study revealed that activations in several areas in the brain belonging to the auditory, limbic, and motor regions were activated by all musical pieces. Notable, areas in the medial orbitofrontal region and the anterior cingulate cortex, which are relevant for self-referential appraisal and aesthetic judgments, were found to be activated during the listening. A further interesting finding was that vocal and instrumental music were processed differently.""><b>Finding:</b></span> Notable, areas in the medial orbitofrontal region and the anterior cingulate cortex, which are relevant for self-referential appraisal and aesthetic judgments, were found to be activated during the listening."				3																					[]	[]
6144742e57a61e489cc9e978	Computer_Science_151_r	"<span id=""hover_text_news"" data-toggle=""tooltip"" data-html=""true"" data-placement=""bottom"" title=""Context: Virtual Reality helped patients recall old memories by providing new stimuli difficult to achieve, due to ill health, or inaccessible within a secure environment. They found that people remember information better if it is presented to them in a virtual environment. ""This data is exciting in that it suggests that immersive environments could offer new pathways for improved outcomes in education and high-proficiency training,"" said Amitabh Varshney, Professor of Computer Science, in a survey published in the journal Virtual Reality.""><b>Finding:</b></span> They found that people remember information better if it is presented to them in a virtual environment."			4																						[]	[]
6144742e57a61e489cc9e978	Certainty Examples.html	Certainty Examples					I carefully went over the examples and the instructions.:::Yes																				[]	[]
6144742e57a61e489cc9e978	Computer_Science_23_p	"<span id=""hover_text_paper"" data-toggle=""tooltip"" data-html=""true"" data-placement=""bottom"" title=""Context: Our findings highlight factors, such as the effect of carry-on bags, that need to be incorporated in designing incentive schemes. Our research also sheds some light on the decisions made by a very operationally focused airline. When the other airlines started charging for one checked bag, Southwest Airlines' decision to not charge for bags went against their high operational service level strategy as their relative departure delay performance initially decreased.""><b>Finding:</b></span> Our research also sheds some light on the decisions made by a very operationally focused airline."			4																						[]	[]
6144742e57a61e489cc9e978	Computer_Science_404_p	"<span id=""hover_text_paper"" data-toggle=""tooltip"" data-html=""true"" data-placement=""bottom"" title=""Context: Individual models for the two musical medleys revealed that activations in several areas in the brain belonging to the auditory, limbic, and motor regions could be predicted. Notably, activations in the medial orbitofrontal region and the anterior cingulate cortex, relevant for self-referential appraisal and aesthetic judgments, could be predicted successfully. Cross-validation across musical stimuli and participant pools helped identify a region of the right superior temporal gyrus, encompassing the planum polare and the Heschl's gyrus, as the core structure that processed complex acoustic features of musical pieces from various genres, with or without lyrics.""><b>Finding:</b></span> Notably, activations in the medial orbitofrontal region and the anterior cingulate cortex, relevant for self-referential appraisal and aesthetic judgments, could be predicted successfully."	2																								[{'start': 1008, 'end': 1014, 'span': 'could ', 'annotation': 'Words indicating uncertainty'}]	[]
6144742e57a61e489cc9e978	test_question_testing_Somewhat certain	<b>Reported Finding:</b> New study suggests that sunscreen could prevent skin damage. This is a test question, please select Somewhat certain. Do not mark any words or phrases.				3																					[]	[]
6144742e57a61e489cc9e978	Computer_Science_183_p	"<span id=""hover_text_paper"" data-toggle=""tooltip"" data-html=""true"" data-placement=""bottom"" title=""Context: We have established that navigation expertise is associated with structural brain differences and behavioural consequences, both positive and negative. In particular, the correlations between time taxi driving and hippocampal grey matter volume suggest that experience drives the patterns observed. This longitudinal approach will also permit the examination of the characteristics of those who succeed at taxi driver training, and whether innate pre-training cognitive factors and/or hippocampal volume are predictive of subsequent successful qualification.""><b>Finding:</b></span> In particular, the correlations between time taxi driving and hippocampal grey matter volume suggest that experience drives the patterns observed."				3																					[]	[{'start': 834, 'end': 842, 'span': 'suggest ', 'annotation': 'Words indicating certainty'}]
6144742e57a61e489cc9e978	test_question_testing_Uncertain	<b>Reported Finding:</b> New study suggests that sunscreen could prevent skin damage. This is a test question, please select Uncertain. Do not mark any words or phrases.		1																							[]	[]
6144742e57a61e489cc9e978	Computer_Science_23_r	"<span id=""hover_text_news"" data-toggle=""tooltip"" data-html=""true"" data-placement=""bottom"" title=""Context: So, a drop in total baggage volume benefits not only the airlines that charge baggage fees but also those that do not. Southwest's improved departure time performance was not as significant as its rival airlines, which did charge for checked bags, and it appears to have hurt one of Southwest's historical competitive advantages in customer service. Southwest's ""bags fly free"" policy is likely not free based on lost opportunity cost, mostly because it could be offering more flights per day with increased boarding times due to charging for checked bags.""><b>Finding:</b></span> Southwest's improved departure time performance was not as significant as its rival airlines, which did charge for checked bags, and it appears to have hurt one of Southwest's historical competitive advantages in customer service."				3																					[{'start': 890, 'end': 893, 'span': 'not', 'annotation': 'Words indicating uncertainty'}, {'start': 974, 'end': 982, 'span': 'appears ', 'annotation': 'Words indicating uncertainty'}]	[]
6144742e57a61e489cc9e978	Computer_Science_tweet_299_r	"<span id=""hover_text_news"" data-toggle=""tooltip"" data-html=""true"" data-placement=""bottom"" title=""Context: #BigData and #networking to detect criminal organizations in mobile phone networks @username  #LogAnalysis ""><b>Finding:</b></span> #BigData and #networking to detect criminal organizations in mobile phone networks @username  #LogAnalysis "			4																						[]	[]
6144742e57a61e489cc9e978	Computer_Science_225_p	"<span id=""hover_text_paper"" data-toggle=""tooltip"" data-html=""true"" data-placement=""bottom"" title=""Context: Defining the algorithms that will help AVs make these moral decisions is a formidable challenge. We found that participants to six MTurk studies approved of utilitarian AVs (that sacrifice their passengers for the greater good), and would like others to buy them; but they would themselves prefer to ride in AVs that protect their passengers at all costs. They would disapprove of enforcing utilitarian AVs, and would be less willing to buy such a regulated AV.""><b>Finding:</b></span> Defining the algorithms that will help AVs make these moral decisions is a formidable challenge."			4																						[]	[]
6144742e57a61e489cc9e978	Computer_Science_183_r	"<span id=""hover_text_news"" data-toggle=""tooltip"" data-html=""true"" data-placement=""bottom"" title=""Context: He sees it as confirmation of the idea that cognitive exercise produces physical changes in the brain. ""The initial findings could have been explained by a correlation, that people with big hippocampi become taxi drivers,"" he says. ""But it turns out it really was the training process that caused the growth in the brain.""><b>Finding:</b></span> ""The initial findings could have been explained by a correlation, that people with big hippocampi become taxi drivers,"" he says."	2																								[{'start': 602, 'end': 608, 'span': 'could ', 'annotation': 'Words indicating uncertainty'}]	[]
6144742e57a61e489cc9e978	Consent.html	Consent						I have read and understood the instructions.:::Yes	I have read and understood the content warning.:::Yes	I want to participate in this research and continue with the study.:::Yes																	[]	[]
6144742e57a61e489cc9e978	Computer_Science_tweet_299_p	"<span id=""hover_text_paper"" data-toggle=""tooltip"" data-html=""true"" data-placement=""bottom"" title=""Context: It has to be repeated m times, so the worst computational cost is O(m 2 n), or O(n 3 ) for sparse graphs. Note that, although for large networks such high computational cost makes this solution often unfeasible, for criminal networks constituted (most often) by hundreds or at most thousands of nodes, this algorithm works well. The number of the edges to be deleted can be chosen interactively.""><b>Finding:</b></span> Note that, although for large networks such high computational cost makes this solution often unfeasible, for criminal networks constituted (most often) by hundreds or at most thousands of nodes, this algorithm works well."			4																						[]	[]
6144742e57a61e489cc9e978	Computer_Science_151_p	"<span id=""hover_text_paper"" data-toggle=""tooltip"" data-html=""true"" data-placement=""bottom"" title=""Context: We found that virtual memory palaces in HMD condition provide a superior memory recall ability compared to the desktop condition. We believe this is a first step in using virtual environments for creating more memorable experiences that enhance productivity through better recall of large amounts of information organized using the idea of virtual memory palaces. The technique of memory palaces provides a natural spatial mnemonic to assist in recall.""><b>Finding:</b></span> We believe this is a first step in using virtual environments for creating more memorable experiences that enhance productivity through better recall of large amounts of information organized using the idea of virtual memory palaces."				3																					[]	[{'start': 638, 'end': 646, 'span': 'believe ', 'annotation': 'Words indicating certainty'}]
6144742e57a61e489cc9e978	Experience.html	Experience										4					4								3		[]	[]
