id	text
Medicine_33_p$Medicine_50_r$Medicine_95_r$Medicine_tweet_29_r	"<span id=""hover_text_paper"" data-toggle=""tooltip"" data-html=""true"" data-placement=""bottom"" title=""Context: Interestingly, AP-1 is essential for MHC complex I downregulation and immune escape upon HIV infection . In summary, the presented evidence supports a major role of negative selection in cancer evolution, which has been neglected in most studies, and ultimately challenges the current paradigm of an exclusive role of positive selection in cancer. These studies help to shed light upon the mechanisms underlying immune evasion and provide insights for improving cancer immunotherapies in the future.""><b>Finding A:</b></span> In summary, the presented evidence supports a major role of negative selection in cancer evolution, which has been neglected in most studies, and ultimately challenges the current paradigm of an exclusive role of positive selection in cancer.<br><span id=""hover_text_news"" data-toggle=""tooltip"" data-html=""true"" data-placement=""bottom"" title=""Context: About 19 percent said they had committed some form of dating violence and 69 percent said they were physically punished during childhood. The study identified a significant association between corporal punishment during childhood and violence toward dating partners in adulthood. Specifically, people who got spanked as kids had a 29 percent higher risk for perpetrating dating violence, the findings showed.""><b>Finding B:</b></span> The study identified a significant association between corporal punishment during childhood and violence toward dating partners in adulthood.<br><span id=""hover_text_news"" data-toggle=""tooltip"" data-html=""true"" data-placement=""bottom"" title=""Context: The research may have applications in a clinical setting for protecting premature infants from a range of intestinal diseases including necrotizing enterocolitis (NEC), a condition that is the second most common cause of death among premature infants in the United States. The researchers emphasized that the finding does not suggest that breast milk from mothers without an active copy of the gene is less nourishing or healthy. Rather, it conveys the subtle and elegant choreography of one part of the human microbiome: The relationships between the mothers\' genetics, the composition of her breast milk and the development of thier infants\' gut microbiota.""><b>Finding C:</b></span> The researchers emphasized that the finding does not suggest that breast milk from mothers without an active copy of the gene is less nourishing or healthy.<br><span id=""hover_text_news"" data-toggle=""tooltip"" data-html=""true"" data-placement=""bottom"" title=""Context: Metabolic phenotyping of plasma could be used to detect lung cancer in Belgian cohort. ""><b>Finding D:</b></span> Metabolic phenotyping of plasma could be used to detect lung cancer in Belgian cohort. "
Medicine_tweet_150_p$Medicine_tweet_30_p$Medicine_tweet_136_r$Medicine_353_p	"<span id=""hover_text_paper"" data-toggle=""tooltip"" data-html=""true"" data-placement=""bottom"" title=""Context: However, significantly reduced risk of development of islet autoimmunity was associated with increased intake of omega-3 fatty acids among youth genetically susceptible to development of type 1 diabetes (36), although continued follow-up did not reveal subsequent protection against incident type 1 diabetes (37). Our study suggests that long-chain omega-3 fatty acids may provide protection to the b-cell after clinical diagnosis of type 1 diabetes. Our results support further study of the potential role of branched-chain amino acids to enhance sustained insulin production in type 1 diabetes.""><b>Finding A:</b></span> Our study suggests that long-chain omega-3 fatty acids may provide protection to the b-cell after clinical diagnosis of type 1 diabetes.<br><span id=""hover_text_paper"" data-toggle=""tooltip"" data-html=""true"" data-placement=""bottom"" title=""Context: Acute hormonal responses were correlated with gains in lean body mass (LBM), muscle fibre cross-sectional area (CSA) and leg press strength. There were no significant correlations between the exercise-induced elevations (area under the curve-AUC) of GH, fT and IGF-1 and gains in LBM or leg press strength. Significant correlations were found for cortisol, usually assumed to be a hormone indicative of catabolic drive, AUC with change in LBM (r = 0.29, P \\ 0.05) and type II fibre CSA (r = 0.35, P \\ 0.01) as well as GH AUC and gain in fibre area (type I: r = 0.36, P = 0.006; type II: r = 0.28, P = 0.04, but not lean mass).""><b>Finding B:</b></span> Acute hormonal responses were correlated with gains in lean body mass (LBM), muscle fibre cross-sectional area (CSA) and leg press strength.<br><span id=""hover_text_news"" data-toggle=""tooltip"" data-html=""true"" data-placement=""bottom"" title=""Context: Association of Prenatal Exposure to Air Pollution With Autism  and some media:  It\'s complicated: ""><b>Finding C:</b></span> Association of Prenatal Exposure to Air Pollution With Autism  and some media:  It\'s complicated: <br><span id=""hover_text_paper"" data-toggle=""tooltip"" data-html=""true"" data-placement=""bottom"" title=""Context: The splint metacarpals, previously interpreted as reduced digits II and IV, also contain remnants of digits I and V compressed as ridges onto the ventral surface. Our proposed locations of the proximal metacarpals are confirmed by their carpal articulations, which are consistent with those of the pentadactyl Phenacodus. The tridactyl equid Mesohippus shares the ventral ridges on the side digit bones, many of which appear to have a distinct fusion line, and exhibits a lesser degree of digit reduction than previously thought.""><b>Finding D:</b></span> Our proposed locations of the proximal metacarpals are confirmed by their carpal articulations, which are consistent with those of the pentadactyl Phenacodus."
Medicine_373_r$Medicine_tweet_92_r$Medicine_tweet_213_r$Medicine_tweet_63_p	"<span id=""hover_text_news"" data-toggle=""tooltip"" data-html=""true"" data-placement=""bottom"" title=""Context: Titze and his colleagues realized that immune cells arriving in wounded skin to fight infections were entering a salty microenvironment. Salt increased the microbe-killing capacity of the immune cells, the team reports; the macrophages exposed to high levels of sodium chloride released significantly more microbicidal molecules than those that grew in a culture medium without salt. After 24 hours, the E. coli load in macrophages exposed to high sodium chloride levels was less than half of that of macrophages cultured without salt, and L. major infections were down as well.""><b>Finding A:</b></span> Salt increased the microbe-killing capacity of the immune cells, the team reports; the macrophages exposed to high levels of sodium chloride released significantly more microbicidal molecules than those that grew in a culture medium without salt.<br><span id=""hover_text_news"" data-toggle=""tooltip"" data-html=""true"" data-placement=""bottom"" title=""Context: Latest from @username, up to 70% of our #arctic infrastructure is at risk of #climatechange induced permafrost degradation, affecting over 4 million people.\n\nI\'m getting a sinking feeling about all of this!\n\n  ""><b>Finding B:</b></span> Latest from @username, up to 70% of our #arctic infrastructure is at risk of #climatechange induced permafrost degradation, affecting over 4 million people.\n\nI\'m getting a sinking feeling about all of this!\n\n  <br><span id=""hover_text_news"" data-toggle=""tooltip"" data-html=""true"" data-placement=""bottom"" title=""Context: Yes. Food ads do make you fatter.  #diet #nutrition #food""><b>Finding C:</b></span> Yes. Food ads do make you fatter.  #diet #nutrition #food<br><span id=""hover_text_paper"" data-toggle=""tooltip"" data-html=""true"" data-placement=""bottom"" title=""Context: These associations were confirmed by dose-response trends, even after excluding non-users. Our unique findings do not support the hypothesis of adverse effects on children\'s language, communication and motor skills due to maternal cell phone use during gestation. Nevertheless, in the Spanish study cell phone users had children who scored higher in the Bayley mental scale and in the Danish study there was a trend for lower risk for cognitive/language delay at 6 months [ .""><b>Finding D:</b></span> Our unique findings do not support the hypothesis of adverse effects on children\'s language, communication and motor skills due to maternal cell phone use during gestation."
Medicine_94_p$Medicine_456_p$Medicine_tweet_34_p$Medicine_tweet_173_r	"<span id=""hover_text_paper"" data-toggle=""tooltip"" data-html=""true"" data-placement=""bottom"" title=""Context: 6 This study showed that when analysis was restricted to populations with observation-derived 10-year cardiovascular event rate estimates of 10% or more, aspirin use was associated with an absolute risk decrease of 0.51% (5% CI, 0.06%-0.3%) for the cardiovascular composite outcome, but an absolute risk increase of 0.64% (5% CI, 0.35%-0.7%) for major bleeding. The current study demonstrates that the absolute risk reduction for cardiovascular events and absolute risk increase for major bleeding associated with aspirin use were of similar magnitude. Aspirin use was not associated with a reduction in cardiovascular mortality, and deaths due to bleeding were rare.""><b>Finding A:</b></span> The current study demonstrates that the absolute risk reduction for cardiovascular events and absolute risk increase for major bleeding associated with aspirin use were of similar magnitude.<br><span id=""hover_text_paper"" data-toggle=""tooltip"" data-html=""true"" data-placement=""bottom"" title=""Context: Even Alicia\'s narrative contains some of the apparently coercive features of anal sex that other women report in negative terms, despite Alicia reporting enjoying anal sex. Fourth, anal sex today appears to be a marker of (hetero)sexual achievement or experience, particularly for men. The society which our interviewees inhabit seems to reward men for sexual experience per se (\'every hole\'s a goal\') and, to some extent, rewards women for compliance with sexually \'adventurous\' acts (enjoyment signifying not being naive, unrelaxed, etc), although women must balance this with the risk to their reputation.""><b>Finding B:</b></span> Fourth, anal sex today appears to be a marker of (hetero)sexual achievement or experience, particularly for men.<br><span id=""hover_text_paper"" data-toggle=""tooltip"" data-html=""true"" data-placement=""bottom"" title=""Context: In addition, we demonstrated that these CD8 + CD28 − T cells reside within the liver and are more numerous in the liver of aged and HFD-fed mice. These suggest that T-cell senescence-mediated reprogramming of metabolic pathways may be associated with development of diabetes and its complications, as well as other aging-related diseases. • In conclusion, we identified a link between the numbers and secretion of effector molecules by senescent T cells, and blood glucose status, in humans and mice.""><b>Finding C:</b></span> These suggest that T-cell senescence-mediated reprogramming of metabolic pathways may be associated with development of diabetes and its complications, as well as other aging-related diseases.<br><span id=""hover_text_news"" data-toggle=""tooltip"" data-html=""true"" data-placement=""bottom"" title=""Context: Researchers at Penn State have identified the major steps in the process used by plant cells to create cellulose:  CSI1 interacts with the exocyst complex, which is involved in transporting materials to the plasma membrane &amp; protein called PATROL1 #plantsci ""><b>Finding D:</b></span> Researchers at Penn State have identified the major steps in the process used by plant cells to create cellulose:  CSI1 interacts with the exocyst complex, which is involved in transporting materials to the plasma membrane &amp; protein called PATROL1 #plantsci "
Medicine_tweet_58_p$Medicine_234_p$Medicine_tweet_173_p$Medicine_tweet_69_p	"<span id=""hover_text_paper"" data-toggle=""tooltip"" data-html=""true"" data-placement=""bottom"" title=""Context: Our findings are consistent with similarly published data. We found that, similarly to the cerebral volume, the bilateral frontal and left temporal lobe volumes increased with age in all children. Interestingly, the right frontal and right temporal lobe volumes differed significantly between patients and controls, and this persisted over time, with controls having higher volumes than patients.""><b>Finding A:</b></span> We found that, similarly to the cerebral volume, the bilateral frontal and left temporal lobe volumes increased with age in all children.<br><span id=""hover_text_paper"" data-toggle=""tooltip"" data-html=""true"" data-placement=""bottom"" title=""Context: Finally, ABHD12 -/mice that survived the initial exaggerated immune response (~days 8-15) displayed a gradual reduction in viral titers in the serum and lung over the ensuing weeks (Fig. Taken together, these data indicate that the inactivation of ABHD12 promotes increased lung ) , regulated on activation, normal T cell expressed and secreted. e, ABHD12 -/mice kill adoptively transferred splenocytes displaying LCMV-specific antigen (GP33-41) more efficiently than ABHD12 +/+ mice.""><b>Finding B:</b></span> Taken together, these data indicate that the inactivation of ABHD12 promotes increased lung ) , regulated on activation, normal T cell expressed and secreted.<br><span id=""hover_text_paper"" data-toggle=""tooltip"" data-html=""true"" data-placement=""bottom"" title=""Context: Therefore, delivery of CSCs to discrete sites at the plasma membrane is critical for cellulose synthesis. We propose that CSI1 plays a role in marking the docking site, which allows CSCs-containing vesicles access to the plasma membrane through its interaction with microtubules. PATROL1 assists in exocytosis by its interaction with multiple components, including CSI1, CSCs, and exocyst subunits.""><b>Finding C:</b></span> Therefore, delivery of CSCs to discrete sites at the plasma membrane is critical for cellulose synthesis.<br><span id=""hover_text_paper"" data-toggle=""tooltip"" data-html=""true"" data-placement=""bottom"" title=""Context: The ambient noise environment could also affect vocal learning, as young animals exposed to elevated noise may hear adjusted calls from conspecifics . In addition to modifying the shape, dolphin whistles were also higher frequency during increased broadband and 2.5 kHz TOL ambient noise immediately prior to the call. Increased low-frequency ambient noise may be causing dolphins to change their vocalization behaviour to avoid or compensate for masking.""><b>Finding D:</b></span> In addition to modifying the shape, dolphin whistles were also higher frequency during increased broadband and 2.5 kHz TOL ambient noise immediately prior to the call."
Medicine_353_r$Medicine_tweet_32_r$Medicine_tweet_111_r$Medicine_19_r	"<span id=""hover_text_news"" data-toggle=""tooltip"" data-html=""true"" data-placement=""bottom"" title=""Context: Fragments of the \'missing\' digits can be found in the form of ridges on the backside of the splints."" According to the team, this demonstrates that the first and fifth digits were not simply lost to evolution, but attached to their neighboring second and fourth digits. ""With a distinct surface from the metacarpal, we know the splints on today\'s horses to be the remnants of the second and fourth digits,"" Professor Solounias said.""><b>Finding A:</b></span> According to the team, this demonstrates that the first and fifth digits were not simply lost to evolution, but attached to their neighboring second and fourth digits.<br><span id=""hover_text_news"" data-toggle=""tooltip"" data-html=""true"" data-placement=""bottom"" title=""Context: New @username study suggests that state efforts to remove barriers to using #telehealth might not be sufficient for increasing use, and new incentives for providers and consumers to adopt and use telehealth may be needed.  @username""><b>Finding B:</b></span> New @username study suggests that state efforts to remove barriers to using #telehealth might not be sufficient for increasing use, and new incentives for providers and consumers to adopt and use telehealth may be needed.  @username<br><span id=""hover_text_news"" data-toggle=""tooltip"" data-html=""true"" data-placement=""bottom"" title=""Context: Feed &amp; satiety response in INFANTS linked to obesity in childhood, this is where prevention begins @username .""><b>Finding C:</b></span> Feed &amp; satiety response in INFANTS linked to obesity in childhood, this is where prevention begins @username .<br><span id=""hover_text_news"" data-toggle=""tooltip"" data-html=""true"" data-placement=""bottom"" title=""Context: The research follows an earlier study which suggested that elevated long-term levels of cortisol may reduce the likelihood of a successful outcome for patients trying to conceive by IVF. However, many factors influence cortisol (including physical activity, sleep and some aspects of our diet such as caffeine) and so it is possible that any or all of these factors may account for the effects of cortisol on pregnancy."" If this is proven with further solid research it may modify our approach to pre-IVF testing in all patients.""><b>Finding D:</b></span> The research follows an earlier study which suggested that elevated long-term levels of cortisol may reduce the likelihood of a successful outcome for patients trying to conceive by IVF."
Medicine_tweet_75_p$Medicine_21_p$Medicine_87_r$Medicine_tweet_59_r	"<span id=""hover_text_paper"" data-toggle=""tooltip"" data-html=""true"" data-placement=""bottom"" title=""Context: The concentration of aluminium in each of the 30 infant formulas is at least twice that which is recommended in the European Union for drinking water (50 μg/L) and in 14 of the milks it exceeds the maximum admissible level for drinking water of 200 μg/L . We consider that the aluminium content of all infant formulas investigated herein is too high and especially so considering that these products constitute either all or a substantial proportion of an infant\'s diet in the first months of their lives. Based upon the criteria for drinking water they are not fit for human consumption and they contravene article 5 of the Food Safety Act which states that \'infant formulas should not contain anything which might endanger the health of infants and young children\' .""><b>Finding A:</b></span> We consider that the aluminium content of all infant formulas investigated herein is too high and especially so considering that these products constitute either all or a substantial proportion of an infant\'s diet in the first months of their lives.<br><span id=""hover_text_paper"" data-toggle=""tooltip"" data-html=""true"" data-placement=""bottom"" title=""Context: Here we report evidence that late-summer sea surface temperature and geopotential height anomalies close to New Zealand exhibit higher correlation with SWUS winter precipitation than ENSO, enhancing the potential for earlier and more accurate prediction. Analysis also shows an amplification of this new teleconnection over the past four decades. Our work highlights the need to understand the dynamic nature of the coupled ocean-atmosphere system in a changing climate for improving future predictions of regional precipitation.""><b>Finding B:</b></span> Analysis also shows an amplification of this new teleconnection over the past four decades.<br><span id=""hover_text_news"" data-toggle=""tooltip"" data-html=""true"" data-placement=""bottom"" title=""Context: This may have happened, the researchers surmise, because consumers wanted to get their ""money\'s worth"" - that is, they consumed more of the refill since they had already paid for it. But data from two additional experiments indicate that this unintended increase in consumption can be dampened somewhat by requiring people to get the refills themselves. ""Taken together, these results suggest that this method of complying with a sugary-drink portion limit could have the perverse effect of increasing consumption,"" the researchers write.""><b>Finding C:</b></span> But data from two additional experiments indicate that this unintended increase in consumption can be dampened somewhat by requiring people to get the refills themselves.<br><span id=""hover_text_news"" data-toggle=""tooltip"" data-html=""true"" data-placement=""bottom"" title=""Context: In our latest @username funded study in @username, people with severe obesity &amp; diabetes who had bariatric surgery were associated with 40% lower 5-year risk of heart attack and stroke than matched people who got usual medical care  ""><b>Finding D:</b></span> In our latest @username funded study in @username, people with severe obesity &amp; diabetes who had bariatric surgery were associated with 40% lower 5-year risk of heart attack and stroke than matched people who got usual medical care  "
Medicine_tweet_27_r$Medicine_tweet_8_p$Medicine_tweet_153_p$Medicine_16_p	"<span id=""hover_text_news"" data-toggle=""tooltip"" data-html=""true"" data-placement=""bottom"" title=""Context: Amygdala encodes subjective judgment of emotions shown in face stimuli, rather than simply their stimulus features: ""><b>Finding A:</b></span> Amygdala encodes subjective judgment of emotions shown in face stimuli, rather than simply their stimulus features: <br><span id=""hover_text_paper"" data-toggle=""tooltip"" data-html=""true"" data-placement=""bottom"" title=""Context: Recognizing that cell biology is not uniform, especially in the lower urinary tract of females and males, is crucial for providing context and relevance for diverse fields of biomedical investigation. This review serves to characterize the current understanding of biological sex differences between female and male lower urinary tracts, while identifying areas for future research. First, the differences in overall cell populations are discussed in the detrusor smooth muscle, urothelium, and trigone.""><b>Finding B:</b></span> This review serves to characterize the current understanding of biological sex differences between female and male lower urinary tracts, while identifying areas for future research.<br><span id=""hover_text_paper"" data-toggle=""tooltip"" data-html=""true"" data-placement=""bottom"" title=""Context: • Prophylaxis improved function, quality of life, activity and pain but not joint structure by MRI. Conclusions: Over a period of 3 years, prophylaxis versus OD in adults with severe hemophilia A and arthropathy led to decreased bleeding, pain, and HRU, better joint health, activity, satisfaction, and HRQoL, but no reduction in structural arthropathy progression, suggesting that preexisting joint arthropathy may be irreversible. • Prophylaxis improved function, quality of life, activity and pain but not joint structure by MRI.""><b>Finding C:</b></span> Conclusions: Over a period of 3 years, prophylaxis versus OD in adults with severe hemophilia A and arthropathy led to decreased bleeding, pain, and HRU, better joint health, activity, satisfaction, and HRQoL, but no reduction in structural arthropathy progression, suggesting that preexisting joint arthropathy may be irreversible.<br><span id=""hover_text_paper"" data-toggle=""tooltip"" data-html=""true"" data-placement=""bottom"" title=""Context: In total, 4 of the 20 mature white fringetrees I examined over this period showed symptoms of emerald ash borer attack. Removal of bark from one of these trees yielded evidence of three generations of usage by emerald ash borer, a dead adult, and live emerald ash borer larvae. Some of the other trees I examined may have contained feeding larvae for the first time in 2014 and whose damage was not yet apparent externally.""><b>Finding D:</b></span> Removal of bark from one of these trees yielded evidence of three generations of usage by emerald ash borer, a dead adult, and live emerald ash borer larvae."
