id	text
Medicine_128_r$Medicine_36_p$Medicine_279_r$Medicine_tweet_76_r	"<span id=""hover_text_news"" data-toggle=""tooltip"" data-html=""true"" data-placement=""bottom"" title=""Context: Self-efficacy and support\n\nThe result: support from their partners is helpful to smokers who wish to stop and it increases their chances of success, provided that they have developed skills of their own that help them to abstain. Such support could involve their partner reminding them of their plan to quit as well as encouraging and supporting them in critical situations. Careful planning\n\nThe same is true of the coping strategies that the smoker plans to apply in difficult situations (for instance, taking a chewing gum or being reminded of one\'s wish to quit when spending an evening in the company of smokers and feeling an uncontrollable craving for a cigarette).""><b>Finding A:</b></span> Self-efficacy and support\n\nThe result: support from their partners is helpful to smokers who wish to stop and it increases their chances of success, provided that they have developed skills of their own that help them to abstain.<br><span id=""hover_text_paper"" data-toggle=""tooltip"" data-html=""true"" data-placement=""bottom"" title=""Context: This is a limitation that is inherent in the prognosis literature that we hope will be overcome in the future by improved quality of reporting. Our study had a number of strengths. The hypothesis-generating nature of this study allowed for the identification of prognostic factors that are potentially modifiable in the preoperative setting, which could lead to better surgical outcomes for older adults undergoing elective surgery.""><b>Finding B:</b></span> Our study had a number of strengths.<br><span id=""hover_text_news"" data-toggle=""tooltip"" data-html=""true"" data-placement=""bottom"" title=""Context: As for your eating after your workout, there is really no time constraint -- but you should definitely eat when you\'re hungry. Whether you decide to eat 30 minutes or two hours after your workout, Agnani stressed that this meal is just as important as the one you had before hitting the gym. ""Eating after your workout is important, as muscle repair continues,"" she wrote.""><b>Finding C:</b></span> Whether you decide to eat 30 minutes or two hours after your workout, Agnani stressed that this meal is just as important as the one you had before hitting the gym.<br><span id=""hover_text_news"" data-toggle=""tooltip"" data-html=""true"" data-placement=""bottom"" title=""Context: Drug Delivers Estrogen Selectively to the Brain to Treat Neurological Disorders #SciTM  via @username @username""><b>Finding D:</b></span> Drug Delivers Estrogen Selectively to the Brain to Treat Neurological Disorders #SciTM  via @username @username"
Medicine_tweet_58_p$Medicine_443_r$Medicine_170_r$Medicine_419_p	"<span id=""hover_text_paper"" data-toggle=""tooltip"" data-html=""true"" data-placement=""bottom"" title=""Context: Our findings are consistent with similarly published data. We found that, similarly to the cerebral volume, the bilateral frontal and left temporal lobe volumes increased with age in all children. Interestingly, the right frontal and right temporal lobe volumes differed significantly between patients and controls, and this persisted over time, with controls having higher volumes than patients.""><b>Finding A:</b></span> We found that, similarly to the cerebral volume, the bilateral frontal and left temporal lobe volumes increased with age in all children.<br><span id=""hover_text_news"" data-toggle=""tooltip"" data-html=""true"" data-placement=""bottom"" title=""Context: However, some perplexing pieces of the puzzle remained, as two people with exactly the same genetic makeup can still differ markedly regarding how bitter certain foods and liquids taste to them. Now, findings from Monell reveal that a person\'s sensitivity to bitter taste is shaped not only by which taste genes that person has, but also by how much messenger RNA -- the gene\'s instruction guide that tells a taste cell to build a specific receptor - their cells make. The findings add a new level of complexity to the understanding of the cellular mechanisms of taste perception, which may ultimately lend insight into individual differences in food preferences and dietary choices.""><b>Finding B:</b></span> Now, findings from Monell reveal that a person\'s sensitivity to bitter taste is shaped not only by which taste genes that person has, but also by how much messenger RNA -- the gene\'s instruction guide that tells a taste cell to build a specific receptor - their cells make.<br><span id=""hover_text_news"" data-toggle=""tooltip"" data-html=""true"" data-placement=""bottom"" title=""Context: They were particularly interested in studying mutations to the ANO7 gene because their previous research suggested this could be a gene of interest for prostate cancer. ""We found that small genetic changes to the ANO7 gene increase a patient\'s risk of aggressive prostate cancer. Genetic testing for ANO7 could help identify these patients sooner and may bring new opportunities for precision oncology in prostate cancer,"" says the leading author of the study, Professor Johanna Schleutker from the Institute of Biomedicine of the University of Turku, Finland.""><b>Finding C:</b></span> ""We found that small genetic changes to the ANO7 gene increase a patient\'s risk of aggressive prostate cancer.<br><span id=""hover_text_paper"" data-toggle=""tooltip"" data-html=""true"" data-placement=""bottom"" title=""Context: Thus, we propose that maternal cortisol levels might mediate the relation between MSDP and offspring ND. Given evidence for more pronounced MSDP-offspring smoking links in daughters (12-14, 16,17,19,24) and for sex differences in prenatal glucocorticoid levels (59) and offspring outcomes after prenatal glucocorticoid exposure (60), we also hypothesized that links between prenatal glucocorticoids and offspring ND would be stronger for daughters. showed associations between fetal testosterone exposure and alterations in responsiveness of neural reward regions and behavioral approach tendencies, both of which have been associated with ND .""><b>Finding D:</b></span> Given evidence for more pronounced MSDP-offspring smoking links in daughters (12-14, 16,17,19,24) and for sex differences in prenatal glucocorticoid levels (59) and offspring outcomes after prenatal glucocorticoid exposure (60), we also hypothesized that links between prenatal glucocorticoids and offspring ND would be stronger for daughters."
Medicine_92_p$Medicine_13_p$Medicine_tweet_14_r$Medicine_tweet_66_p	"<span id=""hover_text_paper"" data-toggle=""tooltip"" data-html=""true"" data-placement=""bottom"" title=""Context: Performing oral sex increases the risk of oral HPV infection, and the risk increases with the number of partners. Awareness of this link between sexual behavior, oral HPV infection, and cancer may cause concern for patients who have HPV-positive OSCC and their partners. Strong associations are observed between sexual behavior, oral HPV infection, and oropharyngeal cancer.""><b>Finding A:</b></span> Awareness of this link between sexual behavior, oral HPV infection, and cancer may cause concern for patients who have HPV-positive OSCC and their partners.<br><span id=""hover_text_paper"" data-toggle=""tooltip"" data-html=""true"" data-placement=""bottom"" title=""Context: Until such findings are confirmed, however, we strongly would caution about drawing impulsive, thoughtless or potentially stigmatizing conclusions about members of such groups . Despite the null findings identified in the present study, history gives us reason to suspect the idea that violent video games drives aggressive behaviour will remain an unsettled question for parents, pundits and policy-makers. Although our results do have implications for these stakeholders, the present work holds special significance for those studying technology effects, in general, and video games, in particular.""><b>Finding B:</b></span> Despite the null findings identified in the present study, history gives us reason to suspect the idea that violent video games drives aggressive behaviour will remain an unsettled question for parents, pundits and policy-makers.<br><span id=""hover_text_news"" data-toggle=""tooltip"" data-html=""true"" data-placement=""bottom"" title=""Context: Our new paper using MTurk finds no evidence that artificial monitoring cues influence online donations to charity ""><b>Finding C:</b></span> Our new paper using MTurk finds no evidence that artificial monitoring cues influence online donations to charity <br><span id=""hover_text_paper"" data-toggle=""tooltip"" data-html=""true"" data-placement=""bottom"" title=""Context: [31] Demonstrating the role that telehealth can play in achieving the Triple Aim of improving quality and health outcomes while lowering the cost of care could prove to be a powerful incentive for increased uptake. The use of telehealth increased dramatically in the period 2013-16 across all population groups. While we found evidence that populations with limited mobility (such as Medicare beneficiaries younger than age sixty-five and people with selfreported physical or mental health concerns that limit their activities) were among the highest users, key underserved populations (including Medicaid, low-income, and rural populations) had significantly lower use of telehealth.""><b>Finding D:</b></span> The use of telehealth increased dramatically in the period 2013-16 across all population groups."
Medicine_53_p$Medicine_tweet_136_r$Medicine_29_r$Medicine_tweet_213_r	"<span id=""hover_text_paper"" data-toggle=""tooltip"" data-html=""true"" data-placement=""bottom"" title=""Context: Furthermore, we observed excellent tumor accumulation of the nanoparticles. Lastly, a tumor could be established in the egg using tumor samples from ovarian cancer patients and that our nanoparticles were effective in eliminating the tumor. These results point to the remarkable efficacy of our nanoparticle based drug delivery system and suggests the value of the chicken egg tumor model for testing novel therapies for ovarian cancer.""><b>Finding A:</b></span> Lastly, a tumor could be established in the egg using tumor samples from ovarian cancer patients and that our nanoparticles were effective in eliminating the tumor.<br><span id=""hover_text_news"" data-toggle=""tooltip"" data-html=""true"" data-placement=""bottom"" title=""Context: Association of Prenatal Exposure to Air Pollution With Autism  and some media:  It\'s complicated: ""><b>Finding B:</b></span> Association of Prenatal Exposure to Air Pollution With Autism  and some media:  It\'s complicated: <br><span id=""hover_text_news"" data-toggle=""tooltip"" data-html=""true"" data-placement=""bottom"" title=""Context: The strongest risk factors--disrupted sleep, having a mood disorder and living in a home with a single caregiver--are not necessarily associated with ASD. ""Our results underscore the importance of a multidisciplinary approach to the assessment and treatment of children and adolescents with ASD that addresses behavioral, psychological and psychiatric, adaptive, sleep and medical functioning in order to decrease behavioral crises and the utilization of inpatient psychiatric services,"" Righi and co-authors wrote in the study published in Journal of Autism and Developmental Disorders. By employing statistical analysis techniques, the researchers were able to isolate risk factors that were independently and significantly associated with the risk of hospitalization.""><b>Finding C:</b></span> ""Our results underscore the importance of a multidisciplinary approach to the assessment and treatment of children and adolescents with ASD that addresses behavioral, psychological and psychiatric, adaptive, sleep and medical functioning in order to decrease behavioral crises and the utilization of inpatient psychiatric services,"" Righi and co-authors wrote in the study published in Journal of Autism and Developmental Disorders.<br><span id=""hover_text_news"" data-toggle=""tooltip"" data-html=""true"" data-placement=""bottom"" title=""Context: Yes. Food ads do make you fatter.  #diet #nutrition #food""><b>Finding D:</b></span> Yes. Food ads do make you fatter.  #diet #nutrition #food"
Medicine_240_r$Medicine_tweet_244_r$Medicine_tweet_137_p$Medicine_tweet_163_p	"<span id=""hover_text_news"" data-toggle=""tooltip"" data-html=""true"" data-placement=""bottom"" title=""Context: ""The Society\'s recommendations allow physicians to make the diagnosis if clear symptoms are present without resorting to universal hormone tests or ultrasound screening."" In the CPG, The Endocrine Society recommends that a diagnosis be made if adult women have two of the three cardinal features of PCOS (diagnostic criteria supported by the NIH panel): * Excess production of male hormones called androgens. Other recommendations from the CPG include:\n\n* Because women with PCOS face an increased risk of pregnancy complications such as gestational diabetes, preterm delivery and preeclampsia that can be exacerbated by obesity, women should have their body mass index, blood pressure and oral glucose tolerance assessed prior to conceiving;\n\n* Following diagnosis, women with PCOS should be examined for skin and hair complications including excess hair growth and acne;\n\n* Although women with PCOS have some of the same risk factors associated with the development of endometrial cancer, they should not routinely undergo ultrasound screening for endometrial thickness;\n\n* To gauge metabolic risk, adolescents and adult women with PCOS should be screened for increased obesity using body mass index and waist circumference measurements;\n\n* Clinicians should give adolescents and adult women with PCOS an oral glucose tolerance test to check for type 2 diabetes or impaired glucose tolerance because they are at increased risk of these conditions; and\n\n* Initial treatment of type 2 diabetes or impaired glucose tolerance in women with PCOS should be diet and exercise, with metformin as a second-line therapy.""><b>Finding A:</b></span> Other recommendations from the CPG include:\n\n* Because women with PCOS face an increased risk of pregnancy complications such as gestational diabetes, preterm delivery and preeclampsia that can be exacerbated by obesity, women should have their body mass index, blood pressure and oral glucose tolerance assessed prior to conceiving;\n\n* Following diagnosis, women with PCOS should be examined for skin and hair complications including excess hair growth and acne;\n\n* Although women with PCOS have some of the same risk factors associated with the development of endometrial cancer, they should not routinely undergo ultrasound screening for endometrial thickness;\n\n* To gauge metabolic risk, adolescents and adult women with PCOS should be screened for increased obesity using body mass index and waist circumference measurements;\n\n* Clinicians should give adolescents and adult women with PCOS an oral glucose tolerance test to check for type 2 diabetes or impaired glucose tolerance because they are at increased risk of these conditions; and\n\n* Initial treatment of type 2 diabetes or impaired glucose tolerance in women with PCOS should be diet and exercise, with metformin as a second-line therapy.<br><span id=""hover_text_news"" data-toggle=""tooltip"" data-html=""true"" data-placement=""bottom"" title=""Context: Our new paper shows link between cuts to public health budgets and falling vaccination rates in Italy \n ""><b>Finding B:</b></span> Our new paper shows link between cuts to public health budgets and falling vaccination rates in Italy \n <br><span id=""hover_text_paper"" data-toggle=""tooltip"" data-html=""true"" data-placement=""bottom"" title=""Context: Overall, if the US had faced, over the past decade, the warmer climate that scientists predict for the future, our results show that much greater generation or storage capacity would have been needed. As such, even absent population and income changes, climate change will demand significant changes to the electric grid. ERCOT covers Texas only and can be thought of as more representative of warmer regions.""><b>Finding C:</b></span> As such, even absent population and income changes, climate change will demand significant changes to the electric grid.<br><span id=""hover_text_paper"" data-toggle=""tooltip"" data-html=""true"" data-placement=""bottom"" title=""Context: Women with below average HRV were significantly more likely to report sexual arousal dysfunction (p \\ .001) and overall sexual dysfunction (p \\ .001) than both women with average HRV and women with above average HRV. In conclusion, low HRV may be a risk factor for female sexual arousal dysfunction and overall sexual dysfunction. Given these findings, it is reasonable to expect ANS activity (indexed by HRV) may be related to women\'s self-reported, real-life sexual arousal function outside of the laboratory.""><b>Finding D:</b></span> In conclusion, low HRV may be a risk factor for female sexual arousal dysfunction and overall sexual dysfunction."
Medicine_43_p$Medicine_tweet_0_r$Medicine_283_p$Medicine_50_r	"<span id=""hover_text_paper"" data-toggle=""tooltip"" data-html=""true"" data-placement=""bottom"" title=""Context: Notably, hepatic Ago2-deficiency improves glucose metabolism in conditions of insulin receptor antagonist treatment, high-fat diet challenge, and hepatic AMPKα1-deletion. The regulation of energy metabolism by Ago2 provides a novel paradigm in which RNA silencing plays an integral role in determining basal metabolic activity in obesity-associated sequelae. Upon loading of Ago proteins with mature miRNAs produced by the endoribonuclease Dicer 18 , RISC represses the expression of targeted mRNA through RNA silencing .""><b>Finding A:</b></span> The regulation of energy metabolism by Ago2 provides a novel paradigm in which RNA silencing plays an integral role in determining basal metabolic activity in obesity-associated sequelae.<br><span id=""hover_text_news"" data-toggle=""tooltip"" data-html=""true"" data-placement=""bottom"" title=""Context: This meta-analysis confirms that use of #aspirin for primary prevention of #cardiovasculardisease is associated with a lower risk of CV events including CV mortality and nonfatal AMI and #stroke, and an increased risk of major bleeding.  ""><b>Finding B:</b></span> This meta-analysis confirms that use of #aspirin for primary prevention of #cardiovasculardisease is associated with a lower risk of CV events including CV mortality and nonfatal AMI and #stroke, and an increased risk of major bleeding.  <br><span id=""hover_text_paper"" data-toggle=""tooltip"" data-html=""true"" data-placement=""bottom"" title=""Context: Third, studies involving both sexes may be needed to clarify the sex-based differences in the effect of such exercise on the calcaneus QUS status. In conclusion, I observed how circuit training at home can improve the calcaneus QUS status, such as QUS-SI, QUS-SOS, and QUS-BUA, as well as build muscle while losing fat mass through easy sports activities among young females. These findings suggest that circuit training can help females attain significantly greater bone mass and muscle mass and may reduce their risk of osteoporosis or cardiovascular disease in later life.""><b>Finding C:</b></span> In conclusion, I observed how circuit training at home can improve the calcaneus QUS status, such as QUS-SI, QUS-SOS, and QUS-BUA, as well as build muscle while losing fat mass through easy sports activities among young females.<br><span id=""hover_text_news"" data-toggle=""tooltip"" data-html=""true"" data-placement=""bottom"" title=""Context: About 19 percent said they had committed some form of dating violence and 69 percent said they were physically punished during childhood. The study identified a significant association between corporal punishment during childhood and violence toward dating partners in adulthood. Specifically, people who got spanked as kids had a 29 percent higher risk for perpetrating dating violence, the findings showed.""><b>Finding D:</b></span> The study identified a significant association between corporal punishment during childhood and violence toward dating partners in adulthood."
Medicine_94_r$Medicine_41_r$Medicine_tweet_29_r$Medicine_240_p	"<span id=""hover_text_news"" data-toggle=""tooltip"" data-html=""true"" data-placement=""bottom"" title=""Context: They found that while it was associated with a lower risk of heart attacks and other cardiovascular events, it did lead to an increased risk of major bleeding. The results showed that:\n\nAspirin use was associated with an 11% lower risk of cardiovascular events. Approximately 250 patients needed to be treated with aspirin for 5 years to prevent a single heart attack, stroke or cardiovascular death.""><b>Finding A:</b></span> They found that while it was associated with a lower risk of heart attacks and other cardiovascular events, it did lead to an increased risk of major bleeding.<br><span id=""hover_text_news"" data-toggle=""tooltip"" data-html=""true"" data-placement=""bottom"" title=""Context: They found that while it was associated with a lower risk of heart attacks and other cardiovascular events, it did lead to an increased risk of major bleeding. The results showed that:\n\nAspirin use was associated with an 11% lower risk of cardiovascular events. Approximately 250 patients needed to be treated with aspirin for 5 years to prevent a single heart attack, stroke or cardiovascular death.""><b>Finding B:</b></span> They found that while it was associated with a lower risk of heart attacks and other cardiovascular events, it did lead to an increased risk of major bleeding.<br><span id=""hover_text_news"" data-toggle=""tooltip"" data-html=""true"" data-placement=""bottom"" title=""Context: Metabolic phenotyping of plasma could be used to detect lung cancer in Belgian cohort. ""><b>Finding C:</b></span> Metabolic phenotyping of plasma could be used to detect lung cancer in Belgian cohort. <br><span id=""hover_text_paper"" data-toggle=""tooltip"" data-html=""true"" data-placement=""bottom"" title=""Context: Women with PCOS should have BMI and blood pressure measured at each clinic visit (and consider waist circumference if nonobese; Ն 36 inches is abnormal), and upon diagnosis of PCOS, additional testing should include a complete fasting lipid profile (total cholesterol, LDL-cholesterol, non-HDL-cholesterol, HDL-cholesterol, and triglycerides). In addition, the nocturnal drop in mean arterial blood pressure is lower, a finding that has also been demonstrated in obese adolescents with PCOS . Another marker of atherosclerosis, coronary artery calcification, is more common in women with PCOS than in controls, even after adjusting for the effects of age and BMI .""><b>Finding D:</b></span> In addition, the nocturnal drop in mean arterial blood pressure is lower, a finding that has also been demonstrated in obese adolescents with PCOS ."
