id	text
Medicine_tweet_58_r$Medicine_tweet_29_p$Medicine_19_r$Medicine_tweet_120_p	"<span id=""hover_text_news"" data-toggle=""tooltip"" data-html=""true"" data-placement=""bottom"" title=""Context: A prospective study of cerebral, frontal &amp; temporal lobe volumes &amp; neuropsychol performance in children w cranial RT ""><b>Finding A:</b></span> A prospective study of cerebral, frontal &amp; temporal lobe volumes &amp; neuropsychol performance in children w cranial RT <br><span id=""hover_text_paper"" data-toggle=""tooltip"" data-html=""true"" data-placement=""bottom"" title=""Context: These findings indicate that lung cancer cells utilize at least some steps of the gluconeogenic pathway to adapt to low-glucose conditions as a result of insufficient blood flow. In conclusion, this paper validates 1 H-NMR metabolic phenotyping of blood plasma as a complementary tool to discriminate between patients with lung cancer and controls. Our findings indicate that metabolic alterations can already be detected in an early stage.""><b>Finding B:</b></span> In conclusion, this paper validates 1 H-NMR metabolic phenotyping of blood plasma as a complementary tool to discriminate between patients with lung cancer and controls.<br><span id=""hover_text_news"" data-toggle=""tooltip"" data-html=""true"" data-placement=""bottom"" title=""Context: The research follows an earlier study which suggested that elevated long-term levels of cortisol may reduce the likelihood of a successful outcome for patients trying to conceive by IVF. However, many factors influence cortisol (including physical activity, sleep and some aspects of our diet such as caffeine) and so it is possible that any or all of these factors may account for the effects of cortisol on pregnancy."" If this is proven with further solid research it may modify our approach to pre-IVF testing in all patients.""><b>Finding C:</b></span> The research follows an earlier study which suggested that elevated long-term levels of cortisol may reduce the likelihood of a successful outcome for patients trying to conceive by IVF.<br><span id=""hover_text_paper"" data-toggle=""tooltip"" data-html=""true"" data-placement=""bottom"" title=""Context: 19, 22 Increasing adoption of additional primary prevention strategies, such as risk factor modification and development of public health initiatives, may limit the applicability of earlier studies to current practice. In this meta-analysis, the use of aspirin in individuals without cardiovascular disease was associated with a lower risk of cardiovascular events and an increased risk of major bleeding. This information may inform discussions with patients about aspirin for primary prevention of cardiovascular events and bleeding.""><b>Finding D:</b></span> In this meta-analysis, the use of aspirin in individuals without cardiovascular disease was associated with a lower risk of cardiovascular events and an increased risk of major bleeding."
Medicine_417_p$Medicine_106_p$Medicine_35_r$Medicine_7_p	"<span id=""hover_text_paper"" data-toggle=""tooltip"" data-html=""true"" data-placement=""bottom"" title=""Context: Further, pride is specific to audience valuation: Emotions that co-activate with pride, such as happiness and excitement, do not track audience valuation uniquely and reliably. This suggests that pride, rather than other positive emotions, is distinctively involved in social valuation. Further evidence to demonstrate domain-specificity is needed, however.""><b>Finding A:</b></span> This suggests that pride, rather than other positive emotions, is distinctively involved in social valuation.<br><span id=""hover_text_paper"" data-toggle=""tooltip"" data-html=""true"" data-placement=""bottom"" title=""Context: The concentration of aluminium in each of the 30 infant formulas is at least twice that which is recommended in the European Union for drinking water (50 μg/L) and in 14 of the milks it exceeds the maximum admissible level for drinking water of 200 μg/L . We consider that the aluminium content of all infant formulas investigated herein is too high and especially so considering that these products constitute either all or a substantial proportion of an infant\'s diet in the first months of their lives. Based upon the criteria for drinking water they are not fit for human consumption and they contravene article 5 of the Food Safety Act which states that \'infant formulas should not contain anything which might endanger the health of infants and young children\' .""><b>Finding B:</b></span> We consider that the aluminium content of all infant formulas investigated herein is too high and especially so considering that these products constitute either all or a substantial proportion of an infant\'s diet in the first months of their lives.<br><span id=""hover_text_news"" data-toggle=""tooltip"" data-html=""true"" data-placement=""bottom"" title=""Context: MRN starts a domino effect, activating histones on surrounding chromosomes, which summons a cascade of additional proteins, resulting in a cell-wide, all-hands-on-deck alarm to help mend the DNA. This provides an elegant mechanism to neutralize viral replication without jeopardizing cellular viability. Image: Courtesy of the Salk Institute for Biological Studies\n\n""What\'s interesting is that even a single break transmits a global signal through the cell, halting cell division and growth,"" says O\'Shea.""><b>Finding C:</b></span> This provides an elegant mechanism to neutralize viral replication without jeopardizing cellular viability.<br><span id=""hover_text_paper"" data-toggle=""tooltip"" data-html=""true"" data-placement=""bottom"" title=""Context: A group of Finnish women consuming >71 g of apple/d experienced a 43% reduction in coronary mortality compared to women who did not eat apples. In men, the risk reduction was 19% in the group consuming >54 g compared to no apple intake . These findings were consistent with prior data showing reduced coronary mortality in elderly Dutch men (65-84 y) who consumed apples (average 69 g/d) compared to men who had little or no apple intake .""><b>Finding D:</b></span> In men, the risk reduction was 19% in the group consuming >54 g compared to no apple intake ."
Medicine_410_p$Medicine_234_r$Medicine_tweet_50_p$Medicine_5_r	"<span id=""hover_text_paper"" data-toggle=""tooltip"" data-html=""true"" data-placement=""bottom"" title=""Context: In addition to the possibility that the drag coefficient might be modulated mid-air by altering the angle of attack, T. rapicauda may be able to move horizontally, thereby adjusting its glide path to permit the selection of specific landing surfaces. We show that landing on plant surfaces following escapeinduced jumps can result in very high impact forces that challenge adhesive capacity, but that these are mitigated by the bending of the leaf and petiole. Increased understanding of how geckos interact with plant surfaces will yield new insights into how innovations facilitate and/or limit extreme behaviours.""><b>Finding A:</b></span> We show that landing on plant surfaces following escapeinduced jumps can result in very high impact forces that challenge adhesive capacity, but that these are mitigated by the bending of the leaf and petiole.<br><span id=""hover_text_news"" data-toggle=""tooltip"" data-html=""true"" data-placement=""bottom"" title=""Context: The rise wasn\'t as great as that seen in the ABHD12-knockout mice, and even four weeks of treatment with the inhibitor appeared to cause only slight hearing defects -- nothing like the profound defects experienced by PHARC patients. However, in further experiments conducted by the laboratory of study co-senior author John Teijaro, an assistant professor in the Department of Immunology and Microbiology at Scripps Research, it was clear that the reduction in ABHD12 activity had a big effect on the mouse immune system. Ordinary mice infected with LCMV clone 13 typically have minor symptoms but take a long time to clear the infection.""><b>Finding B:</b></span> However, in further experiments conducted by the laboratory of study co-senior author John Teijaro, an assistant professor in the Department of Immunology and Microbiology at Scripps Research, it was clear that the reduction in ABHD12 activity had a big effect on the mouse immune system.<br><span id=""hover_text_paper"" data-toggle=""tooltip"" data-html=""true"" data-placement=""bottom"" title=""Context: Longer-term data are needed to assess whether this initial difference in carbon sink potential persists over time. Notwithstanding, our results indicate that, due to their unique attributes, lianas have the potential to severely reduce both the carbon sink potential and long-term carbon storage capacity of tropical forests. While the strength of the liana effect will vary with the density and biomass of lianas, the increase in liana density, biomass, and productivity reported in many neotropical forests (9, 10, 23) may be partially responsible for the longterm decline in the Amazonian carbon sink , which in turn contributes to increasing atmospheric carbon dioxide levels and accelerated climate change.""><b>Finding C:</b></span> Notwithstanding, our results indicate that, due to their unique attributes, lianas have the potential to severely reduce both the carbon sink potential and long-term carbon storage capacity of tropical forests.<br><span id=""hover_text_news"" data-toggle=""tooltip"" data-html=""true"" data-placement=""bottom"" title=""Context: These patterns were highly variable among individuals of domesticated silkmoths but were largely constant in their wild ancestor group as well as in four other insect species. Compared to wild moths, domesticated silkmoths seem to have less ability to smell environmental odours with their antennae and to locate host plants due to several millennia in captivity. On the other side, perception of the female-produced attractant bombykol in Bombyx mori males is unabated, although it is not necessary anymore to find the females, as they are presented to the males by the breeders.""><b>Finding D:</b></span> Compared to wild moths, domesticated silkmoths seem to have less ability to smell environmental odours with their antennae and to locate host plants due to several millennia in captivity."
Medicine_tweet_181_p$Medicine_92_p$Medicine_240_r$Medicine_353_r	"<span id=""hover_text_paper"" data-toggle=""tooltip"" data-html=""true"" data-placement=""bottom"" title=""Context: Vitamin D supplementation during pregnancy with lower doses (≤2000 IU/d) was associated with a reduced risk of fetal and neonatal mortality. Vitamin D supplementation was associated with higher neonatal vitamin D status (bolus-or regular-dose supplement and early or late timing were equally effective in attaining improvement in vitamin D levels), higher calcium levels, higher Apgar scores, greater neonatal skinfold thickness, greater weight (at birth, 3 months, 6 months, 9 months, and 12 months), and greater height (at 3 months, 9 months, and 12 months) in the offspring. Timing of vitamin D supplementation affected birth weight.""><b>Finding A:</b></span> Vitamin D supplementation was associated with higher neonatal vitamin D status (bolus-or regular-dose supplement and early or late timing were equally effective in attaining improvement in vitamin D levels), higher calcium levels, higher Apgar scores, greater neonatal skinfold thickness, greater weight (at birth, 3 months, 6 months, 9 months, and 12 months), and greater height (at 3 months, 9 months, and 12 months) in the offspring.<br><span id=""hover_text_paper"" data-toggle=""tooltip"" data-html=""true"" data-placement=""bottom"" title=""Context: Performing oral sex increases the risk of oral HPV infection, and the risk increases with the number of partners. Awareness of this link between sexual behavior, oral HPV infection, and cancer may cause concern for patients who have HPV-positive OSCC and their partners. Strong associations are observed between sexual behavior, oral HPV infection, and oropharyngeal cancer.""><b>Finding B:</b></span> Awareness of this link between sexual behavior, oral HPV infection, and cancer may cause concern for patients who have HPV-positive OSCC and their partners.<br><span id=""hover_text_news"" data-toggle=""tooltip"" data-html=""true"" data-placement=""bottom"" title=""Context: ""The Society\'s recommendations allow physicians to make the diagnosis if clear symptoms are present without resorting to universal hormone tests or ultrasound screening."" In the CPG, The Endocrine Society recommends that a diagnosis be made if adult women have two of the three cardinal features of PCOS (diagnostic criteria supported by the NIH panel): * Excess production of male hormones called androgens. Other recommendations from the CPG include:\n\n* Because women with PCOS face an increased risk of pregnancy complications such as gestational diabetes, preterm delivery and preeclampsia that can be exacerbated by obesity, women should have their body mass index, blood pressure and oral glucose tolerance assessed prior to conceiving;\n\n* Following diagnosis, women with PCOS should be examined for skin and hair complications including excess hair growth and acne;\n\n* Although women with PCOS have some of the same risk factors associated with the development of endometrial cancer, they should not routinely undergo ultrasound screening for endometrial thickness;\n\n* To gauge metabolic risk, adolescents and adult women with PCOS should be screened for increased obesity using body mass index and waist circumference measurements;\n\n* Clinicians should give adolescents and adult women with PCOS an oral glucose tolerance test to check for type 2 diabetes or impaired glucose tolerance because they are at increased risk of these conditions; and\n\n* Initial treatment of type 2 diabetes or impaired glucose tolerance in women with PCOS should be diet and exercise, with metformin as a second-line therapy.""><b>Finding C:</b></span> Other recommendations from the CPG include:\n\n* Because women with PCOS face an increased risk of pregnancy complications such as gestational diabetes, preterm delivery and preeclampsia that can be exacerbated by obesity, women should have their body mass index, blood pressure and oral glucose tolerance assessed prior to conceiving;\n\n* Following diagnosis, women with PCOS should be examined for skin and hair complications including excess hair growth and acne;\n\n* Although women with PCOS have some of the same risk factors associated with the development of endometrial cancer, they should not routinely undergo ultrasound screening for endometrial thickness;\n\n* To gauge metabolic risk, adolescents and adult women with PCOS should be screened for increased obesity using body mass index and waist circumference measurements;\n\n* Clinicians should give adolescents and adult women with PCOS an oral glucose tolerance test to check for type 2 diabetes or impaired glucose tolerance because they are at increased risk of these conditions; and\n\n* Initial treatment of type 2 diabetes or impaired glucose tolerance in women with PCOS should be diet and exercise, with metformin as a second-line therapy.<br><span id=""hover_text_news"" data-toggle=""tooltip"" data-html=""true"" data-placement=""bottom"" title=""Context: Fragments of the \'missing\' digits can be found in the form of ridges on the backside of the splints."" According to the team, this demonstrates that the first and fifth digits were not simply lost to evolution, but attached to their neighboring second and fourth digits. ""With a distinct surface from the metacarpal, we know the splints on today\'s horses to be the remnants of the second and fourth digits,"" Professor Solounias said.""><b>Finding D:</b></span> According to the team, this demonstrates that the first and fifth digits were not simply lost to evolution, but attached to their neighboring second and fourth digits."
Medicine_42_r$Medicine_tweet_137_r$Medicine_tweet_105_p$Medicine_98_p	"<span id=""hover_text_news"" data-toggle=""tooltip"" data-html=""true"" data-placement=""bottom"" title=""Context: ""The data are really striking,"" said Gabrielle Nevitt, professor of neurobiology, physiology and behavior at UC Davis and co-author on the paper with graduate student Matthew Savoca. This suggests that marine top predators are important in climate regulation, although they are mostly left out of climate models, Nevitt said. ""In addition to studying how these marine top predators are responding to climate change, our data suggest that more attention should be focused on how ecological systems, themselves, impact climate.""><b>Finding A:</b></span> This suggests that marine top predators are important in climate regulation, although they are mostly left out of climate models, Nevitt said.<br><span id=""hover_text_news"" data-toggle=""tooltip"" data-html=""true"" data-placement=""bottom"" title=""Context: #climatechange expected to have negative impact on US electric grid  #climateandhealth #putkids1st #KidsEnvHealth""><b>Finding B:</b></span> #climatechange expected to have negative impact on US electric grid  #climateandhealth #putkids1st #KidsEnvHealth<br><span id=""hover_text_paper"" data-toggle=""tooltip"" data-html=""true"" data-placement=""bottom"" title=""Context: Instead, different people appear to be experiencing widely different health trajectories with widely different health outcomes at the same ages. Our findings suggest that the time has arrived to reconsider the importance of chronological age and to design better social policies to reflect the substantial variation in health trajectories across the life span. These findings have important implications for five policy issues surrounding aging.""><b>Finding C:</b></span> Our findings suggest that the time has arrived to reconsider the importance of chronological age and to design better social policies to reflect the substantial variation in health trajectories across the life span.<br><span id=""hover_text_paper"" data-toggle=""tooltip"" data-html=""true"" data-placement=""bottom"" title=""Context: Taking these observations into account, fundamental and clinical research studies are now required to investigate whether MSCs isolated from equine cadavers are suitable, abundant, and readily available to be used in future clinical applications. The present work is the first, in both animal and human, to show that tissues harvested from cadaveric ligaments up to 72 hours postmortem represent an available reservoir of specific stem cell populations. SLs were confirmed free of any damage following examination of the tissues both macroscopically and microscopically.""><b>Finding D:</b></span> The present work is the first, in both animal and human, to show that tissues harvested from cadaveric ligaments up to 72 hours postmortem represent an available reservoir of specific stem cell populations."
Medicine_239_r$Medicine_tweet_111_r$Medicine_70_p$Medicine_107_r	"<span id=""hover_text_news"" data-toggle=""tooltip"" data-html=""true"" data-placement=""bottom"" title=""Context: What they found was that the increases in vessel noises resulted in higher whistle frequencies with reductions in complexity. In other words, the dolphins whistled more, but with much less complexity. Analyzing the data, the researchers found that with background noise, the dolphins\' typically complex whistles essentially flatlined.""><b>Finding A:</b></span> In other words, the dolphins whistled more, but with much less complexity.<br><span id=""hover_text_news"" data-toggle=""tooltip"" data-html=""true"" data-placement=""bottom"" title=""Context: Feed &amp; satiety response in INFANTS linked to obesity in childhood, this is where prevention begins @username .""><b>Finding B:</b></span> Feed &amp; satiety response in INFANTS linked to obesity in childhood, this is where prevention begins @username .<br><span id=""hover_text_paper"" data-toggle=""tooltip"" data-html=""true"" data-placement=""bottom"" title=""Context: There was no clear evidence that subsequent to the problem of aluminium being highlighted in a previous publication in this journal that contamination had been addressed and reduced. It is the opinion of the authors that regulatory and other nonvoluntary methods are now required to reduce the aluminium content of infant formulas and thereby protect infants from chronic exposure to dietary aluminium. However, the range of values obtained was skewed towards high content and we were left to conclude that the aluminium content of infant formulas were too high, for example as compared to aluminium exposure through breast milk .""><b>Finding C:</b></span> It is the opinion of the authors that regulatory and other nonvoluntary methods are now required to reduce the aluminium content of infant formulas and thereby protect infants from chronic exposure to dietary aluminium.<br><span id=""hover_text_news"" data-toggle=""tooltip"" data-html=""true"" data-placement=""bottom"" title=""Context: ""The effect of RHDV disease virus on rabbits is enhanced by previous infection with MYXV virus. Survival rates were lowest for rabbits which survived MYXV infection and then were exposed to RHDV disease,"" says Dr Fordham from the University\'s Environment Institute. ""The findings suggest a continuous benefit from both viruses and maximum impact on rabbit numbers if they act together.""""><b>Finding D:</b></span> Survival rates were lowest for rabbits which survived MYXV infection and then were exposed to RHDV disease,"" says Dr Fordham from the University\'s Environment Institute."
Medicine_tweet_68_r$Medicine_tweet_88_r$Medicine_294_r$Medicine_214_r	"<span id=""hover_text_news"" data-toggle=""tooltip"" data-html=""true"" data-placement=""bottom"" title=""Context: #Vitamin D supplementation during #pregnancy may reduce the risk for underweight babies and fetal or infant mortality. ""><b>Finding A:</b></span> #Vitamin D supplementation during #pregnancy may reduce the risk for underweight babies and fetal or infant mortality. <br><span id=""hover_text_news"" data-toggle=""tooltip"" data-html=""true"" data-placement=""bottom"" title=""Context: Multi #omics analysis of individuals during periods of weight loss &amp; gain  #systemsbiology""><b>Finding B:</b></span> Multi #omics analysis of individuals during periods of weight loss &amp; gain  #systemsbiology<br><span id=""hover_text_news"" data-toggle=""tooltip"" data-html=""true"" data-placement=""bottom"" title=""Context: Study anticoagulant was discontinued because of bleeding in 242 patients (4.7 percent) in the otamixaban group and in 95 patients (1.7 percent) in the UFH-plus-eptifibatide group. ""Otamixaban did not reduce ischemic events compared with UFH plus eptifibatide but increased bleeding among patients with NSTE-ACS and a planned invasive strategy. These findings do not support the use of otamixaban for patients with NSTE-ACS undergoing planned early percutaneous coronary intervention,"" the authors conclude.""><b>Finding C:</b></span> These findings do not support the use of otamixaban for patients with NSTE-ACS undergoing planned early percutaneous coronary intervention,"" the authors conclude.<br><span id=""hover_text_news"" data-toggle=""tooltip"" data-html=""true"" data-placement=""bottom"" title=""Context: ""The Society\'s recommendations allow physicians to make the diagnosis if clear symptoms are present without resorting to universal hormone tests or ultrasound screening."" In the CPG, The Endocrine Society recommends that a diagnosis be made if adult women have two of the three cardinal features of PCOS (diagnostic criteria supported by the NIH panel): * Excess production of male hormones called androgens. Other recommendations from the CPG include:\n\n* Because women with PCOS face an increased risk of pregnancy complications such as gestational diabetes, preterm delivery and preeclampsia that can be exacerbated by obesity, women should have their body mass index, blood pressure and oral glucose tolerance assessed prior to conceiving;\n\n* Following diagnosis, women with PCOS should be examined for skin and hair complications including excess hair growth and acne;\n\n* Although women with PCOS have some of the same risk factors associated with the development of endometrial cancer, they should not routinely undergo ultrasound screening for endometrial thickness;\n\n* To gauge metabolic risk, adolescents and adult women with PCOS should be screened for increased obesity using body mass index and waist circumference measurements;\n\n* Clinicians should give adolescents and adult women with PCOS an oral glucose tolerance test to check for type 2 diabetes or impaired glucose tolerance because they are at increased risk of these conditions; and\n\n* Initial treatment of type 2 diabetes or impaired glucose tolerance in women with PCOS should be diet and exercise, with metformin as a second-line therapy.""><b>Finding D:</b></span> ""The Society\'s recommendations allow physicians to make the diagnosis if clear symptoms are present without resorting to universal hormone tests or ultrasound screening."""
