id	text
Medicine_401_p$Medicine_417_p$Medicine_87_p$Medicine_tweet_59_p	"<span id=""hover_text_paper"" data-toggle=""tooltip"" data-html=""true"" data-placement=""bottom"" title=""Context: Most staff reported positive care behaviours, but specific person-centred activities were sometimes infrequent. Many care home staff were never or almost never aware of a resident being taken out of the home for their enjoyment (34%, n = 520); or an activity planned around a resident\'s interests (5%, n = 234). 763 (5%; 95% Confidence Interval (CI) 47% to 54%) of care home staff reported carrying out or observing potentially abusive or neglectful behaviours at least sometimes in the preceding 3 months; some abuse was reported as happening ""at least sometimes"" in 9/92 care homes.""><b>Finding A:</b></span> Many care home staff were never or almost never aware of a resident being taken out of the home for their enjoyment (34%, n = 520); or an activity planned around a resident\'s interests (5%, n = 234).<br><span id=""hover_text_paper"" data-toggle=""tooltip"" data-html=""true"" data-placement=""bottom"" title=""Context: Further, pride is specific to audience valuation: Emotions that co-activate with pride, such as happiness and excitement, do not track audience valuation uniquely and reliably. This suggests that pride, rather than other positive emotions, is distinctively involved in social valuation. Further evidence to demonstrate domain-specificity is needed, however.""><b>Finding B:</b></span> This suggests that pride, rather than other positive emotions, is distinctively involved in social valuation.<br><span id=""hover_text_paper"" data-toggle=""tooltip"" data-html=""true"" data-placement=""bottom"" title=""Context: However, at least in this instance, it did not achieve the intended purpose of reducing consumption. Experiment 3a suggests that requiring participants to get their own refills alleviates the perverse effect of the free-refill response to a portion cap. Of 285 participants, 48.4% were male and 50.5% were female; 1.1% did not report their gender.""><b>Finding C:</b></span> Experiment 3a suggests that requiring participants to get their own refills alleviates the perverse effect of the free-refill response to a portion cap.<br><span id=""hover_text_paper"" data-toggle=""tooltip"" data-html=""true"" data-placement=""bottom"" title=""Context: The findings require confirmation in randomized clinical trials. Health care professionals should engage patients with severe obesity and type 2 diabetes in a shared decision making conversation about the potential role of bariatric surgery in the prevention of macrovascular events. [5] [6] [7] [8] [9] In comparison, patients who have bariatric surgery have better glycemic control and greater macrovascular risk factor reduction than those who get both intensive lifestyle and medical treatment combined.""><b>Finding D:</b></span> Health care professionals should engage patients with severe obesity and type 2 diabetes in a shared decision making conversation about the potential role of bariatric surgery in the prevention of macrovascular events."
Medicine_167_p$Medicine_tweet_157_r$Medicine_49_r$Medicine_tweet_68_p	"<span id=""hover_text_paper"" data-toggle=""tooltip"" data-html=""true"" data-placement=""bottom"" title=""Context: These findings further strengthen the concept that odor perception is influenced by cognitive interpretation. Furthermore, we found an impact of labels on intensity ratings for one of the administered odors that goes against our hypothesis. We found that participants rated geraniol as more intense when it was labeled positively (""fresh flowers"") than when labeled negatively (""cheap perfume"").""><b>Finding A:</b></span> Furthermore, we found an impact of labels on intensity ratings for one of the administered odors that goes against our hypothesis.<br><span id=""hover_text_news"" data-toggle=""tooltip"" data-html=""true"" data-placement=""bottom"" title=""Context: So excited about my recent publication in @username on a #VLP vaccine targeting #Alzheimers #publishorperish Check it out here: ""><b>Finding B:</b></span> So excited about my recent publication in @username on a #VLP vaccine targeting #Alzheimers #publishorperish Check it out here: <br><span id=""hover_text_news"" data-toggle=""tooltip"" data-html=""true"" data-placement=""bottom"" title=""Context: ""This is a good example of how the study of a rare genetic disease can reveal a pathway that plays a key role in human biology,"" says study co-senior author Benjamin Cravatt, professor and chair of the Department of Chemical Physiology at Scripps Research. The team found that in adult mice, reducing ABHD12 activity with the inhibitor led to a rise in lyso-PS in immune cells called macrophages, as well as in brain tissue. The rise wasn\'t as great as that seen in the ABHD12-knockout mice, and even four weeks of treatment with the inhibitor appeared to cause only slight hearing defects -- nothing like the profound defects experienced by PHARC patients.""><b>Finding C:</b></span> The team found that in adult mice, reducing ABHD12 activity with the inhibitor led to a rise in lyso-PS in immune cells called macrophages, as well as in brain tissue.<br><span id=""hover_text_paper"" data-toggle=""tooltip"" data-html=""true"" data-placement=""bottom"" title=""Context: We found that maternal vitamin D supplementation timing, dose, and administration method did not affect cord blood vitamin D concentration. Late vitamin D supplementation (initiation at ≥20 weeks\' gestation) improved birth weight, but early supplementation (initiation at <20 weeks\' gestation) did not. Most importantly, we found that the lower dose of vitamin D supplementation (≤2000 IU/d) reduced the risk of fetal or neonatal mortality and SGA, but the higher dose (>2000 IU/d) did not.""><b>Finding D:</b></span> Late vitamin D supplementation (initiation at ≥20 weeks\' gestation) improved birth weight, but early supplementation (initiation at <20 weeks\' gestation) did not."
Medicine_417_r$Medicine_tweet_52_r$Medicine_tweet_58_r$Medicine_tweet_123_r	"<span id=""hover_text_news"" data-toggle=""tooltip"" data-html=""true"" data-placement=""bottom"" title=""Context: This may explain why pride is a target of righteous indignation around the world. ""A careful mapping of this emotion suggests a different view, however,"" he continues. ""Pride appears to be an elegantly engineered emotion: It makes you pursue socially valued courses of action, and it facilitates the gains in esteem that make those actions worth pursuing.""""><b>Finding A:</b></span> ""Pride appears to be an elegantly engineered emotion: It makes you pursue socially valued courses of action, and it facilitates the gains in esteem that make those actions worth pursuing.""<br><span id=""hover_text_news"" data-toggle=""tooltip"" data-html=""true"" data-placement=""bottom"" title=""Context: Neonatal regulatory behavior problems are predicted by maternal early pregnancy overweight &amp; obesity\n\nA number of 3117 women of the PREDO Study filled in a questionnaire on regulatory behavior problems at the child’s mean age of 16.9 days \n\n""><b>Finding B:</b></span> Neonatal regulatory behavior problems are predicted by maternal early pregnancy overweight &amp; obesity\n\nA number of 3117 women of the PREDO Study filled in a questionnaire on regulatory behavior problems at the child’s mean age of 16.9 days \n\n<br><span id=""hover_text_news"" data-toggle=""tooltip"" data-html=""true"" data-placement=""bottom"" title=""Context: A prospective study of cerebral, frontal &amp; temporal lobe volumes &amp; neuropsychol performance in children w cranial RT ""><b>Finding C:</b></span> A prospective study of cerebral, frontal &amp; temporal lobe volumes &amp; neuropsychol performance in children w cranial RT <br><span id=""hover_text_news"" data-toggle=""tooltip"" data-html=""true"" data-placement=""bottom"" title=""Context: New study ( prenatal exposure to glucucorticoids or smoking raise adult daughters\' nicotine dependence but not sons\'""><b>Finding D:</b></span> New study ( prenatal exposure to glucucorticoids or smoking raise adult daughters\' nicotine dependence but not sons\"
Medicine_29_p$Medicine_425_p$Medicine_tweet_151_r$Medicine_tweet_31_r	"<span id=""hover_text_paper"" data-toggle=""tooltip"" data-html=""true"" data-placement=""bottom"" title=""Context: In spite of its limitations, the present findings reveal indicators that may be useful for identifying children and adolescents at greater risk of psychiatric hospitalization as well as offer potential targets for individual and family intervention aimed at reducing the likelihood of requiring acute psychiatric services. Our results underscore the importance of a multi-disciplinary approach to the assessment and treatment of children and adolescents with ASD that addresses behavioral, psychological/ psychiatric, adaptive, sleep, and medical functioning in order to decrease behavioral crises and the utilization of inpatient psychiatric services. Furthermore, our findings highlight the need to consider the child\'s functioning in the context of family resources and needs during assessment and treatment, and to provide adequate supports for caregivers.""><b>Finding A:</b></span> Our results underscore the importance of a multi-disciplinary approach to the assessment and treatment of children and adolescents with ASD that addresses behavioral, psychological/ psychiatric, adaptive, sleep, and medical functioning in order to decrease behavioral crises and the utilization of inpatient psychiatric services.<br><span id=""hover_text_paper"" data-toggle=""tooltip"" data-html=""true"" data-placement=""bottom"" title=""Context: Post-diagnostic intakes of mayonnaise and margarine were not associated with risk of lethal prostate cancer or all-cause mortality. In this prospective analysis, vegetable fat intake after diagnosis was associated with a lower risk of lethal prostate cancer and all-cause mortality. Among 525 Swedish men, marine fatty acids were associated with lower risk of prostate cancer death (events: 222; HR Q4 v. Q1: 0.5; 5% CI: 0.40, 0.87) and, among the men diagnosed with localized disease (46 events), myristic acid and shortchain saturated fatty acids were associated with higher risk of prostate cancer death (HR Q4 v Q1: 2.3; 5% CI: 1.06, 5.38 and HR Q4 v. Q1: 2.88; 5% CI: 1.24, 6.67, respectively).""><b>Finding B:</b></span> In this prospective analysis, vegetable fat intake after diagnosis was associated with a lower risk of lethal prostate cancer and all-cause mortality.<br><span id=""hover_text_news"" data-toggle=""tooltip"" data-html=""true"" data-placement=""bottom"" title=""Context: New DSM-V categories for alcohol use disorders could allow for better targeting of treatment ""><b>Finding C:</b></span> New DSM-V categories for alcohol use disorders could allow for better targeting of treatment <br><span id=""hover_text_news"" data-toggle=""tooltip"" data-html=""true"" data-placement=""bottom"" title=""Context: Screening fails to lower breast cancer mortality statistics: ""><b>Finding D:</b></span> Screening fails to lower breast cancer mortality statistics: "
Medicine_tweet_69_p$Medicine_tweet_7_r$Medicine_tweet_28_p$Medicine_tweet_181_r	"<span id=""hover_text_paper"" data-toggle=""tooltip"" data-html=""true"" data-placement=""bottom"" title=""Context: The ambient noise environment could also affect vocal learning, as young animals exposed to elevated noise may hear adjusted calls from conspecifics . In addition to modifying the shape, dolphin whistles were also higher frequency during increased broadband and 2.5 kHz TOL ambient noise immediately prior to the call. Increased low-frequency ambient noise may be causing dolphins to change their vocalization behaviour to avoid or compensate for masking.""><b>Finding A:</b></span> In addition to modifying the shape, dolphin whistles were also higher frequency during increased broadband and 2.5 kHz TOL ambient noise immediately prior to the call.<br><span id=""hover_text_news"" data-toggle=""tooltip"" data-html=""true"" data-placement=""bottom"" title=""Context: High School Students’ Use of Electronic Cigarettes to Vaporize Cannabis\nMorean PhD, Kong PhD et alPediatrics Oct 2015 ""><b>Finding B:</b></span> High School Students’ Use of Electronic Cigarettes to Vaporize Cannabis\nMorean PhD, Kong PhD et alPediatrics Oct 2015 <br><span id=""hover_text_paper"" data-toggle=""tooltip"" data-html=""true"" data-placement=""bottom"" title=""Context: It should be noted that the authors report a skewed study population with regard to low socioeconomic position . They found a J-shaped association between frequency of drinking and IQ test results, where the daily drinkers had the lowest IQ. A higher IQ was associated with being a rare, an occasional, and a moderate drinker, whereas there was a lower IQ for being a former drinker compared with being a lifetime abstainer.""><b>Finding C:</b></span> They found a J-shaped association between frequency of drinking and IQ test results, where the daily drinkers had the lowest IQ.<br><span id=""hover_text_news"" data-toggle=""tooltip"" data-html=""true"" data-placement=""bottom"" title=""Context: ""Question  Is vitamin D supplementation during pregnancy beneficial and safe for offspring?""  Answer: pretty much, yes. And some editorial comments:  and some other \'possible\' links... ""><b>Finding D:</b></span> ""Question  Is vitamin D supplementation during pregnancy beneficial and safe for offspring?""  Answer: pretty much, yes. And some editorial comments:  and some other \'possible\' links... "
Medicine_tweet_13_r$Medicine_tweet_18_r$Medicine_tweet_2_p$Medicine_tweet_47_r	"<span id=""hover_text_news"" data-toggle=""tooltip"" data-html=""true"" data-placement=""bottom"" title=""Context: Diagnosis and treatment of #oralcancer are assoc w/ changes in sexual behavior, regardless of tumor #HPV status  ""><b>Finding A:</b></span> Diagnosis and treatment of #oralcancer are assoc w/ changes in sexual behavior, regardless of tumor #HPV status  <br><span id=""hover_text_news"" data-toggle=""tooltip"" data-html=""true"" data-placement=""bottom"" title=""Context:  | Jurology | Emotional distress increases the likelihood of receiving surgery among men with localized prostate ca…""><b>Finding B:</b></span>  | Jurology | Emotional distress increases the likelihood of receiving surgery among men with localized prostate ca…<br><span id=""hover_text_paper"" data-toggle=""tooltip"" data-html=""true"" data-placement=""bottom"" title=""Context: Fourth, as with all observational studies, it was not possible to rule out residual confounding. In this long-term prospective cohort study, diet quality assessed during midlife was not significantly associated with subsequent risk for dementia. The validity and reliability of this version of the FFQ in terms of nutrient and food consumption has been documented in detail both in this cohort and in another independent study in the United Kingdom.""><b>Finding C:</b></span> In this long-term prospective cohort study, diet quality assessed during midlife was not significantly associated with subsequent risk for dementia.<br><span id=""hover_text_news"" data-toggle=""tooltip"" data-html=""true"" data-placement=""bottom"" title=""Context: Bed bugs evolved unique adaptive strategy to resist pyrethroid ...: Recent advances in genomic and post-genomi... ""><b>Finding D:</b></span> Bed bugs evolved unique adaptive strategy to resist pyrethroid ...: Recent advances in genomic and post-genomi... "
Medicine_420_p$Medicine_tweet_61_r$Medicine_418_p$Medicine_86_r	"<span id=""hover_text_paper"" data-toggle=""tooltip"" data-html=""true"" data-placement=""bottom"" title=""Context: Conversely, determination in peripheral blood mononuclear cells of histone-deacetylase1 mRNA as \'umbrella mediator\' of epigenetic processes revealed an increase in the high-risk group, suggesting lasting epigenetic alterations. Together, we provide sound evidence of a disease-independent unfortunate relationship between well-defined pre-adult environmental hits and violent aggression, calling for more efficient prevention. Moreover, these environmental risk factors seem to contribute to abnormal behavior and to severity and onset of mental illness [1] , even though different risk factors may have different impact, dependent on the particular neuropsychiatric disease in focus.""><b>Finding A:</b></span> Together, we provide sound evidence of a disease-independent unfortunate relationship between well-defined pre-adult environmental hits and violent aggression, calling for more efficient prevention.<br><span id=""hover_text_news"" data-toggle=""tooltip"" data-html=""true"" data-placement=""bottom"" title=""Context: Consumption of #processed #meat may increase risk of #breast #cancer ""><b>Finding B:</b></span> Consumption of #processed #meat may increase risk of #breast #cancer <br><span id=""hover_text_paper"" data-toggle=""tooltip"" data-html=""true"" data-placement=""bottom"" title=""Context: Our results also confirm that overweight dogs, as opposed to normal weight dogs, tried to maximize food intake from the higher quality food and hesitated to do the task when the food reward was uncertain. These results are very similar to those expected from the parallel models that exist between certain personality traits and being overweight in humans, suggesting that dogs are indeed a promising model for experimentally investigating obesity in humans. Dogs, due to their shared living environment with humans, may provide a beneficial model to study the causes and consequences of obesity.""><b>Finding C:</b></span> These results are very similar to those expected from the parallel models that exist between certain personality traits and being overweight in humans, suggesting that dogs are indeed a promising model for experimentally investigating obesity in humans.<br><span id=""hover_text_news"" data-toggle=""tooltip"" data-html=""true"" data-placement=""bottom"" title=""Context: ""Because prostate cancer is so common, 7 percent is a significant number. The fact that immune checkpoint inhibitors may be effective against this sub-type of prostate cancer makes it even more significant. This is an exciting prospect for patients who have CDK12 alterations and may benefit from immunotherapy,"" says senior study author Arul Chinnaiyan, M.D., Ph.D., director of the Michigan Center for Translational Pathology.""><b>Finding D:</b></span> The fact that immune checkpoint inhibitors may be effective against this sub-type of prostate cancer makes it even more significant."
Medicine_30_r$Medicine_461_r$Medicine_353_p$Medicine_tweet_50_p	"<span id=""hover_text_news"" data-toggle=""tooltip"" data-html=""true"" data-placement=""bottom"" title=""Context: That underlines how important it is not to start doing this until you\'ve chatted to your doctor about it. With a daily aspirin, 57 rather than 61 people per 10,000 would be expected to suffer a heart attack or stroke; at the same time, 23 rather than 16 people per 10,000 would experience severe bleeding, on average. ""This seriously questions whether people who have not previously had heart attacks or strokes should be taking aspirin with the aim of reducing future cardiovascular events,"" Zheng told Lisa Rapaport at Reuters.""><b>Finding A:</b></span> With a daily aspirin, 57 rather than 61 people per 10,000 would be expected to suffer a heart attack or stroke; at the same time, 23 rather than 16 people per 10,000 would experience severe bleeding, on average.<br><span id=""hover_text_news"" data-toggle=""tooltip"" data-html=""true"" data-placement=""bottom"" title=""Context: Early detection reduces the risk of being diagnosed with an advanced cancer that is often deadly. If the program is successful, these rates should fall over time, indicating that mammography screening is contributing effectively to reducing breast cancer mortality. Moreover, with increased screening, more rapid and more pronounced falls in breast cancer mortality would be expected in countries that implemented mammography screening program at end of the 1980s than in countries that implemented programs 10 to 15 years later.""><b>Finding B:</b></span> If the program is successful, these rates should fall over time, indicating that mammography screening is contributing effectively to reducing breast cancer mortality.<br><span id=""hover_text_paper"" data-toggle=""tooltip"" data-html=""true"" data-placement=""bottom"" title=""Context: The splint metacarpals, previously interpreted as reduced digits II and IV, also contain remnants of digits I and V compressed as ridges onto the ventral surface. Our proposed locations of the proximal metacarpals are confirmed by their carpal articulations, which are consistent with those of the pentadactyl Phenacodus. The tridactyl equid Mesohippus shares the ventral ridges on the side digit bones, many of which appear to have a distinct fusion line, and exhibits a lesser degree of digit reduction than previously thought.""><b>Finding C:</b></span> Our proposed locations of the proximal metacarpals are confirmed by their carpal articulations, which are consistent with those of the pentadactyl Phenacodus.<br><span id=""hover_text_paper"" data-toggle=""tooltip"" data-html=""true"" data-placement=""bottom"" title=""Context: Longer-term data are needed to assess whether this initial difference in carbon sink potential persists over time. Notwithstanding, our results indicate that, due to their unique attributes, lianas have the potential to severely reduce both the carbon sink potential and long-term carbon storage capacity of tropical forests. While the strength of the liana effect will vary with the density and biomass of lianas, the increase in liana density, biomass, and productivity reported in many neotropical forests (9, 10, 23) may be partially responsible for the longterm decline in the Amazonian carbon sink , which in turn contributes to increasing atmospheric carbon dioxide levels and accelerated climate change.""><b>Finding D:</b></span> Notwithstanding, our results indicate that, due to their unique attributes, lianas have the potential to severely reduce both the carbon sink potential and long-term carbon storage capacity of tropical forests."
