id	text
Medicine_239_p$Medicine_4_r$Medicine_440_p$Medicine_tweet_162_p	"<span id=""hover_text_paper"" data-toggle=""tooltip"" data-html=""true"" data-placement=""bottom"" title=""Context: The ambient noise environment could also affect vocal learning, as young animals exposed to elevated noise may hear adjusted calls from conspecifics . In addition to modifying the shape, dolphin whistles were also higher frequency during increased broadband and 2.5 kHz TOL ambient noise immediately prior to the call. Increased low-frequency ambient noise may be causing dolphins to change their vocalization behaviour to avoid or compensate for masking.""><b>Finding A:</b></span> In addition to modifying the shape, dolphin whistles were also higher frequency during increased broadband and 2.5 kHz TOL ambient noise immediately prior to the call.<br><span id=""hover_text_news"" data-toggle=""tooltip"" data-html=""true"" data-placement=""bottom"" title=""Context: Cette etude montre que, si les incidents cardiovasculaires peuvent etre reduits chez ces patients, les avantages sont confrontes a un plus grand risque d\'incidents hemorragiques majeurs. >>\n\nLe Dr. Zheng a explique que l\'usage de l\'aspirine devrait donner lieu a une discussion entre les patients et les medecins, et leur preciser que toute amelioration de leur sante cardiovasculaire, meme minime, implique << un reel risque d\'hemorragie grave >>. Certains des participants prenaient de l\'aspirine tandis que d\'autres avaient un placebo ou rien du tout.""><b>Finding B:</b></span> >>\n\nLe Dr. Zheng a explique que l\'usage de l\'aspirine devrait donner lieu a une discussion entre les patients et les medecins, et leur preciser que toute amelioration de leur sante cardiovasculaire, meme minime, implique << un reel risque d\'hemorragie grave >>.<br><span id=""hover_text_paper"" data-toggle=""tooltip"" data-html=""true"" data-placement=""bottom"" title=""Context: Even for a compact genome such as Drosophila melanogaster, at least 30% of enhancer-promoter interactions occur over 20 kb, and in many cases over intervening genes . We show that sustained proximity of the enhancer to its target is required for activation. Transcription in turn affects the three-dimensional topology as it enhances the temporal stability of the proximal conformation and is associated with further spatial compaction.""><b>Finding C:</b></span> We show that sustained proximity of the enhancer to its target is required for activation.<br><span id=""hover_text_paper"" data-toggle=""tooltip"" data-html=""true"" data-placement=""bottom"" title=""Context: Thus, consumption of fish rich in 16:4(n-3) enhanced plasma levels of this PIFA. Herein we show that fish oil contains substantial levels of 16: 4(n-3), a fatty acid with potent chemotherapy-negating effects in preclinical models, and that intake of low doses of fish As can be seen by the quantities of 16:4(n-3) contained in the ingested fish portions (shown in parentheses in the panel labels), mackerel and herring contained high levels, and salmon and tuna contained low levels. oil interferes with chemotherapy activity in mice.""><b>Finding D:</b></span> Herein we show that fish oil contains substantial levels of 16: 4(n-3), a fatty acid with potent chemotherapy-negating effects in preclinical models, and that intake of low doses of fish As can be seen by the quantities of 16:4(n-3) contained in the ingested fish portions (shown in parentheses in the panel labels), mackerel and herring contained high levels, and salmon and tuna contained low levels."
Medicine_174_p$Medicine_tweet_27_p$Medicine_tweet_79_p$Medicine_24_r	"<span id=""hover_text_paper"" data-toggle=""tooltip"" data-html=""true"" data-placement=""bottom"" title=""Context: Cholesterol binding appears to modulate CD81 activity in cells, suggesting a potential mechanism for regulation of tetraspanin function. The tetraspanin CD81 contains a large intramembrane cavity occupied by cholesterol, indicating the potential for functional modulation by small molecules. The development of specialized cell-cell interactions and new cell types likely selected for the duplication and differentiation of tetraspanins that evolved to effect specific functions.""><b>Finding A:</b></span> The tetraspanin CD81 contains a large intramembrane cavity occupied by cholesterol, indicating the potential for functional modulation by small molecules.<br><span id=""hover_text_paper"" data-toggle=""tooltip"" data-html=""true"" data-placement=""bottom"" title=""Context: We found 3 out of 24 (12.5%) fear-selective cells and 5 out of 17 (29.4%) happyselective cells are also whole-face-selective, a ratio of whole-face cells similar to that found in the entire population (36 out of 185, 19.5%). This suggests that amygdala neurons encode whole-face information and emotion independently. We found that face information conveyed by the eyes, but not the mouth region, modulated emotion-selective neuronal responses.""><b>Finding B:</b></span> This suggests that amygdala neurons encode whole-face information and emotion independently.<br><span id=""hover_text_paper"" data-toggle=""tooltip"" data-html=""true"" data-placement=""bottom"" title=""Context: Hence, 2.3 years (CR, 1.8-2.5) or 30% (CR, 23%-32%) of improved life expectancy for men is projected to be associated with tobacco control. In women, life expectancy at age 40 years increased 5.4 years (from 37.4 to 42.7 years), but without tobacco control, it would have been projected to increase by only 3.8 years (from 37.3 to 41.2 years). Tobacco control appears to be associated with 1.6 years (CR, 1.4-1.7) of the improvement in life expectancy for women or 29% (CR, 25%-32%) of the gain.""><b>Finding C:</b></span> In women, life expectancy at age 40 years increased 5.4 years (from 37.4 to 42.7 years), but without tobacco control, it would have been projected to increase by only 3.8 years (from 37.3 to 41.2 years).<br><span id=""hover_text_news"" data-toggle=""tooltip"" data-html=""true"" data-placement=""bottom"" title=""Context: Those with inadequate FHL had the following when compared with those with sufficient FHL:Health-related quality of life, as measured by the EuroQol-visual analog scale, also revealed poorer outcomes for those with inadequate FHL; this group had worse scores for physical function, vitality, social functioning, and mental health. ""Our results suggest that functional health literacy can now also be included as an influencing factor for the quality of postoperative recovery,"" wrote the authors, who added that FHL should be considered a relevant factor in considering how to best optimize recovery for patients undergoing day surgery.In a linked commentary Jesse P Wright, MD; Kelvin Moses, MD, PhD; and Kamran Idrees, MD, MSCI, MMHC, wrote that ""we question if patients are able to equally discern the difference in the questioning in the quality of recovery and [quality of life] questionnaires"" used in the study, but said that ""The findings in this ambulatory setting mirror findings by our group where we reported an association of low health literacy with various postoperative metrics, including increased hospital length of stay and use of discharge resources in patients undergoing surgical procedures. ""The commentary\'s authors say that investment in development of validated tools to measure FHL will generate the empirical data necessary to develop and use appropriate health literacy interventions.1.""><b>Finding D:</b></span> ""Our results suggest that functional health literacy can now also be included as an influencing factor for the quality of postoperative recovery,"" wrote the authors, who added that FHL should be considered a relevant factor in considering how to best optimize recovery for patients undergoing day surgery.In a linked commentary Jesse P Wright, MD; Kelvin Moses, MD, PhD; and Kamran Idrees, MD, MSCI, MMHC, wrote that ""we question if patients are able to equally discern the difference in the questioning in the quality of recovery and [quality of life] questionnaires"" used in the study, but said that ""The findings in this ambulatory setting mirror findings by our group where we reported an association of low health literacy with various postoperative metrics, including increased hospital length of stay and use of discharge resources in patients undergoing surgical procedures."
Medicine_tweet_161_r$Medicine_tweet_159_r$Medicine_tweet_74_p$Medicine_434_r	"<span id=""hover_text_news"" data-toggle=""tooltip"" data-html=""true"" data-placement=""bottom"" title=""Context: How mothers of kids w #obesity limit their intake of junk food.\nProud of this work with @username @username . @username ""><b>Finding A:</b></span> How mothers of kids w #obesity limit their intake of junk food.\nProud of this work with @username @username . @username <br><span id=""hover_text_news"" data-toggle=""tooltip"" data-html=""true"" data-placement=""bottom"" title=""Context: P. gingivalis linked to esophageal cancer. ""><b>Finding B:</b></span> P. gingivalis linked to esophageal cancer. <br><span id=""hover_text_paper"" data-toggle=""tooltip"" data-html=""true"" data-placement=""bottom"" title=""Context: This approach may be particularly important for parents of overweight or obese adolescents. This study builds on recent research focusing on fathers and their role in adolescent eating disorders treatment 32, [41] [42] [43] and finds that adolescents whose fathers engaged in weight conversations were significantly more likely to engage in dieting and UWCBs than adolescents whose fathers did not. Thus, it may be important to educate fathers to avoid any form of weight-related conversations with their adolescents.""><b>Finding C:</b></span> This study builds on recent research focusing on fathers and their role in adolescent eating disorders treatment 32, [41] [42] [43] and finds that adolescents whose fathers engaged in weight conversations were significantly more likely to engage in dieting and UWCBs than adolescents whose fathers did not.<br><span id=""hover_text_news"" data-toggle=""tooltip"" data-html=""true"" data-placement=""bottom"" title=""Context: ""It could be the other way around for a minority of individuals, that is, when exposure to alcohol has led to cognitive impairment, but this is less likely to be found among young persons of course."" ""We found that lower results on IQ tests in Swedish adolescent men are associated with a higher consumption of alcohol, measured in both terms of total intake and binge drinking,"" said Sjolund. ""It may be that a higher IQ results in healthier lifestyle choices.""><b>Finding D:</b></span> ""We found that lower results on IQ tests in Swedish adolescent men are associated with a higher consumption of alcohol, measured in both terms of total intake and binge drinking,"" said Sjolund."
Medicine_117_p$Medicine_tweet_183_r$Medicine_340_p$Medicine_tweet_111_p	"<span id=""hover_text_paper"" data-toggle=""tooltip"" data-html=""true"" data-placement=""bottom"" title=""Context: Importantly, we observe that happiness increases before birth, suggesting that the happiness gain around the time of birth may capture not only the effect of the birth but also the complex childbearing process that may involve partnership formation, partnership quality, and increased sexual activity. We then analyze the patterns for different socioeconomic groups and parities and show that the changes in subjective well-being over the transition to parenthood are highly consistent with the low and late fertility behavior that has emerged during the second demographic transition: older parents and those with more socioeconomic resources have the strongest happiness gains around the time of birth, and the temporary happiness gain around the time of birth declines with the number of children that one already has. These results were similar in Britain and Germany.""><b>Finding A:</b></span> We then analyze the patterns for different socioeconomic groups and parities and show that the changes in subjective well-being over the transition to parenthood are highly consistent with the low and late fertility behavior that has emerged during the second demographic transition: older parents and those with more socioeconomic resources have the strongest happiness gains around the time of birth, and the temporary happiness gain around the time of birth declines with the number of children that one already has.<br><span id=""hover_text_news"" data-toggle=""tooltip"" data-html=""true"" data-placement=""bottom"" title=""Context: Use of #antipsychotic meds increased among teens &amp; young adults from 2006-2010 but not among kids 12 or younger. ""><b>Finding B:</b></span> Use of #antipsychotic meds increased among teens &amp; young adults from 2006-2010 but not among kids 12 or younger. <br><span id=""hover_text_paper"" data-toggle=""tooltip"" data-html=""true"" data-placement=""bottom"" title=""Context: As the most enriched values exceed the geogenic range, the observed isotopic signatures cannot be explained by a mixture of biogenic and geogenic methane (Fig. Extensive potential for methanotrophic activity, as evidenced through the incubation of sediments under oxidizing conditions (see Supplementary Fig. S2 ), likely explains the isotopic fractionation trajectory away from the microbial end member signature.""><b>Finding C:</b></span> Extensive potential for methanotrophic activity, as evidenced through the incubation of sediments under oxidizing conditions (see Supplementary Fig.<br><span id=""hover_text_paper"" data-toggle=""tooltip"" data-html=""true"" data-placement=""bottom"" title=""Context: 25 Our findings indicate that within the same family the sibling with the higher appetite grows faster than the sibling with the lower appetite. Similar patterns are to be expected in the wider population; therefore, this study corroborates the hypothesis that a hearty appetite in infancy is a risk factor for faster weight gain. Our study has several strengths.""><b>Finding D:</b></span> Similar patterns are to be expected in the wider population; therefore, this study corroborates the hypothesis that a hearty appetite in infancy is a risk factor for faster weight gain."
Medicine_104_r$Medicine_46_r$Medicine_122_p$Medicine_400_r	"<span id=""hover_text_news"" data-toggle=""tooltip"" data-html=""true"" data-placement=""bottom"" title=""Context: On evenings when using light-emitting tablets, participants\' self-selected bedtimes were on average half an hour later, and they showed suppressed melatonin levels, delayed timing of melatonin secretion onset, and later sleep onset. When using the tablets, participants rated themselves as less sleepy in the evenings and less alert in the first hour after awakening on the following mornings. ""These findings provide more evidence that light-emitting electronic devices have biological effects,"" said co-author Dr. Jeanne Duffy, of Brigham and Women\'s Hospital and Harvard Medical School.""><b>Finding A:</b></span> On evenings when using light-emitting tablets, participants\' self-selected bedtimes were on average half an hour later, and they showed suppressed melatonin levels, delayed timing of melatonin secretion onset, and later sleep onset.<br><span id=""hover_text_news"" data-toggle=""tooltip"" data-html=""true"" data-placement=""bottom"" title=""Context: Compared to those who didn\'t take aspirin, aspirin use was associated with a 43 percent increase of major bleeding events. In other words, researchers wrote, approximately one in 200 people treated with aspirin would experience significant bleeding. To prevent a single heart attack, stroke or cardiovascular death, approximately 250 patients needed to be treated with the drug for five years.""><b>Finding B:</b></span> In other words, researchers wrote, approximately one in 200 people treated with aspirin would experience significant bleeding.<br><span id=""hover_text_paper"" data-toggle=""tooltip"" data-html=""true"" data-placement=""bottom"" title=""Context: Our results provide strong initial evidence that these alterations arise from delays in typical maturational patterns. Our results invite further investigation into the neurobiological mechanisms in ADHD that produce delays in development of large-scale networks. We found significant and specific maturational lag in connections within default mode network (DMN) and in DMN interconnections with two task positive networks (TPNs): frontoparietal network and ventral attention network.""><b>Finding C:</b></span> Our results invite further investigation into the neurobiological mechanisms in ADHD that produce delays in development of large-scale networks.<br><span id=""hover_text_news"" data-toggle=""tooltip"" data-html=""true"" data-placement=""bottom"" title=""Context: Among the 188 participants, 66 percent reported having received food stamps, 58 percent reported housing instability (either being thrown out of their house or running away from home), 52 percent reported living in neighborhoods with poor quality (living on a street with abandoned homes or apartments; buildings with broken windows; and/or homes with bars on the windows and doors) and 27 percent indicated gang involvement. Low levels of self-esteem and poor emotional processing skills were significantly correlated with gang involvement, as were low levels of parental monitoring, poor parental communication and housing instability. ""Adolescents who have strained relationships with positive family and community members and have displaced housing may find a sense of belonging with gangs,"" Voisin said.""><b>Finding D:</b></span> Low levels of self-esteem and poor emotional processing skills were significantly correlated with gang involvement, as were low levels of parental monitoring, poor parental communication and housing instability."
Medicine_tweet_136_p$Medicine_15_r$Medicine_tweet_40_p$Medicine_tweet_11_p	"<span id=""hover_text_paper"" data-toggle=""tooltip"" data-html=""true"" data-placement=""bottom"" title=""Context: Findings In this population-based cohort study of 132 256 births, maternal exposure to nitric oxide during pregnancy was associated with increased risk of autism spectrum disorder in offspring. Meaning Reducing exposures of pregnant women to environmental nitric oxide may be associated with a reduction in autism spectrum disorder incidence in their children. The use of LUR models provides greater spatial resolution and the ability to capture small-scale, localized variation compared with reliance on air-quality monitoring data alone.""><b>Finding A:</b></span> Meaning Reducing exposures of pregnant women to environmental nitric oxide may be associated with a reduction in autism spectrum disorder incidence in their children.<br><span id=""hover_text_news"" data-toggle=""tooltip"" data-html=""true"" data-placement=""bottom"" title=""Context: The development of a reliable method that enables the perfect alignment of molecules or molecular assemblies on a graphene surface may lead the way to tune the electric properties of graphene, and to improve the performance of graphene-based electronic devices. An AFM height image recorded 1 hour after SDS injection showed random unevenness on the surface, which indicates random adsorption of SDS molecules on the graphene surface. After 15 minutes of intense AFM scanning, the SDS adsorption morphology drastically changed and many ribbon-like molecules were observed.""><b>Finding B:</b></span> An AFM height image recorded 1 hour after SDS injection showed random unevenness on the surface, which indicates random adsorption of SDS molecules on the graphene surface.<br><span id=""hover_text_paper"" data-toggle=""tooltip"" data-html=""true"" data-placement=""bottom"" title=""Context: CONCLUSIONS AND RELEVANCE Inadequate FHL in patients undergoing day surgery was associated with poorer postoperative recovery and a lower health-related quality of life. Health literacy is a relevant factor to consider for optimizing the postoperative recovery in patients undergoing day surgery. 6 Considering this, the association between FHL and postoperative recovery in patients undergoing day surgery needs to be assessed.""><b>Finding C:</b></span> Health literacy is a relevant factor to consider for optimizing the postoperative recovery in patients undergoing day surgery.<br><span id=""hover_text_paper"" data-toggle=""tooltip"" data-html=""true"" data-placement=""bottom"" title=""Context: Such an alignment may be predicted by the classic view of sexual differentiation of the brain, according to which masculinization and defeminization of the brain are under the sole influence of testosterone (9). Here we show that, although there are sex/gender differences in brain and behavior, humans and human brains are comprised of unique ""mosaics"" of features, some more common in females compared with males, some more common in males compared with females, and some common in both females and males. Our results demonstrate that regardless of the cause of observed sex/gender differences in brain and behavior (nature or nurture), human brains cannot be categorized into two distinct classes: male brain/female brain.""><b>Finding D:</b></span> Here we show that, although there are sex/gender differences in brain and behavior, humans and human brains are comprised of unique ""mosaics"" of features, some more common in females compared with males, some more common in males compared with females, and some common in both females and males."
Medicine_tweet_15_p$Medicine_21_r$Medicine_79_p$Medicine_465_r	"<span id=""hover_text_paper"" data-toggle=""tooltip"" data-html=""true"" data-placement=""bottom"" title=""Context: There was no evidence of effect modification by race, GD, or parity. This study provides longitudinal biochemical evidence that lactation duration is independently associated with lower incidence of diabetes. Further investigation is required to elucidate mechanisms that may explain this relationship.""><b>Finding A:</b></span> This study provides longitudinal biochemical evidence that lactation duration is independently associated with lower incidence of diabetes.<br><span id=""hover_text_news"" data-toggle=""tooltip"" data-html=""true"" data-placement=""bottom"" title=""Context: ""With the New Zealand Index, we can predict from late summer the likelihood of above- or below-normal winter precipitation in the southwestern U.S., with a correlation in the order of 0.7 -- compared to the El Nino-Southern Oscillation technique, which has a correlation around 0.3 to 0.4,"" said lead author Antonios Mamalakis, a UCI graduate student in civil & environmental engineering. ""Our research also shows an amplification of this newly discovered teleconnection over the past four decades."" Mamalakis said the unexpected result was the discovery of persistent sea surface temperature and atmospheric pressure patterns in the southwestern Pacific Ocean that exhibited a strong correlation with precipitation in Southern California, Nevada, Arizona and Utah.""><b>Finding B:</b></span> ""Our research also shows an amplification of this newly discovered teleconnection over the past four decades.""<br><span id=""hover_text_paper"" data-toggle=""tooltip"" data-html=""true"" data-placement=""bottom"" title=""Context: CONCLUSIONS AND RELEVANCE Vitamin D supplementation during pregnancy is associated with a reduced risk of SGA and improved infant growth without risk of fetal or neonatal mortality or congenital abnormality. Vitamin D supplementation with doses of 2000 IU/d or lower during pregnancy may reduce the risk of fetal or neonatal mortality. Low vitamin D level status during pregnancy may expose the offspring to a suboptimal nutritional environment during critical phases of fetal development and may have long-term effects on offspring health outcomes.""><b>Finding C:</b></span> Vitamin D supplementation with doses of 2000 IU/d or lower during pregnancy may reduce the risk of fetal or neonatal mortality.<br><span id=""hover_text_news"" data-toggle=""tooltip"" data-html=""true"" data-placement=""bottom"" title=""Context: In the context of drug delivery, this platform is considered \'drug-agnostic,\' which simply means the same membrane technology can be used for a wide spectrum of drugs, and just the size of the channel is what needs to be customized. The results of this study provide new insight into the channel function. Upon putting them to the test, however, they discovered intriguing, unexpected molecular behavior in these channels.""><b>Finding D:</b></span> The results of this study provide new insight into the channel function."
